id,release_date,original_title,title,budget,revenue,runtime,popularity,vote_average,vote_count,adult,belongs_to_collection,genres,production_companies,spoken_languages,status,tagline,overview,imdb_id,production_countries,original_language
37254,2001-12-20,Mermaid Chronicles Part 1: She Creature,Mermaid Chronicles Part 1: She Creature,0,0,91,17.821,5.753,93,False,,"[{'id': 27, 'name': 'Horror'}, {'id': 14, 'name': 'Fantasy'}, {'id': 10770, 'name': 'TV Movie'}]","[{'id': 177, 'logo_path': None, 'name': 'Columbia TriStar', 'origin_country': ''}, {'id': 23188, 'logo_path': None, 'name': 'Creature Features Productions LLC', 'origin_country': ''}, {'id': 3268, 'logo_path': '/tuomPhY2UtuPTqqFnKMVHvSb724.png', 'name': 'HBO', 'origin_country': 'US'}]","[{'english_name': 'English', 'iso_639_1': 'en', 'name': 'English'}]",Released,"Beatiful, seductive and totally deadly.","Two carnies (Sewell and Gugino) abduct a mermaid in Ireland, circa 1900, and decide to transport her to America. As their ship loses its way and heads towards the mythical Forbidden Islands, the mermaid begins to display its deadly side.",tt0274659,"[{'iso_3166_1': 'US', 'name': 'United States of America'}]",en
11000,1996-03-08,The Birdcage,The Birdcage,31000000,185300000,119,17.808,7.0,1139,False,,"[{'id': 35, 'name': 'Comedy'}]","[{'id': 60, 'logo_path': '/4YldLvCWQL9VIAHQ2Fu3Ffkh9Si.png', 'name': 'United Artists', 'origin_country': 'US'}, {'id': 21, 'logo_path': '/usUnaYV6hQnlVAXP6r4HwrlLFPG.png', 'name': 'Metro-Goldwyn-Mayer', 'origin_country': 'US'}]","[{'english_name': 'English', 'iso_639_1': 'en', 'name': 'English'}]",Released,Come as you are.,"Middle-aged gay life partners, Armand Goldman, a Jewish drag club owner, and Albert, the club's flamboyant star attraction, live in the eclectic community of South Beach and have raised a straight son. Now, their newly engaged son, 20-year-old Val, wants to bring his fiancée, Barbara, and her ultraconservative parents home to meet his family for the first time. By Val's request, Armand pretends to be straight, not Jewish and attempts to hide his relationship with Albert, in order to please Barbara's father, controversial right-wing Republican Sen. Kevin Keeley.",tt0115685,"[{'iso_3166_1': 'US', 'name': 'United States of America'}]",en
8879,1985-06-28,Pale Rider,Pale Rider,6900000,41400000,115,17.743,7.154,1061,False,,"[{'id': 37, 'name': 'Western'}, {'id': 18, 'name': 'Drama'}]","[{'id': 174, 'logo_path': '/zhD3hhtKB5qyv7ZeL4uLpNxgMVU.png', 'name': 'Warner Bros. Pictures', 'origin_country': 'US'}, {'id': 171, 'logo_path': '/bqLWwuNCHcY3IjB5e4o29h7l80D.png', 'name': 'Malpaso Productions', 'origin_country': 'US'}]","[{'english_name': 'English', 'iso_639_1': 'en', 'name': 'English'}]",Released,...and hell followed with him.,A mysterious preacher protects a humble prospector village from a greedy mining company trying to encroach on their land.,tt0089767,"[{'iso_3166_1': 'US', 'name': 'United States of America'}]",en
633182,2020-01-09,Freies Land,Free Country,0,0,130,17.403,6.3,77,False,,"[{'id': 18, 'name': 'Drama'}, {'id': 53, 'name': 'Thriller'}]","[{'id': 823, 'logo_path': '/275O5OoKjulWtY1uRHRXaYsrt9I.png', 'name': 'Telepool', 'origin_country': 'DE'}, {'id': 52799, 'logo_path': None, 'name': 'Syrreal Entertainment', 'origin_country': 'DE'}, {'id': 4606, 'logo_path': '/otZHbf1HmzLRQsZFSqJXkf8EHz7.png', 'name': 'ZDF', 'origin_country': 'DE'}]","[{'english_name': 'German', 'iso_639_1': 'de', 'name': 'Deutsch'}]",Released,,"Former East Germany, 1992. Patrick Stein and Markus Bach, two very different police officers, are commissioned to investigate the disappearance of two female teenagers in a remote area of the country. Did they run away from home or did something more terrible happen to them?",tt9407490,"[{'iso_3166_1': 'DE', 'name': 'Germany'}]",de
18487,2009-06-10,The Taking of Pelham 1 2 3,The Taking of Pelham 1 2 3,100000000,150166126,106,17.376,6.35,3085,False,,"[{'id': 80, 'name': 'Crime'}, {'id': 53, 'name': 'Thriller'}, {'id': 28, 'name': 'Action'}]","[{'id': 1423, 'logo_path': '/gzvsPHV9WqcQMrvI8pq5hbuvEZ5.png', 'name': 'Escape Artists', 'origin_country': 'US'}, {'id': 5, 'logo_path': '/71BqEFAF4V3qjjMPCpLuyJFB9A.png', 'name': 'Columbia Pictures', 'origin_country': 'US'}, {'id': 7295, 'logo_path': '/5MYE96QiE5a5oFhXxFb4y8ILSpw.png', 'name': 'Relativity Media', 'origin_country': 'US'}, {'id': 1645, 'logo_path': '/6Ry6uNBaa0IbbSs1XYIgX5DkA9r.png', 'name': 'Scott Free Productions', 'origin_country': 'GB'}, {'id': 21, 'logo_path': '/usUnaYV6hQnlVAXP6r4HwrlLFPG.png', 'name': 'Metro-Goldwyn-Mayer', 'origin_country': 'US'}]","[{'english_name': 'English', 'iso_639_1': 'en', 'name': 'English'}]",Released,I can't get it out of my head. I'm gonna die today.,"Armed men hijack a New York City subway train, holding the passengers hostage in return for a ransom, and turning an ordinary day's work for dispatcher Walter Garber into a face-off with the mastermind behind the crime.",tt1111422,"[{'iso_3166_1': 'GB', 'name': 'United Kingdom'}, {'iso_3166_1': 'US', 'name': 'United States of America'}]",en
2212,1997-01-31,Nightwatch,Nightwatch,10000000,1179002,102,17.371,6.045,393,False,,"[{'id': 18, 'name': 'Drama'}, {'id': 27, 'name': 'Horror'}, {'id': 9648, 'name': 'Mystery'}, {'id': 53, 'name': 'Thriller'}]","[{'id': 7405, 'logo_path': '/rfnws0uY8rsNAsrLbx3gEIcYXx3.png', 'name': 'Dimension Films', 'origin_country': 'US'}, {'id': 14, 'logo_path': '/m6AHu84oZQxvq7n1rsvMNJIAsMu.png', 'name': 'Miramax', 'origin_country': 'US'}]","[{'english_name': 'English', 'iso_639_1': 'en', 'name': 'English'}]",Released,,A law student takes a job as a night watchman at a morgue and begins to discover clues that implicate him as the suspect in a series of murders.,tt0119791,"[{'iso_3166_1': 'US', 'name': 'United States of America'}]",en
8487,1999-06-30,Wild Wild West,Wild Wild West,170000000,222104681,106,17.201,5.326,3289,False,,"[{'id': 28, 'name': 'Action'}, {'id': 12, 'name': 'Adventure'}, {'id': 35, 'name': 'Comedy'}, {'id': 878, 'name': 'Science Fiction'}, {'id': 37, 'name': 'Western'}]","[{'id': 174, 'logo_path': '/zhD3hhtKB5qyv7ZeL4uLpNxgMVU.png', 'name': 'Warner Bros. Pictures', 'origin_country': 'US'}, {'id': 16774, 'logo_path': '/uD6Ls0FSJwo13ekpz91s1TRpkGq.png', 'name': 'Peters Entertainment', 'origin_country': 'US'}, {'id': 57088, 'logo_path': None, 'name': 'Sonnenfeld/Josephson Worldwide Entertainment', 'origin_country': ''}, {'id': 2507, 'logo_path': None, 'name': 'Todman, Simon, LeMasters Productions', 'origin_country': ''}]","[{'english_name': 'English', 'iso_639_1': 'en', 'name': 'English'}]",Released,It's a whole new west.,Legless Southern inventor Dr. Arliss Loveless plans to rekindle the Civil War by assassinating President U.S. Grant. Only two men can stop him: gunfighter James West and master-of-disguise and inventor Artemus Gordon. The two must team up to thwart Loveless' plans.,tt0120891,"[{'iso_3166_1': 'US', 'name': 'United States of America'}, {'iso_3166_1': 'CA', 'name': 'Canada'}]",en
58151,2011-08-18,Fright Night,Fright Night,30000000,41002607,106,17.039,6.2,1922,False,"{'id': 230161, 'name': 'Fright Night (Reboot) Collection', 'poster_path': '/j552uoYU3B45mIHLPBorkdoW0Mr.jpg', 'backdrop_path': '/9N1PbMkYJ5Zn2suUSHt38lAJnkD.jpg'}","[{'id': 27, 'name': 'Horror'}, {'id': 35, 'name': 'Comedy'}]","[{'id': 77471, 'logo_path': None, 'name': 'Gaeta / Rosenzweig Films', 'origin_country': 'US'}, {'id': 7, 'logo_path': '/vru2SssLX3FPhnKZGtYw00pVIS9.png', 'name': 'DreamWorks Pictures', 'origin_country': 'US'}, {'id': 11370, 'logo_path': None, 'name': 'Michael De Luca Productions', 'origin_country': 'US'}, {'id': 7294, 'logo_path': '/kK4PRgceWp9KNrycD8xx8seWxYU.png', 'name': 'Reliance Entertainment', 'origin_country': 'IN'}]","[{'english_name': 'English', 'iso_639_1': 'en', 'name': 'English'}]",Released,You can't run from evil when it lives next door.,"A teenager suspects his new neighbour is a vampire. Unable to convince anyone, he tries to enlist the help of a self-proclaimed vampire hunter and magician.",tt1438176,"[{'iso_3166_1': 'IN', 'name': 'India'}, {'iso_3166_1': 'US', 'name': 'United States of America'}]",en
9038,2007-10-05,The Heartbreak Kid,The Heartbreak Kid,60000000,128453183,116,16.97,5.727,1591,False,,"[{'id': 35, 'name': 'Comedy'}, {'id': 10749, 'name': 'Romance'}]","[{'id': 1156, 'logo_path': None, 'name': 'Conundrum Entertainment', 'origin_country': 'US'}, {'id': 1302, 'logo_path': '/zC3b70ixHh89qJIikLQPEvLqbPM.png', 'name': 'Davis Entertainment', 'origin_country': 'US'}, {'id': 7, 'logo_path': '/vru2SssLX3FPhnKZGtYw00pVIS9.png', 'name': 'DreamWorks Pictures', 'origin_country': 'US'}, {'id': 350, 'logo_path': '/jrlmyFt4rzIfcFQx0PN2ydrErwI.png', 'name': 'Radar Pictures', 'origin_country': 'US'}]","[{'english_name': 'English', 'iso_639_1': 'en', 'name': 'English'}, {'english_name': 'Spanish', 'iso_639_1': 'es', 'name': 'Español'}]",Released,He waited all his life to get married. Too bad he didn't wait another week.,"Eddie, the 40-year-old confirmed bachelor finally says ""I do"" to the beautiful and sexy Lila. But during their honeymoon in Mexico, the woman of his dreams turns out to be a total nightmare, and the guy who could never pull the trigger realizes he’s jumped the gun.",tt0408839,"[{'iso_3166_1': 'US', 'name': 'United States of America'}]",en
29101,2005-02-03,Vet Hard,Too Fat Too Furious,4200000,0,100,16.891,5.9,39,False,,"[{'id': 18, 'name': 'Drama'}, {'id': 35, 'name': 'Comedy'}, {'id': 80, 'name': 'Crime'}]","[{'id': 12046, 'logo_path': '/wauD5HrRmaR5TdQr0ylGTLyifpQ.png', 'name': 'Fu Works', 'origin_country': 'NL'}, {'id': 865, 'logo_path': None, 'name': 'Motel Films', 'origin_country': 'NL'}, {'id': 3134, 'logo_path': '/1w7LQKO5fNzovefxGReUpZlM8e9.png', 'name': 'A Private View', 'origin_country': 'BE'}, {'id': 25488, 'logo_path': None, 'name': 'Clockwork Pictures', 'origin_country': 'NL'}, {'id': 2105, 'logo_path': '/48jOgfdOkjNXwHPhbtpHj1H8kRt.png', 'name': 'Thura Film', 'origin_country': 'DK'}, {'id': 96905, 'logo_path': '/tEmGTKWCPz87Gl7ZExY4k7Ks9GQ.png', 'name': 'BNN', 'origin_country': 'NL'}]","[{'english_name': 'Arabic', 'iso_639_1': 'ar', 'name': 'العربية'}, {'english_name': 'Dutch', 'iso_639_1': 'nl', 'name': 'Nederlands'}, {'english_name': 'French', 'iso_639_1': 'fr', 'name': 'Français'}]",Released,,"Bennie, a clumsy criminal who's touchy about his weight, teams up with his adoptive father's biological (serial killer) son, his employees who in his absence turned his snack-bar into a quiche bakery, a suicidal manic-depressive woman and a Yugoslavian who keeps blowing things up unintended. They need to get 300000 Euro to get Bennies father a new liver.",tt0382365,"[{'iso_3166_1': 'NL', 'name': 'Netherlands'}]",nl
46845,1971-11-24,Man in the Wilderness,Man in the Wilderness,0,0,104,16.818,6.2,89,False,,"[{'id': 37, 'name': 'Western'}, {'id': 12, 'name': 'Adventure'}, {'id': 18, 'name': 'Drama'}]","[{'id': 1397, 'logo_path': None, 'name': 'Limbridge', 'origin_country': ''}, {'id': 11981, 'logo_path': None, 'name': 'Wilderness Films', 'origin_country': ''}]","[{'english_name': 'English', 'iso_639_1': 'en', 'name': 'English'}]",Released,He was left for dead. He would not forget.,"In the early 1800s, a group of fur trappers and Indian traders are returning with their goods to civilization and are making a desperate attempt to beat the oncoming winter. When guide Zachary Bass is injured in a bear attack, they decide he's a goner and leave him behind to die. When he recovers instead, he swears revenge on them and tracks them and their paranoiac expedition leader down.",tt0067388,"[{'iso_3166_1': 'US', 'name': 'United States of America'}]",en
44982,2010-03-12,13,13,0,3317662,91,16.667,5.836,801,False,,"[{'id': 18, 'name': 'Drama'}, {'id': 53, 'name': 'Thriller'}]","[{'id': 5860, 'logo_path': None, 'name': 'Anchor Bay Films', 'origin_country': 'US'}, {'id': 10808, 'logo_path': None, 'name': 'Overnight Films', 'origin_country': ''}, {'id': 24323, 'logo_path': None, 'name': 'Morabito Picture Company', 'origin_country': ''}, {'id': 6563, 'logo_path': None, 'name': 'Barbarian Films', 'origin_country': ''}, {'id': 22546, 'logo_path': None, 'name': 'Magnet Media Group', 'origin_country': ''}, {'id': 4634, 'logo_path': None, 'name': 'Oceana Media Finance', 'origin_country': ''}, {'id': 24322, 'logo_path': None, 'name': 'Red Dragon Productions', 'origin_country': ''}, {'id': 20659, 'logo_path': None, 'name': 'Cinedigm', 'origin_country': 'US'}, {'id': 22545, 'logo_path': None, 'name': 'Magnet Media Productions', 'origin_country': ''}, {'id': 88639, 'logo_path': None, 'name': 'Number 13', 'origin_country': ''}, {'id': 838, 'logo_path': '/tcW3UqV46Mdq6GyaS1ydEDocEDF.png', 'name': 'Paramount Vantage', 'origin_country': 'US'}]","[{'english_name': 'English', 'iso_639_1': 'en', 'name': 'English'}]",Released,Spin. Aim. Survive.,"A naive young man assumes a dead man's identity and finds himself embroiled in an underground world of power, violence, and chance where men gamble behind closed doors on the lives of other men.",tt0798817,"[{'iso_3166_1': 'US', 'name': 'United States of America'}]",en
28512,2005-11-20,The Poseidon Adventure,The Poseidon Adventure,14000000,0,173,16.641,5.2,104,False,,"[{'id': 12, 'name': 'Adventure'}, {'id': 18, 'name': 'Drama'}, {'id': 53, 'name': 'Thriller'}, {'id': 28, 'name': 'Action'}, {'id': 10770, 'name': 'TV Movie'}]","[{'id': 6355, 'logo_path': None, 'name': 'Silverstar Limited', 'origin_country': 'US'}, {'id': 3282, 'logo_path': None, 'name': 'Larry Levinson Productions', 'origin_country': 'US'}]","[{'english_name': 'English', 'iso_639_1': 'en', 'name': 'English'}]",Released,,"A cruise ship succumbs to a terrorist act and capsizes on New Year's eve. A rag-tag group of survivors, spearheaded by a priest and a homeland security agent, must journey through the upside down vessel and attempt an escape.",tt0419358,"[{'iso_3166_1': 'US', 'name': 'United States of America'}]",en
500852,2019-02-01,Miss Bala,Miss Bala,15000000,15200000,104,16.637,6.4,539,False,,"[{'id': 28, 'name': 'Action'}]","[{'id': 5, 'logo_path': '/71BqEFAF4V3qjjMPCpLuyJFB9A.png', 'name': 'Columbia Pictures', 'origin_country': 'US'}, {'id': 1719, 'logo_path': '/nCCpnwdybGqektBEjqpz6WX0cbF.png', 'name': 'Canana', 'origin_country': 'MX'}, {'id': 11581, 'logo_path': '/yIORcWTFHtbXvWjqXAqFuMxx0K0.png', 'name': 'Misher Films', 'origin_country': 'US'}]","[{'english_name': 'English', 'iso_639_1': 'en', 'name': 'English'}]",Released,Who would you become to save your family?,"Gloria finds a power she never knew she had when she is drawn into a dangerous world of cross-border crime. Surviving will require all of her cunning, inventiveness, and strength.",tt5941692,"[{'iso_3166_1': 'MX', 'name': 'Mexico'}, {'iso_3166_1': 'US', 'name': 'United States of America'}]",en
691683,2022-03-18,Cheaper by the Dozen,Cheaper by the Dozen,0,0,107,16.605,6.4,247,False,,"[{'id': 10751, 'name': 'Family'}, {'id': 35, 'name': 'Comedy'}]","[{'id': 2, 'logo_path': '/wdrCwmRnLFJhEoH8GSfymY85KHT.png', 'name': 'Walt Disney Pictures', 'origin_country': 'US'}, {'id': 114690, 'logo_path': '/dP4q0910XaQmW6WsDGNaAyZDK8J.png', 'name': 'Khalabo Ink Society', 'origin_country': 'US'}]","[{'english_name': 'English', 'iso_639_1': 'en', 'name': 'English'}]",Released,,"This remake of the beloved classic follows the raucous exploits of a blended family of 12, the Bakers, as they navigate a hectic home life while simultaneously managing their family business.",tt6705162,"[{'iso_3166_1': 'US', 'name': 'United States of America'}]",en
20534,2004-04-02,Murder,Murder,0,0,130,16.552,5.0,32,False,"{'id': 484529, 'name': 'Murder Collection', 'poster_path': '/aKPlQwfmTmsPyssPh0387onFohl.jpg', 'backdrop_path': '/zKvn9nhlmGzWOTdEC4VPUXtEzoV.jpg'}","[{'id': 18, 'name': 'Drama'}, {'id': 53, 'name': 'Thriller'}]","[{'id': 3749, 'logo_path': '/vSqS9ovkpql7VN1HwTYwR5KexrB.png', 'name': 'Vishesh Films', 'origin_country': 'IN'}]","[{'english_name': 'Hindi', 'iso_639_1': 'hi', 'name': 'हिन्दी'}]",Released,"She is married, she is lonely, she is having an affair......","To escape a secure but stifling life with her workaholic husband Sudhir, bored housewife Simran begins an affair with Sunny, an ex-boyfriend from her college days. However, when Sudhir grows suspicious and hires a private detective, the infidelity soon comes to light.",tt0405507,"[{'iso_3166_1': 'IN', 'name': 'India'}]",hi
814800,2022-09-16,Goodnight Mommy,Goodnight Mommy,0,0,91,16.527,6.269,454,False,,"[{'id': 27, 'name': 'Horror'}, {'id': 53, 'name': 'Thriller'}, {'id': 9648, 'name': 'Mystery'}]","[{'id': 26995, 'logo_path': '/acHyNRG9qZKvr4ZlhsKlojhYeey.png', 'name': 'Animal Kingdom', 'origin_country': 'US'}, {'id': 108769, 'logo_path': '/riBQBny2Z3la03Wy8I27Ahn2spC.png', 'name': 'Playtime', 'origin_country': 'FR'}]","[{'english_name': 'English', 'iso_639_1': 'en', 'name': 'English'}]",Released,The darkest family secrets stay under wraps.,"When twin brothers arrive home to find their mother’s demeanor altered and face covered in surgical bandages, they begin to suspect the woman beneath the gauze might not be their mother.",tt9000184,"[{'iso_3166_1': 'FR', 'name': 'France'}, {'iso_3166_1': 'US', 'name': 'United States of America'}]",en
433251,2017-08-11,Naked,Naked,0,0,96,16.418,5.766,1272,False,,"[{'id': 35, 'name': 'Comedy'}]","[{'id': 8000, 'logo_path': '/f8NwLg72BByt3eav7lX1lcJfe60.png', 'name': 'Broken Road Productions', 'origin_country': 'US'}]","[{'english_name': 'English', 'iso_639_1': 'en', 'name': 'English'}]",Released,It's Deja Groom All Over Again.,"Following a wild night out with his best man, Rob Anderson wakes up to find himself naked in an elevator on the morning of his wedding day and is forced to relive the morning over and over again.",tt6048930,"[{'iso_3166_1': 'US', 'name': 'United States of America'}]",en
16007,2006-06-17,デスノート,Death Note,20000000,29667169,126,16.352,7.0,697,False,"{'id': 102019, 'name': 'Death Note Collection', 'poster_path': '/ecxqdvpHQyKyFU8ElyBGvhzy1Be.jpg', 'backdrop_path': '/mmxYQGbk4VWa0ARb418ANsew5TP.jpg'}","[{'id': 14, 'name': 'Fantasy'}, {'id': 9648, 'name': 'Mystery'}, {'id': 53, 'name': 'Thriller'}]","[{'id': 6755, 'logo_path': '/c0ENH8QeZLvCACpzCpwvYMy2SDr.png', 'name': 'Nippon Television Network Corporation', 'origin_country': 'JP'}, {'id': 2918, 'logo_path': '/gyEWUBWwqrm3H5T2hkERD9LxpOq.png', 'name': 'Shueisha', 'origin_country': 'JP'}, {'id': 192, 'logo_path': '/93eAKlnQecDdMtucfOprzcjMw9V.png', 'name': 'Shochiku', 'origin_country': 'JP'}, {'id': 11725, 'logo_path': '/3OZxd70DZ1LbVelmZK8mR5FIXxO.png', 'name': 'VAP', 'origin_country': 'JP'}, {'id': 955, 'logo_path': '/5xnXD3PJI1HqOJceSAKZ3fDqO1V.png', 'name': 'Nikkatsu Corporation', 'origin_country': 'JP'}, {'id': 4330, 'logo_path': '/n8v5Ii8FCPHAg0KaIXviDRFSqhG.png', 'name': 'Horipro', 'origin_country': 'JP'}, {'id': 3627, 'logo_path': '/pBfPYpzg5o3EoBPfrFKzTRi8MGr.png', 'name': 'Warner Bros. Japan', 'origin_country': 'JP'}]","[{'english_name': 'Japanese', 'iso_639_1': 'ja', 'name': '日本語'}]",Released,The battle of wits begins. Whose side are you on?,"Light Yagami finds the ""Death Note,"" a notebook with the power to kill, and decides to create a Utopia by killing the world's criminals, and soon the world's greatest detective, ""L,"" is hired to find the mysterious murderer. An all out battle between the two greatest minds on earth begins and the winner will control the world.",tt0758742,"[{'iso_3166_1': 'JP', 'name': 'Japan'}]",ja
407451,2018-03-08,A Wrinkle in Time,A Wrinkle in Time,103000000,132675864,109,16.207,5.07,1788,False,,"[{'id': 12, 'name': 'Adventure'}, {'id': 878, 'name': 'Science Fiction'}, {'id': 10751, 'name': 'Family'}, {'id': 14, 'name': 'Fantasy'}]","[{'id': 51164, 'logo_path': None, 'name': 'Whitaker Entertainment', 'origin_country': 'US'}, {'id': 2, 'logo_path': '/wdrCwmRnLFJhEoH8GSfymY85KHT.png', 'name': 'Walt Disney Pictures', 'origin_country': 'US'}]","[{'english_name': 'English', 'iso_639_1': 'en', 'name': 'English'}]",Released,Be a warrior,"After the disappearance of her scientist father, three peculiar beings send Meg, her brother, and her friend to space in order to find him.",tt1620680,"[{'iso_3166_1': 'US', 'name': 'United States of America'}]",en
456154,2018-03-28,Croc-Blanc,White Fang,0,0,87,16.193,7.35,198,False,,"[{'id': 16, 'name': 'Animation'}, {'id': 10751, 'name': 'Family'}]","[{'id': 20338, 'logo_path': '/yCTqaPPzFfjqKU2YAGWce4qQk1S.png', 'name': 'Bidibul Productions', 'origin_country': 'LU'}, {'id': 63540, 'logo_path': '/7xQ00vsbxc8qZeeOeam3teObjfU.png', 'name': 'Superprod Animation', 'origin_country': 'FR'}, {'id': 188, 'logo_path': '/40E8iNvy6brH6t4BbmQL211jIpl.png', 'name': 'Big Beach', 'origin_country': 'US'}, {'id': 591, 'logo_path': '/q5I5RDwMEiqoNmfaJgd2LraEOJY.png', 'name': 'France 3 Cinéma', 'origin_country': 'FR'}]","[{'english_name': 'French', 'iso_639_1': 'fr', 'name': 'Français'}]",Released,Rediscover Jack London's Masterpiece,A loyal wolfdog’s curiosity leads him on the adventure of a lifetime while serving a series of three distinctly different masters.,tt5222768,"[{'iso_3166_1': 'US', 'name': 'United States of America'}, {'iso_3166_1': 'FR', 'name': 'France'}, {'iso_3166_1': 'LU', 'name': 'Luxembourg'}]",fr
4520,2007-10-12,Sleuth,Sleuth,0,342835,86,16.162,6.2,529,False,,"[{'id': 18, 'name': 'Drama'}, {'id': 9648, 'name': 'Mystery'}, {'id': 53, 'name': 'Thriller'}]","[{'id': 97, 'logo_path': '/qv3ih9pR9w2XNKZDsqDqAGuZjqc.png', 'name': 'Castle Rock Entertainment', 'origin_country': 'US'}, {'id': 679, 'logo_path': None, 'name': 'Timnick Films', 'origin_country': 'US'}, {'id': 1668, 'logo_path': None, 'name': 'Riff Raff Film Productions', 'origin_country': ''}, {'id': 181992, 'logo_path': None, 'name': 'Mandate International', 'origin_country': 'US'}, {'id': 58, 'logo_path': '/voYCwlBHJQANtjvm5MNIkCF1dDH.png', 'name': 'Sony Pictures Classics', 'origin_country': 'US'}]","[{'english_name': 'English', 'iso_639_1': 'en', 'name': 'English'}]",Released,Obey the rules.,"On his sprawling country estate, an aging writer matches wits with the struggling actor who has stolen his wife's heart.",tt0857265,"[{'iso_3166_1': 'GB', 'name': 'United Kingdom'}, {'iso_3166_1': 'US', 'name': 'United States of America'}]",en
10461,2000-10-06,Get Carter,Get Carter,63600000,19412993,102,16.109,5.2,567,False,,"[{'id': 28, 'name': 'Action'}, {'id': 18, 'name': 'Drama'}, {'id': 53, 'name': 'Thriller'}, {'id': 80, 'name': 'Crime'}]","[{'id': 10210, 'logo_path': '/gHaNnHd4LjNAoAG5aJthVrdAjZo.png', 'name': 'Morgan Creek Entertainment', 'origin_country': 'US'}, {'id': 22351, 'logo_path': None, 'name': 'The Canton Company', 'origin_country': 'US'}, {'id': 1403, 'logo_path': '/pMTQNUhHCwr39CsS7yUmSg503E7.png', 'name': 'Franchise Pictures', 'origin_country': 'US'}, {'id': 174, 'logo_path': '/zhD3hhtKB5qyv7ZeL4uLpNxgMVU.png', 'name': 'Warner Bros. Pictures', 'origin_country': 'US'}, {'id': 1171, 'logo_path': '/wp7NwsxxHT8sqPaek6SlxnXlkP4.png', 'name': 'Epsilon Motion Pictures', 'origin_country': 'CH'}, {'id': 4253, 'logo_path': '/qgFBsEmKTckDM0Fk6ZTB8RyW0Rc.png', 'name': 'Don Carmody Productions', 'origin_country': 'CA'}]","[{'english_name': 'English', 'iso_639_1': 'en', 'name': 'English'}]",Released,The Truth Hurts,"Jack Carter, a mob enforcer living in Las Vegas, travels back to his hometown of Seattle for his brother's funeral. During this visit, Carter realizes that the death of his brother was not accidental, but a murder. With this knowledge, Carter sets out to kill all those responsible.",tt0208988,"[{'iso_3166_1': 'CA', 'name': 'Canada'}, {'iso_3166_1': 'CH', 'name': 'Switzerland'}, {'iso_3166_1': 'US', 'name': 'United States of America'}]",en
14254,2009-01-30,The Uninvited,The Uninvited,0,41624046,87,16.074,6.5,1489,False,,"[{'id': 27, 'name': 'Horror'}]","[{'id': 7, 'logo_path': '/vru2SssLX3FPhnKZGtYw00pVIS9.png', 'name': 'DreamWorks Pictures', 'origin_country': 'US'}, {'id': 2363, 'logo_path': None, 'name': 'Cold Spring Pictures', 'origin_country': 'US'}, {'id': 49325, 'logo_path': '/R05WCoCJcPWGSDaKaYgx3AeVuR.png', 'name': 'Parkes+MacDonald Image Nation', 'origin_country': 'US'}, {'id': 2364, 'logo_path': '/oZyR5maGM96jReVgW7oJ7mXN8ts.png', 'name': 'The Montecito Picture Company', 'origin_country': 'US'}, {'id': 829, 'logo_path': '/aXqwCvJSCDbTclkxAYfsT1l4Dsa.png', 'name': 'Vertigo Entertainment', 'origin_country': 'US'}]","[{'english_name': 'English', 'iso_639_1': 'en', 'name': 'English'}]",Released,Can you believe what you see?,"Anna returns home after spending time in a psychiatric facility following her mother's tragic death and discovers that her mother's former nurse, Rachel, has moved into their house and become engaged to her father. Soon after she learns this shocking news, Anna is visited by her mother's ghost, who warns her that Rachel has evil intentions.",tt0815245,"[{'iso_3166_1': 'US', 'name': 'United States of America'}]",en
