id,release_date,original_title,title,budget,revenue,runtime,popularity,vote_average,vote_count,adult,belongs_to_collection,genres,production_companies,spoken_languages,status,tagline,overview,imdb_id,production_countries,original_language
417501,2016-10-28,Child Eater,Child Eater,0,0,82,4.039,4.563,48,False,,"[{'id': 27, 'name': 'Horror'}]","[{'id': 105462, 'logo_path': '/pjpj1dl2uxVebvqppQ9d3PXbwZx.png', 'name': 'Wheelhouse Creative', 'origin_country': 'US'}]","[{'english_name': 'English', 'iso_639_1': 'en', 'name': 'English'}]",Released,The young ones taste the best,A simple night of babysitting takes a horrifying turn when Helen realizes the boogeyman really is in little Lucas' closet.,tt4565400,"[{'iso_3166_1': 'IS', 'name': 'Iceland'}, {'iso_3166_1': 'US', 'name': 'United States of America'}]",en
557648,2019-01-27,Rent,Rent,0,0,135,4.008,6.821,81,False,,"[{'id': 10402, 'name': 'Music'}, {'id': 10770, 'name': 'TV Movie'}, {'id': 18, 'name': 'Drama'}]","[{'id': 1556, 'logo_path': '/31h94rG9hzjprXoYNy3L1ErUya2.png', 'name': '20th Century Fox Television', 'origin_country': 'US'}]","[{'english_name': 'English', 'iso_639_1': 'en', 'name': 'English'}]",Released,,"The story of several friends in New York City facing financial poverty, homophobia, AIDS, and, of course, rent.",tt6881910,"[{'iso_3166_1': 'US', 'name': 'United States of America'}]",en
1021792,2023-02-24,தக்ஸ்,Thugs,0,0,122,3.987,3.0,1,False,,"[{'id': 28, 'name': 'Action'}, {'id': 53, 'name': 'Thriller'}, {'id': 80, 'name': 'Crime'}, {'id': 10749, 'name': 'Romance'}]","[{'id': 212302, 'logo_path': None, 'name': 'HR Pictures', 'origin_country': 'IN'}]","[{'english_name': 'Tamil', 'iso_639_1': 'ta', 'name': 'தமிழ்'}]",Released,,"Sethu, along with his prison inmates, plots a plan to escape from the district jail of Nagercoil. Can these remand prisoners carry out their plan despite all the odds they face every day?",tt23951484,"[{'iso_3166_1': 'IN', 'name': 'India'}]",ta
217414,2013-11-15,¿Quién mató a Bambi?,Who Killed Bambi?,0,850259,86,3.968,5.4,55,False,,"[{'id': 35, 'name': 'Comedy'}]","[{'id': 11651, 'logo_path': '/i5JILeNrP9piqdJWmfQCbTHQKJf.png', 'name': 'Rodar y Rodar', 'origin_country': 'ES'}, {'id': 7341, 'logo_path': '/r4zR9lVBlByJ4gX3wqelIpLZUvD.png', 'name': 'AXN Original Production', 'origin_country': ''}, {'id': 9335, 'logo_path': None, 'name': 'Canal+ España', 'origin_country': 'ES'}, {'id': 35559, 'logo_path': '/xLqNfq5xXETBKjq3jSSiNqqPiN7.png', 'name': 'ICEC', 'origin_country': 'ES'}, {'id': 5085, 'logo_path': '/mPuVc7m1Ki7OQQvAYwYfIlEI3vu.png', 'name': 'TV3', 'origin_country': 'ES'}, {'id': 981, 'logo_path': '/pkrdO9ykplO4Zc8edikoSX5APUN.png', 'name': 'TVE', 'origin_country': 'ES'}]","[{'english_name': 'Spanish', 'iso_639_1': 'es', 'name': 'Español'}]",Released,,"The story of two young friends, a lawyer, a rich man and a group of kidnappers end up in a series of strange circumstances all to discover; Who Killed Bambi?",tt2604346,"[{'iso_3166_1': 'ES', 'name': 'Spain'}]",es
481533,2018-04-16,When Jeff Tried to Save the World,When Jeff Tried to Save the World,0,0,93,3.953,5.6,27,False,,"[{'id': 35, 'name': 'Comedy'}, {'id': 18, 'name': 'Drama'}]","[{'id': 96203, 'logo_path': None, 'name': '71 Degrees North', 'origin_country': ''}, {'id': 89113, 'logo_path': None, 'name': 'Bad Rack Entertainment', 'origin_country': ''}, {'id': 18346, 'logo_path': '/wZT3JBshK7M7ChquboLlPyV9L0p.png', 'name': 'Burn Later Productions', 'origin_country': 'US'}]","[{'english_name': 'English', 'iso_639_1': 'en', 'name': 'English'}]",Released,,"When Jeff discovers that the bowling alley he manages is being sold, he must do everything he can to save the place he's come to call home.",tt7115980,"[{'iso_3166_1': 'US', 'name': 'United States of America'}]",en
44972,2010-09-03,वी आर फैमिली,We Are Family,0,0,115,3.944,5.914,35,False,,"[{'id': 18, 'name': 'Drama'}, {'id': 10751, 'name': 'Family'}]","[{'id': 2320, 'logo_path': '/nSAXfUCy16cNRiPlBMHeb700t9p.png', 'name': 'UTV Motion Pictures', 'origin_country': 'IN'}, {'id': 19146, 'logo_path': '/5Ff25ornzVNhm5skuAvMAR556NB.png', 'name': 'Dharma Productions', 'origin_country': 'IN'}, {'id': 5, 'logo_path': '/71BqEFAF4V3qjjMPCpLuyJFB9A.png', 'name': 'Columbia Pictures', 'origin_country': 'US'}]","[{'english_name': 'Hindi', 'iso_639_1': 'hi', 'name': 'हिन्दी'}]",Released,A family... in an unusual situation.,"Maya is the perfect mother. Her life revolves around her three children, Aleya, Ankush, and Anjali. Who thinks nothing much then the world of her. Despite being divorced from her husband, Aman. Maya has ensured that everything runs smoothly in her house, under her watch, and that they continue to remain a happy family unit. However, when Aman introduces his girlfriend, Shreya a career oriented woman, who has a lot to learn about children's, to the family, the situation immediately takes an unexpected turn. When an incident changes their lives drastically, bringing the two women under the same roof, they find themselves putting to test an unusual situation; can two mothers make a home?",tt1428459,"[{'iso_3166_1': 'AU', 'name': 'Australia'}, {'iso_3166_1': 'IN', 'name': 'India'}, {'iso_3166_1': 'US', 'name': 'United States of America'}]",hi
445650,2016-12-09,Sen Benim Her Şeyimsin,You're Everything To Me,0,0,107,3.851,6.2,34,False,,"[{'id': 35, 'name': 'Comedy'}]","[{'id': 72676, 'logo_path': '/ddvOjfeS99fksgQ6PjV59szCSGl.png', 'name': 'TME Films', 'origin_country': 'TR'}]","[{'english_name': 'Turkish', 'iso_639_1': 'tr', 'name': 'Türkçe'}]",Released,,"When an old fling shows up with their infant child, a dallying man-child must take on the role of father and create a fairytale world for his daughter.",tt5748380,"[{'iso_3166_1': 'TR', 'name': 'Turkey'}]",tr
517065,2018-08-31,SUNNY 強い気持ち・強い愛,Sunny: Our Hearts Beat Together,0,0,118,3.773,6.9,22,False,,"[{'id': 18, 'name': 'Drama'}, {'id': 35, 'name': 'Comedy'}]","[{'id': 882, 'logo_path': '/fRSWWjquvzcHjACbtF53utZFIll.png', 'name': 'TOHO', 'origin_country': 'JP'}, {'id': 14625, 'logo_path': '/kgDY8gC5UQ33IHDRTrheMfNsvXg.png', 'name': 'Office Crescendo', 'origin_country': 'JP'}, {'id': 7036, 'logo_path': '/javbyY0ZCvlFJtly3tpZqf2NwLX.png', 'name': 'CJ Entertainment', 'origin_country': 'KR'}]","[{'english_name': 'Japanese', 'iso_639_1': 'ja', 'name': '日本語'}]",Released,From 1990's to 2018.,A group of friends from high school days reunite for once more time before one of them dies from cancer.,tt7493818,"[{'iso_3166_1': 'JP', 'name': 'Japan'}]",ja
338969,2023-09-21,The Toxic Avenger,The Toxic Avenger,0,0,102,3.659,7.5,4,False,,"[{'id': 28, 'name': 'Action'}, {'id': 35, 'name': 'Comedy'}, {'id': 27, 'name': 'Horror'}, {'id': 878, 'name': 'Science Fiction'}]","[{'id': 923, 'logo_path': '/8M99Dkt23MjQMTTWukq4m5XsEuo.png', 'name': 'Legendary Pictures', 'origin_country': 'US'}, {'id': 3052, 'logo_path': '/kqP7DC8cUCzDSI5SXiJKJKmQg1K.png', 'name': 'Troma Entertainment', 'origin_country': 'US'}]","[{'english_name': 'English', 'iso_639_1': 'en', 'name': 'English'}]",Released,A toxic world deserves a toxic hero.,"A horrible toxic accident transforms downtrodden janitor Winston Gooze into a new evolution of hero: THE TOXIC AVENGER! Now wielding a glowing mop with super-human strength, he must race against time to save his son and stop a ruthless and power-hungry tyrant bent on harnessing toxic superpowers to strengthen his polluted empire.",tt1633359,"[{'iso_3166_1': 'US', 'name': 'United States of America'}]",en
327476,2015-02-25,Luokkakokous,Reunion,1432960,0,88,3.613,5.2,37,False,"{'id': 504984, 'name': 'Reunion Collection', 'poster_path': '/cRwrdd6rW2N17IV2Eg9KyIDWGAg.jpg', 'backdrop_path': '/2HI6PbPaONpSaoif44INBf5jR87.jpg'}","[{'id': 35, 'name': 'Comedy'}]","[{'id': 6339, 'logo_path': '/ufP8NkiJ9ScGLIKz7J25xKtmVvX.png', 'name': 'Solar Films', 'origin_country': 'FI'}]","[{'english_name': 'Finnish', 'iso_639_1': 'fi', 'name': 'suomi'}]",Released,,Luokkakokous is a story about three men that travel back to their hometown to attend their high school class reunion.,tt3672640,"[{'iso_3166_1': 'FI', 'name': 'Finland'}]",fi
433605,2016-12-30,情圣,Some Like It Hot,0,0,116,3.605,6.9,13,False,,"[{'id': 35, 'name': 'Comedy'}]","[{'id': 83838, 'logo_path': '/5jZHAya89oRyQfAgwa1e5rfKmrN.png', 'name': 'Wanda Pictures', 'origin_country': 'CN'}]","[{'english_name': 'Mandarin', 'iso_639_1': 'zh', 'name': '普通话'}]",Released,Feel Alive Or Fail At Life.,"After the unexpected death of his best friend, a man examines his life and finds it incredibly lonely.  Inspired by an encounter with a beautiful and sexy model, he embarks with his three friends on what turns out to be a crazy (and slightly stupid) endeavor on a path towards fulfillment.",tt6398666,"[{'iso_3166_1': 'CN', 'name': 'China'}]",zh
648316,2019-12-13,The Body,The Body,0,0,101,3.561,5.6,34,False,,"[{'id': 53, 'name': 'Thriller'}, {'id': 9648, 'name': 'Mystery'}]","[{'id': 71969, 'logo_path': '/v2UW0b2odtD5VT8d1IG3D2saLD7.png', 'name': 'Azure Entertainment', 'origin_country': 'IN'}, {'id': 6808, 'logo_path': '/xa1Yz7B5eRC2F9oHA6mDn8NE6ci.png', 'name': 'Viacom18 Studios', 'origin_country': 'IN'}]","[{'english_name': 'Hindi', 'iso_639_1': 'hi', 'name': 'हिन्दी'}]",Released,Death Is The Ultimate Adventure,"When the body of a powerful businesswoman goes missing from the morgue, the inspector-in-charge hunts for the truth. When he questions her husband he realizes that there is much more to the case than meets the eye.",tt8130904,"[{'iso_3166_1': 'IN', 'name': 'India'}]",hi
173603,2013-02-27,Skytten,The Shooter,0,0,90,3.553,5.1,43,False,,"[{'id': 53, 'name': 'Thriller'}, {'id': 80, 'name': 'Crime'}, {'id': 18, 'name': 'Drama'}, {'id': 9648, 'name': 'Mystery'}]","[{'id': 758, 'logo_path': '/fft3jrctrZNcgAxgN1w5Givtzip.png', 'name': 'TV 2', 'origin_country': 'DK'}, {'id': 118, 'logo_path': '/AiBorgNTCS1lT1FdFPYheax9jfF.png', 'name': 'Det Danske Filminstitut', 'origin_country': 'DK'}, {'id': 235, 'logo_path': '/obOynoztBEhDNfHsDXBqOuQLAZk.png', 'name': 'Nordisk Film Denmark', 'origin_country': 'DK'}]","[{'english_name': 'Danish', 'iso_639_1': 'da', 'name': 'Dansk'}]",Released,,"The five days when Copenhagen was held in a panic grip by an intelligent activist and former elite shooter, who takes to arms when a woman journalist writes about the government’s broken promises in an environmental question.",tt2381989,"[{'iso_3166_1': 'DK', 'name': 'Denmark'}]",da
581104,2019-05-11,அயோக்யா,Ayogya,0,0,150,3.475,7.3,14,False,,"[{'id': 28, 'name': 'Action'}, {'id': 80, 'name': 'Crime'}, {'id': 18, 'name': 'Drama'}]","[{'id': 114595, 'logo_path': None, 'name': 'Light House Productions', 'origin_country': ''}]","[{'english_name': 'Tamil', 'iso_639_1': 'ta', 'name': 'தமிழ்'}]",Released,A story for current society,"When a corrupt cop gets embroiled in a heroic brawl, he has no idea how it would eventually lead him to a shocking rape case and change his life forever.",tt9304360,"[{'iso_3166_1': 'IN', 'name': 'India'}]",ta
974604,2022-10-21,Terror Train,Terror Train,0,0,90,3.466,4.5,35,False,"{'id': 1066568, 'name': 'Terror Train Collection', 'poster_path': '/yikOtwT17E82chfhGh8Bv2vN3sZ.jpg', 'backdrop_path': '/cuPGnDIPjLelNaCpR1umHuxkNZD.jpg'}","[{'id': 27, 'name': 'Horror'}]","[{'id': 13404, 'logo_path': '/4F5RxvJgbVT0vFQHs3IYRPfJvo3.png', 'name': 'Incendo Productions', 'origin_country': 'CA'}, {'id': 153734, 'logo_path': '/9pHAaHxAJtz6jobVWPkF1kG3kEG.png', 'name': 'Tubi', 'origin_country': 'US'}]","[{'english_name': 'English', 'iso_639_1': 'en', 'name': 'English'}]",Released,"Once the ride starts, the terror never stops!","Alana and a group of college seniors board a party train for a Halloween-themed bash, but their fun spirals into fear when a mysterious assailant begins killing the passengers one-by-one.",tt20222422,"[{'iso_3166_1': 'CA', 'name': 'Canada'}]",en
127894,2012-10-03,Do Not Disturb,Do Not Disturb,5000000,0,120,3.466,4.3,37,False,,"[{'id': 35, 'name': 'Comedy'}, {'id': 10749, 'name': 'Romance'}]","[{'id': 3578, 'logo_path': None, 'name': 'UGC Distribution', 'origin_country': ''}]","[{'english_name': 'French', 'iso_639_1': 'fr', 'name': 'Français'}, {'english_name': 'Russian', 'iso_639_1': 'ru', 'name': 'Pусский'}]",Released,,"In this lively French remake of Humpday, best buds reunite and revive their friendship on a questionable dare. Can two straight guys really make a gay sex film, together?",tt2193782,"[{'iso_3166_1': 'FR', 'name': 'France'}]",fr
301274,2015-01-15,重返20岁,20 Once Again,0,0,131,3.412,6.7,45,False,,"[{'id': 35, 'name': 'Comedy'}, {'id': 10402, 'name': 'Music'}, {'id': 14, 'name': 'Fantasy'}]","[{'id': 7036, 'logo_path': '/javbyY0ZCvlFJtly3tpZqf2NwLX.png', 'name': 'CJ Entertainment', 'origin_country': 'KR'}]","[{'english_name': 'Mandarin', 'iso_639_1': 'zh', 'name': '普通话'}]",Released,,"A visit to the photographer's returns the physical looks of a 70-year-old grandmother back to her 20s. Things get even stranger when his grandson asks her to join his band, and his best friend begins to fall for her.",tt4344878,"[{'iso_3166_1': 'KR', 'name': 'South Korea'}, {'iso_3166_1': 'CN', 'name': 'China'}]",zh
83382,2012-01-06,Players,Players,0,0,163,3.34,4.9,55,False,,"[{'id': 28, 'name': 'Action'}, {'id': 12, 'name': 'Adventure'}, {'id': 80, 'name': 'Crime'}, {'id': 53, 'name': 'Thriller'}, {'id': 18, 'name': 'Drama'}]","[{'id': 6808, 'logo_path': '/xa1Yz7B5eRC2F9oHA6mDn8NE6ci.png', 'name': 'Viacom18 Studios', 'origin_country': 'IN'}, {'id': 3943, 'logo_path': None, 'name': 'Burmawala Partners', 'origin_country': 'IN'}, {'id': 23319, 'logo_path': None, 'name': 'Globus-film', 'origin_country': 'RU'}, {'id': 15357, 'logo_path': '/uvaRT02pY9U8qLH8a9WwwAroDqr.png', 'name': 'Prime Focus', 'origin_country': 'IN'}]","[{'english_name': 'English', 'iso_639_1': 'en', 'name': 'English'}, {'english_name': 'Hindi', 'iso_639_1': 'hi', 'name': 'हिन्दी'}]",Released,,"Two professional robbers, an illusionist, an expert make-up artist, a gadget expert and a hacker come together to steal Romanian gold ingots while it is in transit.",tt1784589,"[{'iso_3166_1': 'IN', 'name': 'India'}, {'iso_3166_1': 'RU', 'name': 'Russia'}]",hi
545471,2018-11-30,Swingers,Swingers,0,0,85,3.339,4.0,9,False,,"[{'id': 35, 'name': 'Comedy'}]","[{'id': 108333, 'logo_path': None, 'name': 'Tuotantoyhtiö Hihhihhii', 'origin_country': 'FI'}, {'id': 3154, 'logo_path': None, 'name': 'Bronson Club', 'origin_country': 'FI'}]","[{'english_name': 'Finnish', 'iso_639_1': 'fi', 'name': 'suomi'}]",Released,,"A tough crisis comedy on a swing weekend where four different age couples face each other mentally and physically. Everyone has a crisis, either on the surface or hidden, and hence their own reasons to try to save their relationship. The weekend's dress code is with or without a bathrobe, and falling in love and jealousy are forbidden.",tt8630424,"[{'iso_3166_1': 'FI', 'name': 'Finland'}]",fi
516052,2019-09-27,銀河英雄伝説 Die Neue These 星乱 第一章,The Legend of the Galactic Heroes: Die Neue These Seiran 1,0,0,120,3.332,7.7,18,False,"{'id': 987450, 'name': 'The Legend of the Galactic Heroes: Die Neue These Seiran Collection', 'poster_path': '/l8sUIh3EhrI35zVEJ8HUjfz2y6s.jpg', 'backdrop_path': '/43L49uLTqASQaajQrDOmfbj1gmu.jpg'}","[{'id': 16, 'name': 'Animation'}, {'id': 878, 'name': 'Science Fiction'}]","[{'id': 529, 'logo_path': '/rwB6w2aPENQbx756pBWSw44Ouk.png', 'name': 'Production I.G', 'origin_country': 'JP'}]","[{'english_name': 'Japanese', 'iso_639_1': 'ja', 'name': '日本語'}]",Released,,"In humanity's distant future, two interstellar states-the monarchic Galactic Empire and the democratic Free Planets Alliance-are embroiled in a never-ending war. The story focuses on the exploits of rivals Reinhard von Müsel and Yang Wen Li as they rise to power and fame in the Galactic Empire and the Free Planets Alliance.",tt7401028,"[{'iso_3166_1': 'JP', 'name': 'Japan'}]",ja
391766,2016-06-10,Do Lafzon Ki Kahani,Do Lafzon Ki Kahani,0,0,128,3.319,7.0,11,False,,"[{'id': 18, 'name': 'Drama'}, {'id': 10749, 'name': 'Romance'}, {'id': 28, 'name': 'Action'}]","[{'id': 75203, 'logo_path': None, 'name': 'Dhiraj Motion Pictures', 'origin_country': ''}, {'id': 168743, 'logo_path': None, 'name': 'Deepak Tijori Films', 'origin_country': ''}, {'id': 153758, 'logo_path': None, 'name': 'Focus Motion Pictures', 'origin_country': ''}]","[{'english_name': 'Hindi', 'iso_639_1': 'hi', 'name': 'हिन्दी'}]",Released,Love never hurts...Love heals.,Centered on ex-mixed martial arts artist Sooraj and sculptor artist Jenny. Their fate intertwines when their past are revealed in their blooming relationship.,tt4857886,"[{'iso_3166_1': 'IN', 'name': 'India'}]",hi
69775,2011-07-07,मर्डर 2,Murder 2,0,0,127,3.286,5.7,46,False,"{'id': 484529, 'name': 'Murder Collection', 'poster_path': '/aKPlQwfmTmsPyssPh0387onFohl.jpg', 'backdrop_path': '/zKvn9nhlmGzWOTdEC4VPUXtEzoV.jpg'}","[{'id': 28, 'name': 'Action'}, {'id': 80, 'name': 'Crime'}, {'id': 18, 'name': 'Drama'}, {'id': 53, 'name': 'Thriller'}]","[{'id': 3749, 'logo_path': '/vSqS9ovkpql7VN1HwTYwR5KexrB.png', 'name': 'Vishesh Films', 'origin_country': 'IN'}, {'id': 15357, 'logo_path': '/uvaRT02pY9U8qLH8a9WwwAroDqr.png', 'name': 'Prime Focus', 'origin_country': 'IN'}]","[{'english_name': 'Hindi', 'iso_639_1': 'hi', 'name': 'हिन्दी'}]",Released,,A former police officer gets hired by a gangster to trace missing call girls and their abductor.,tt1918965,"[{'iso_3166_1': 'IN', 'name': 'India'}]",hi
451634,2016-04-21,Cracking the Shakespeare Code,Cracking the Shakespeare Code,0,0,125,3.28,7.0,5,False,,"[{'id': 99, 'name': 'Documentary'}, {'id': 36, 'name': 'History'}]","[{'id': 70000, 'logo_path': None, 'name': 'Arts Alliance', 'origin_country': ''}, {'id': 67731, 'logo_path': None, 'name': 'Videomaker', 'origin_country': 'NO'}]","[{'english_name': 'English', 'iso_639_1': 'en', 'name': 'English'}, {'english_name': 'Norwegian', 'iso_639_1': 'no', 'name': 'Norsk'}]",Released,The masonic ciphers hidden in Shakespeare and Renaissance art,"Norwegian researcher Petter Amundsen claims to have deciphered a secret code hidden in legendary playwright William Shakespeare's works that reveals a map leading to the location of certain treasures. British Shakespearean scholar Robert Crumpton embarks on a mission to prove he is spectacularly wrong. (A remake of “Shakespeare: The Hidden Truth,” including new discoveries.)",tt6992888,"[{'iso_3166_1': 'NO', 'name': 'Norway'}, {'iso_3166_1': 'GB', 'name': 'United Kingdom'}]",en
1032412,2022-12-16,Snow Day,Snow Day,0,0,77,3.204,6.5,21,False,,"[{'id': 10770, 'name': 'TV Movie'}, {'id': 10751, 'name': 'Family'}, {'id': 35, 'name': 'Comedy'}, {'id': 10402, 'name': 'Music'}]","[{'id': 2348, 'logo_path': '/m31fQvZJuUvAgxoqTiCGYFBfZYe.png', 'name': 'Nickelodeon Movies', 'origin_country': 'US'}, {'id': 188542, 'logo_path': None, 'name': 'Rotten Eggs Productions', 'origin_country': 'US'}, {'id': 6438, 'logo_path': '/hQVRii7CRnfG0rowSEc6ibt2Pke.png', 'name': 'Muse Entertainment', 'origin_country': 'CA'}]","[{'english_name': 'English', 'iso_639_1': 'en', 'name': 'English'}]",Released,Freeze the day.,"A pair of siblings make the most of a school snow day, while trying to avoid their nemesis, the Snowplowman.",tt23622516,"[{'iso_3166_1': 'US', 'name': 'United States of America'}]",en
144206,2010-12-24,Whistle and I'll Come to You,Whistle and I'll Come to You,0,0,52,3.2,5.8,18,False,,"[{'id': 27, 'name': 'Horror'}, {'id': 10770, 'name': 'TV Movie'}]","[{'id': 3324, 'logo_path': '/dqT3yOTlfJRmtvk52Ccd1O6dZ0A.png', 'name': 'BBC', 'origin_country': 'GB'}]","[{'english_name': 'English', 'iso_639_1': 'en', 'name': 'English'}]",Released,,"After placing his ailing wife Alice in a care home, elderly academic James Parkin goes to stay at a wintry out-of-season hotel which they used to visit together. But at night he seemingly becomes the victim of a ghostly revenge - but who is the avenger?",tt1795050,"[{'iso_3166_1': 'GB', 'name': 'United Kingdom'}]",en
58723,2011-01-15,காவலன்,Kaavalan,8400000,20000000,152,3.145,5.6,38,False,,"[{'id': 18, 'name': 'Drama'}, {'id': 10751, 'name': 'Family'}, {'id': 10749, 'name': 'Romance'}]",[],"[{'english_name': 'Tamil', 'iso_639_1': 'ta', 'name': 'தமிழ்'}]",Released,,"Bhoominathan aka Bhoomi is introduced to us as a person who gets into many local fights. Worried about his future, his family sends him to Muthuramalingam (Raj Kiran), a much respected personality in his place Semmanur, to put Bhoomi's life on the right track. But things don't go as planned. Muthuramalingam's adversary threatens to kill his daughter Meera (Asin) as a revenge against his own daughter's fate. So Bhoomi is given the job of Meera's bodyguard at college. Meera goes to college with her friend Madhu but is irritated by Bhoomi's presence everywhere. So she devises a plan.",tt1821478,"[{'iso_3166_1': 'IN', 'name': 'India'}]",ta
168114,2013-02-14,मर्डर 3,Murder 3,0,0,124,3.103,3.7,26,False,"{'id': 484529, 'name': 'Murder Collection', 'poster_path': '/aKPlQwfmTmsPyssPh0387onFohl.jpg', 'backdrop_path': '/zKvn9nhlmGzWOTdEC4VPUXtEzoV.jpg'}","[{'id': 53, 'name': 'Thriller'}, {'id': 18, 'name': 'Drama'}, {'id': 9648, 'name': 'Mystery'}]","[{'id': 3749, 'logo_path': '/vSqS9ovkpql7VN1HwTYwR5KexrB.png', 'name': 'Vishesh Films', 'origin_country': 'IN'}]","[{'english_name': 'Hindi', 'iso_639_1': 'hi', 'name': 'हिन्दी'}]",Released,This Valentine... Love Will be Murdered,"A hot-shot fashion and wildlife photographer Vikram gets into a relationship with Nisha. She moves in with him in his palatial house outside of the city. The old world house, made decades ago is as beautiful as it is scary. It holds many secrets which Nisha is soon to unearth; of the life of the man who made it and of Vikram, who is dealing with the mysterious disappearance of his former girlfriend Roshni",tt2429640,"[{'iso_3166_1': 'IN', 'name': 'India'}]",hi
1014390,2023-06-09,Bloody Daddy,Bloody Daddy,0,0,122,3.041,5.9,27,False,,"[{'id': 28, 'name': 'Action'}, {'id': 80, 'name': 'Crime'}, {'id': 53, 'name': 'Thriller'}]","[{'id': 132288, 'logo_path': None, 'name': 'AAZ Films', 'origin_country': ''}, {'id': 132287, 'logo_path': None, 'name': 'Offside Entertainment', 'origin_country': ''}, {'id': 115477, 'logo_path': '/6CkBjiSlfAJFaMjwB44ILbOhFuV.png', 'name': 'Jio Studios', 'origin_country': 'IN'}, {'id': 179468, 'logo_path': None, 'name': 'The Vermillion World', 'origin_country': 'IN'}]","[{'english_name': 'Hindi', 'iso_639_1': 'hi', 'name': 'हिन्दी'}]",Released,One man. One job. One hell of a night.,"Sumair Azad, a dirty cop and his friend, Jaggi, steal Sikandar Chowdhary's cocaine bag. As a result, Sikandar kidnaps Sumair's son, but things take a turn when he loses the cocaine bag as he faces off Gurugram’s drug lords, a crime boss, murderous narcs and straight cops on one fateful night.",tt27501039,"[{'iso_3166_1': 'IN', 'name': 'India'}, {'iso_3166_1': 'AE', 'name': 'United Arab Emirates'}]",hi
570657,2019-02-14,Громкая связь,Loudspeaker,0,0,96,3.017,6.6,51,False,"{'id': 122776, 'name': 'Kvartet I Collection', 'poster_path': '/rleIVHx2kG8lYfHUsBh3CkD4Jnc.jpg', 'backdrop_path': '/6xWR4pUav8UKXqkCdgqgZTIk1mg.jpg'}","[{'id': 35, 'name': 'Comedy'}]","[{'id': 54307, 'logo_path': '/c6zhUONn8UMP6vdDHXrxpGxuzh2.png', 'name': 'Mars Media Entertainment', 'origin_country': 'RU'}]","[{'english_name': 'Russian', 'iso_639_1': 'ru', 'name': 'Pусский'}]",Released,,"Gathered together in a country house, seven friends play an entertaining game, in which participants have to read aloud all of their incoming text messages, and can only answer their calls using loudspeaker mode. They can’t even imagine what stunning surprises about each other they will discover.",tt9624470,"[{'iso_3166_1': 'RU', 'name': 'Russia'}]",ru
1122978,2023-06-28,Why Do You Love Me,Why Do You Love Me,0,0,83,3.007,6.8,3,False,,"[{'id': 35, 'name': 'Comedy'}, {'id': 18, 'name': 'Drama'}]","[{'id': 84442, 'logo_path': '/26lMqyZAFqRu9UFiYszYX3kHOo2.png', 'name': 'Max Pictures', 'origin_country': 'ID'}, {'id': 72761, 'logo_path': '/ikOKXFh7K4Hc9ywiqCI9humBHmg.png', 'name': 'Falcon Pictures', 'origin_country': 'ID'}]","[{'english_name': 'Indonesian', 'iso_639_1': 'id', 'name': 'Bahasa indonesia'}]",Released,,"Baskara, a paraplegic with paralyzed nerves, Danton with a brain tumor that paralyzes his lower body, and Miko with retinitis pigmentosa, which has made him completely blind. But they are not going to let anything stand in their way, hellbent to finally losing their virginity.",tt27950276,"[{'iso_3166_1': 'ID', 'name': 'Indonesia'}]",id
371425,2016-02-04,பெங்களூர் நாட்கள்,Bangalore Naatkal,0,0,156,2.986,5.8,19,False,,"[{'id': 18, 'name': 'Drama'}, {'id': 10751, 'name': 'Family'}, {'id': 10749, 'name': 'Romance'}]","[{'id': 74236, 'logo_path': None, 'name': 'Bommarillu Bhaskar Cinema', 'origin_country': ''}, {'id': 12299, 'logo_path': '/lZn0b4iiw6ucIn0dUC5MIKlknAU.png', 'name': 'PVP Cinema', 'origin_country': 'IN'}]","[{'english_name': 'Tamil', 'iso_639_1': 'ta', 'name': 'தமிழ்'}]",Released,,"Three cousins, Arjun, Divya and Kannan, relocate to Bangalore for various reasons. However, they face many challenges which change their lives forever.",tt5328784,"[{'iso_3166_1': 'IN', 'name': 'India'}]",ta
