id,release_date,original_title,title,budget,revenue,runtime,popularity,vote_average,vote_count,adult,belongs_to_collection,genres,production_companies,spoken_languages,status,tagline,overview,imdb_id,production_countries,original_language
92182,2011-01-21,Silent House,Silent House,2000000,13101672,85,8.971,5.4,402,False,,"[{'id': 27, 'name': 'Horror'}, {'id': 9648, 'name': 'Mystery'}, {'id': 18, 'name': 'Drama'}]","[{'id': 6930, 'logo_path': '/2G6LAOzXjNDWOgqL63C3xFsEkrI.png', 'name': 'Elle Driver', 'origin_country': 'FR'}, {'id': 25904, 'logo_path': None, 'name': 'Tazora Films', 'origin_country': ''}]","[{'english_name': 'English', 'iso_639_1': 'en', 'name': 'English'}, {'english_name': 'French', 'iso_639_1': 'fr', 'name': 'Français'}]",Released,"Experience 88 minutes of real fear, captured In real time","Sarah returns with her father and uncle to fix up the family's longtime summerhouse after it was violated by squatters in the off-season. As they work in the dark, Sarah begins to hear sounds from within the walls of the boarded-up building. Although she barely remembers the place, Sarah senses the past may still haunt the home.",tt1767382,"[{'iso_3166_1': 'FR', 'name': 'France'}, {'iso_3166_1': 'US', 'name': 'United States of America'}]",en
456529,2019-08-23,Jacob's Ladder,Jacob's Ladder,0,0,89,8.909,4.282,78,False,,"[{'id': 27, 'name': 'Horror'}, {'id': 9648, 'name': 'Mystery'}, {'id': 53, 'name': 'Thriller'}]","[{'id': 49968, 'logo_path': '/gz2hSoMkvMJdTMgCLFGRJErPwXY.png', 'name': 'Will Packer Productions', 'origin_country': 'US'}, {'id': 77471, 'logo_path': None, 'name': 'Gaeta / Rosenzweig Films', 'origin_country': 'US'}, {'id': 8533, 'logo_path': '/5jxaT7zoJKtnwqxniiJ9iJLsJru.png', 'name': 'LD Entertainment', 'origin_country': 'US'}]","[{'english_name': 'English', 'iso_639_1': 'en', 'name': 'English'}]",Released,,"After losing his brother in combat, Jacob Singer returns home from Afghanistan -- only to be pulled into a mind-twisting state of paranoia. Singer soon realizes that his sibling is alive but life is not what it seems.",tt3016748,"[{'iso_3166_1': 'US', 'name': 'United States of America'}]",en
482273,2020-05-08,Valley Girl,Valley Girl,0,0,102,8.884,5.676,94,False,,"[{'id': 35, 'name': 'Comedy'}, {'id': 10749, 'name': 'Romance'}, {'id': 10402, 'name': 'Music'}]","[{'id': 31835, 'logo_path': None, 'name': 'Sneak Preview Productions', 'origin_country': ''}, {'id': 21, 'logo_path': '/usUnaYV6hQnlVAXP6r4HwrlLFPG.png', 'name': 'Metro-Goldwyn-Mayer', 'origin_country': 'US'}, {'id': 134559, 'logo_path': None, 'name': 'Orion Classics', 'origin_country': ''}, {'id': 41, 'logo_path': '/xAot4SSOIHiWQ2WEnVXYGR1lce9.png', 'name': 'Orion Pictures', 'origin_country': 'US'}]","[{'english_name': 'English', 'iso_639_1': 'en', 'name': 'English'}]",Released,The awesomest love story ever told.,"Set to a new wave '80s soundtrack, a pair of young lovers from different backgrounds defy their parents and friends to stay together.",tt1266036,"[{'iso_3166_1': 'US', 'name': 'United States of America'}]",en
800823,2021-07-08,A todo tren: destino Asturias,The Kids Are Alright: Destination Asturias,5300000,9600000,89,8.747,5.622,147,False,"{'id': 1098551, 'name': 'A todo tren - Colección', 'poster_path': '/jZiRqgHPvzTxFqB1CEtZOVESZ4E.jpg', 'backdrop_path': '/hEO6Awu1eX5uh7p7oCZZTZyE4QV.jpg'}","[{'id': 35, 'name': 'Comedy'}, {'id': 10751, 'name': 'Family'}]","[{'id': 91991, 'logo_path': '/ngEpBkH7nkFfyCCtvGhhIzPS1xF.png', 'name': 'Bowfinger', 'origin_country': 'ES'}, {'id': 29566, 'logo_path': '/wHbtRtUnXGNzX0riQIpq1fcgueq.png', 'name': 'Atresmedia', 'origin_country': 'ES'}, {'id': 67412, 'logo_path': '/vgVqq5hunVs8GN5Je9d9rG7Q2NU.png', 'name': 'Movistar+', 'origin_country': 'ES'}, {'id': 141786, 'logo_path': None, 'name': 'Buendía Estudios', 'origin_country': 'ES'}, {'id': 80408, 'logo_path': '/e2LblDStah74O4c9E6o1U0qv0Oa.png', 'name': 'Glow', 'origin_country': 'ES'}]","[{'english_name': 'Spanish', 'iso_639_1': 'es', 'name': 'Español'}]",Released,A hilarious adventure (as long as it doesn't happen to you),"When Ricardo, a responsible father, decides to personally take his son to a camp in Asturias, other parents propose that he should also take care of their children. When the train is about to leave, Felipe, a flamboyant individual and grandfather of two of the children, shows up at the station.",tt13150080,"[{'iso_3166_1': 'ES', 'name': 'Spain'}]",es
277934,2014-03-14,Sadece Sen,Only You,0,3655907,105,8.427,7.4,101,False,,"[{'id': 28, 'name': 'Action'}, {'id': 18, 'name': 'Drama'}, {'id': 10749, 'name': 'Romance'}]",[],"[{'english_name': 'Turkish', 'iso_639_1': 'tr', 'name': 'Türkçe'}]",Released,,The passionate love between a former boxer and a beautiful blind woman.,tt3477480,"[{'iso_3166_1': 'TR', 'name': 'Turkey'}]",tr
852592,2022-06-15,Centauro,Centauro,0,0,89,8.395,6.2,122,False,,"[{'id': 28, 'name': 'Action'}, {'id': 80, 'name': 'Crime'}, {'id': 53, 'name': 'Thriller'}]","[{'id': 157700, 'logo_path': None, 'name': 'Borsalino Productions', 'origin_country': ''}]","[{'english_name': 'Spanish', 'iso_639_1': 'es', 'name': 'Español'}]",Released,,"Rafa's hooked on the pure, fiery feelings he gets from speed racing, but when his kid's mom gets mixed up with drug dealers, he burns rubber to save her.",tt13479592,"[{'iso_3166_1': 'ES', 'name': 'Spain'}]",es
548352,2018-10-31,완벽한 타인,Intimate Strangers,0,0,115,8.37,7.191,47,False,,"[{'id': 18, 'name': 'Drama'}, {'id': 35, 'name': 'Comedy'}]","[{'id': 7819, 'logo_path': '/ghFZAt4edln0M7BzDExyYMzUGX1.png', 'name': 'Lotte Entertainment', 'origin_country': 'KR'}, {'id': 86981, 'logo_path': '/8FwCT7KohE031xFLBeRMZlbuzSr.png', 'name': 'SLL', 'origin_country': 'KR'}, {'id': 113553, 'logo_path': '/asYwlV8bdPaQr3iQN7k01llcFDG.png', 'name': 'Film Monster', 'origin_country': 'KR'}, {'id': 172185, 'logo_path': '/u89w62EzN9WxzSxFEfHaZ09LXc7.png', 'name': 'DramaHouse', 'origin_country': 'KR'}, {'id': 7036, 'logo_path': '/javbyY0ZCvlFJtly3tpZqf2NwLX.png', 'name': 'CJ Entertainment', 'origin_country': 'KR'}]","[{'english_name': 'Korean', 'iso_639_1': 'ko', 'name': '한국어/조선말'}]",Released,The secret inside your phone will be revealed!,A group of people meet for the first time in a long time and play a game that reveals each other's secrets.,tt8986842,"[{'iso_3166_1': 'KR', 'name': 'South Korea'}]",ko
397520,2016-02-15,Anne of Green Gables,Anne of Green Gables,0,127345,85,8.369,7.2,126,False,"{'id': 653726, 'name': ""L.M. Montgomery's Anne of Green Gables Collection"", 'poster_path': '/epT7TS8YKGrV8IkD9JxNdRyIKdM.jpg', 'backdrop_path': '/3EVtuNEeH0C2BqYi5BimKnT6ce8.jpg'}","[{'id': 18, 'name': 'Drama'}, {'id': 10751, 'name': 'Family'}, {'id': 10770, 'name': 'TV Movie'}]","[{'id': 5743, 'logo_path': '/y8JaCRhsEz4ipl7MWE0ErxWVPYN.png', 'name': 'Breakthrough Entertainment', 'origin_country': 'CA'}]","[{'english_name': 'English', 'iso_639_1': 'en', 'name': 'English'}]",Released,,"A retelling of L.M. Montgomery's story of Anne Shirley, an orphan who is accidentally sent to a couple looking to adopt a boy instead",tt4820224,"[{'iso_3166_1': 'CA', 'name': 'Canada'}]",en
659994,2020-10-15,Rams,Rams,0,4155492,119,8.301,6.4,74,False,,"[{'id': 18, 'name': 'Drama'}, {'id': 35, 'name': 'Comedy'}]","[{'id': 13675, 'logo_path': '/tHVRMDKKx4NR3lAgZZlthCMEJFf.png', 'name': 'Village Roadshow Entertainment', 'origin_country': 'AU'}, {'id': 55254, 'logo_path': None, 'name': 'WBMC', 'origin_country': 'AU'}]","[{'english_name': 'English', 'iso_639_1': 'en', 'name': 'English'}]",Released,"Where there's a wool, there's a way","In remote Western Australia, two estranged farmer brothers, Colin and Les, are at war. But when Les' prize ram is diagnosed with a rare and lethal illness, authorities order a purge of every sheep in the valley—so the brothers must work together to reunite their family, save their herd, and bring their community back together.",tt8737608,"[{'iso_3166_1': 'AU', 'name': 'Australia'}]",en
280690,2014-07-25,Kick,Kick,22000000,55000000,146,8.262,5.7,149,False,,"[{'id': 28, 'name': 'Action'}, {'id': 10749, 'name': 'Romance'}, {'id': 35, 'name': 'Comedy'}, {'id': 80, 'name': 'Crime'}]","[{'id': 60536, 'logo_path': '/chMIfiURhqvr6eWCrzxIwuaWVeN.png', 'name': 'Nadiadwala Grandson Entertainment', 'origin_country': 'IN'}, {'id': 2320, 'logo_path': '/nSAXfUCy16cNRiPlBMHeb700t9p.png', 'name': 'UTV Motion Pictures', 'origin_country': 'IN'}]","[{'english_name': 'Hindi', 'iso_639_1': 'hi', 'name': 'हिन्दी'}]",Released,,"An adrenaline junkie walks away from a whirlwind romance and embraces a new life as a thief, though he soon finds himself pursued by veteran police officer and engaged in a turf war with a local gangster.",tt2372222,"[{'iso_3166_1': 'IN', 'name': 'India'}]",hi
1053419,2022-12-20,Reviviendo la Navidad,A Not So Merry Christmas,0,0,99,8.256,6.7,154,False,,"[{'id': 35, 'name': 'Comedy'}, {'id': 10751, 'name': 'Family'}]",[],"[{'english_name': 'Spanish', 'iso_639_1': 'es', 'name': 'Español'}]",Released,,"A curse is placed on grinchy Chuy, who wakes up to find he's lived a full year, but is doomed to remember only Christmas Day. Every year. From now on.",tt23808016,"[{'iso_3166_1': 'MX', 'name': 'Mexico'}]",es
56180,2010-08-25,La casa muda,The Silent House,6000,0,86,8.131,5.453,138,False,,"[{'id': 18, 'name': 'Drama'}, {'id': 27, 'name': 'Horror'}, {'id': 9648, 'name': 'Mystery'}, {'id': 53, 'name': 'Thriller'}]","[{'id': 6930, 'logo_path': '/2G6LAOzXjNDWOgqL63C3xFsEkrI.png', 'name': 'Elle Driver', 'origin_country': 'FR'}, {'id': 13073, 'logo_path': None, 'name': 'Tokio Films', 'origin_country': ''}]","[{'english_name': 'Spanish', 'iso_639_1': 'es', 'name': 'Español'}]",Released,Real Fear In Real Time,"Laura and her father Wilson arrive at a cottage off the beaten path in order to repair it since its owner will soon put the house on sale. They will spend the night there in order to start the repairs the following morning. Everything seems to go on smoothly until Laura hears a sound that comes from outside and gets louder and louder in the upper floor of the house. Wilson goes up to see what is going on while she remains downstairs on her own waiting for her father to come down. The plot is based on a true story that occurred in the 1940s in a small village in Uruguay. La casa muda focuses on the last seventy eight minutes, second by second, as Laura tries to leave the house unharmed and discovers the dark secret it hides.",tt1646973,"[{'iso_3166_1': 'UY', 'name': 'Uruguay'}]",es
667869,2020-11-03,La vita davanti a sé,The Life Ahead,0,0,94,8.073,6.7,544,False,,"[{'id': 18, 'name': 'Drama'}]","[{'id': 7699, 'logo_path': '/fHasfMWVRXGOmao2p1ijwicv9f4.png', 'name': 'Palomar', 'origin_country': 'IT'}, {'id': 66478, 'logo_path': '/u7WmMkfo9MqsqfD5cuDAbd0u1qY.png', 'name': 'Artemis Rising', 'origin_country': 'US'}]","[{'english_name': 'Hebrew', 'iso_639_1': 'he', 'name': 'עִבְרִית'}, {'english_name': 'Italian', 'iso_639_1': 'it', 'name': 'Italiano'}, {'english_name': 'Spanish', 'iso_639_1': 'es', 'name': 'Español'}]",Released,The bonds we forge can change us forever.,"In seaside Italy, a Holocaust survivor with a daycare business takes in a 12-year-old street kid who recently robbed her.",tt10627584,"[{'iso_3166_1': 'IT', 'name': 'Italy'}, {'iso_3166_1': 'US', 'name': 'United States of America'}]",it
965606,2023-03-30,भोला,Bholaa,0,0,144,7.858,6.0,26,False,,"[{'id': 28, 'name': 'Action'}, {'id': 12, 'name': 'Adventure'}, {'id': 80, 'name': 'Crime'}, {'id': 53, 'name': 'Thriller'}]","[{'id': 16429, 'logo_path': '/8VoXlyno166HSIwMilMLtmb9EBk.png', 'name': 'Dream Warrior Pictures', 'origin_country': 'IN'}, {'id': 3522, 'logo_path': '/d3u51JgEP5KwPfxS13ocqvtzZeX.png', 'name': 'T-Series', 'origin_country': 'IN'}, {'id': 128365, 'logo_path': '/9UnLNX7mfB1FzieJcjA9xyni8wY.png', 'name': 'Ajay Devgn FFilms', 'origin_country': 'IN'}, {'id': 7294, 'logo_path': '/kK4PRgceWp9KNrycD8xx8seWxYU.png', 'name': 'Reliance Entertainment', 'origin_country': 'IN'}, {'id': 63997, 'logo_path': '/9uKga6AVuuGzVszeQgjqVYdqWw9.png', 'name': 'PVR Inox Pictures', 'origin_country': 'IN'}]","[{'english_name': 'English', 'iso_639_1': 'en', 'name': 'English'}, {'english_name': 'Hindi', 'iso_639_1': 'hi', 'name': 'हिन्दी'}]",Released,,"An ex-convict must undertake a perilous, violent journey in order to meet his daughter after ten years of imprisonment.",tt15302222,"[{'iso_3166_1': 'IN', 'name': 'India'}]",hi
58959,2010-09-16,무적자,A Better Tomorrow,8700000,0,124,7.724,6.2,57,False,,"[{'id': 18, 'name': 'Drama'}, {'id': 28, 'name': 'Action'}, {'id': 53, 'name': 'Thriller'}]","[{'id': 2812, 'logo_path': None, 'name': 'Lion Rock Productions', 'origin_country': 'US'}, {'id': 7036, 'logo_path': '/javbyY0ZCvlFJtly3tpZqf2NwLX.png', 'name': 'CJ Entertainment', 'origin_country': 'KR'}, {'id': 198393, 'logo_path': None, 'name': 'Fingerprint Pictures', 'origin_country': ''}, {'id': 81594, 'logo_path': None, 'name': 'Michigan Venture Capital', 'origin_country': 'KR'}, {'id': 78353, 'logo_path': None, 'name': 'Fortune Star Films Co. (H.K.)', 'origin_country': ''}, {'id': 198395, 'logo_path': None, 'name': 'Zuzac', 'origin_country': 'TH'}, {'id': 198396, 'logo_path': None, 'name': 'Formula Entertainment', 'origin_country': ''}, {'id': 74216, 'logo_path': '/gNBRUzI4CI9cKfNDsR9KOdlkEj6.png', 'name': 'Busan Film Commission', 'origin_country': 'KR'}]","[{'english_name': 'Korean', 'iso_639_1': 'ko', 'name': '한국어/조선말'}]",Released,Brothers. Enemies. Killers.,Two brothers on different sides of the law go head-to-head.,tt1138442,"[{'iso_3166_1': 'HK', 'name': 'Hong Kong'}, {'iso_3166_1': 'KR', 'name': 'South Korea'}, {'iso_3166_1': 'TH', 'name': 'Thailand'}, {'iso_3166_1': 'US', 'name': 'United States of America'}]",ko
377448,2016-10-20,The Rocky Horror Picture Show: Let's Do the Time Warp Again,The Rocky Horror Picture Show: Let's Do the Time Warp Again,20000000,0,88,7.615,5.069,204,False,,"[{'id': 10770, 'name': 'TV Movie'}, {'id': 35, 'name': 'Comedy'}, {'id': 878, 'name': 'Science Fiction'}, {'id': 14, 'name': 'Fantasy'}, {'id': 27, 'name': 'Horror'}]","[{'id': 75060, 'logo_path': '/iS6njjhHMBYIcwcBrjNfd53dyXQ.png', 'name': 'The Jackal Group', 'origin_country': 'US'}, {'id': 86063, 'logo_path': '/9Juyx6JYvie3Kx24PGCDfNRYp9Y.png', 'name': 'Fox 21 Television Studios', 'origin_country': 'US'}, {'id': 115483, 'logo_path': None, 'name': 'Ode Visuals', 'origin_country': ''}]","[{'english_name': 'English', 'iso_639_1': 'en', 'name': 'English'}]",Released,Transcend your expectations,"Sweethearts Brad and Janet, stuck with a flat tire during a storm, discover the eerie mansion of Dr. Frank-N-Furter, a gender ambiguous scientist. As their innocence is lost, Brad and Janet meet a houseful of wild characters, including a rocking biker and a creepy butler. Through elaborate dances and rock songs, Frank-N-Furter unveils her latest creation: a muscular man named 'Rocky'.",tt1267299,"[{'iso_3166_1': 'US', 'name': 'United States of America'}]",en
199578,2013-10-15,Patrick,Patrick,0,0,96,7.613,4.9,166,False,,"[{'id': 27, 'name': 'Horror'}, {'id': 878, 'name': 'Science Fiction'}, {'id': 53, 'name': 'Thriller'}]","[{'id': 7584, 'logo_path': '/eGkfvvyf4fJTvBUR1xt1669IPA3.png', 'name': 'Screen Australia', 'origin_country': 'AU'}, {'id': 17526, 'logo_path': None, 'name': 'F.G. Film Productions', 'origin_country': 'AU'}]","[{'english_name': 'English', 'iso_639_1': 'en', 'name': 'English'}]",Released,Cruel. Controlling. Comatose.,"Patrick lays comatose in a small private hospital, his only action being his involuntary spitting. When a pretty young nurse, just separated from her husband, begins work at the hospital, she senses that Patrick is communicating with her, and he seems to be using his psychic powers to manipulate events in her life.",tt2147459,"[{'iso_3166_1': 'AU', 'name': 'Australia'}]",en
575754,2019-06-26,비스트,The Beast,0,0,130,7.59,6.6,85,False,,"[{'id': 80, 'name': 'Crime'}, {'id': 28, 'name': 'Action'}, {'id': 53, 'name': 'Thriller'}, {'id': 9648, 'name': 'Mystery'}]","[{'id': 106996, 'logo_path': '/stmGVs6UmgfqE9BYNB5lXjy5gQm.png', 'name': 'Studio & New', 'origin_country': 'KR'}, {'id': 20064, 'logo_path': '/2In7Heq6DuXDjOwPmJqHWkpohaL.png', 'name': 'Next Entertainment World', 'origin_country': 'KR'}]","[{'english_name': 'Korean', 'iso_639_1': 'ko', 'name': '한국어/조선말'}]",Released,Who is the beast?,Two rival detectives with different methods try to solve the murder of a missing girl after discovering her mutilated body in the tidelands of Incheon.,tt10530286,"[{'iso_3166_1': 'KR', 'name': 'South Korea'}]",ko
215180,2012-08-25,ワンピースエピソード・オブ・ナミ～航海士の涙と仲間の絆～,One Piece Episode of Nami: Tears of a Navigator and the Bonds of Friends,0,0,105,7.586,6.906,48,False,,"[{'id': 28, 'name': 'Action'}, {'id': 16, 'name': 'Animation'}, {'id': 18, 'name': 'Drama'}]","[{'id': 5542, 'logo_path': '/ayE4LIqoAWotavo7xdvYngwqGML.png', 'name': 'Toei Animation', 'origin_country': 'JP'}]","[{'english_name': 'Japanese', 'iso_639_1': 'ja', 'name': '日本語'}]",Released,,"After Nami steals the Going Merry, Roronoa Zoro, Usopp, and later Monkey D. Luffy and Sanji (along with Johnny and Yosaku) set after her and wind up in Cocoyasi Village, Nami's hometown ruled by the tyrannical fishman Arlong. It is here that Nami's past and true motives come to light.",tt2598466,"[{'iso_3166_1': 'JP', 'name': 'Japan'}]",ja
800085,2023-01-27,Lobo Feroz,Ferocious Wolf,0,0,105,7.54,7.0,60,False,,"[{'id': 18, 'name': 'Drama'}, {'id': 53, 'name': 'Thriller'}]","[{'id': 91991, 'logo_path': '/ngEpBkH7nkFfyCCtvGhhIzPS1xF.png', 'name': 'Bowfinger', 'origin_country': 'ES'}, {'id': 29240, 'logo_path': '/qz14qTCqR1KdkOGFsP1DQ4LcmI3.png', 'name': 'Mother Superior', 'origin_country': 'UY'}, {'id': 149885, 'logo_path': None, 'name': 'Film Shark', 'origin_country': ''}, {'id': 149886, 'logo_path': '/oDG7mNqzGZGRI8Q4qIAPOS0wdh4.png', 'name': 'Esto También Pasará', 'origin_country': 'ES'}, {'id': 52270, 'logo_path': None, 'name': 'Basque Films', 'origin_country': 'ES'}, {'id': 149887, 'logo_path': None, 'name': 'Lobo Feroz AIE', 'origin_country': ''}]","[{'english_name': 'Spanish', 'iso_639_1': 'es', 'name': 'Español'}]",Released,,"A detective on trail of a suspected child killer, was arrested for the crime, but was allowed to walk free after a clerical error. The detective enlists the mother of the murdered child to exact a justice the legal system can't provide.",tt14118246,"[{'iso_3166_1': 'ES', 'name': 'Spain'}, {'iso_3166_1': 'UY', 'name': 'Uruguay'}]",es
74945,2011-09-21,La Nouvelle Guerre des boutons,War of the Buttons,0,15000000,100,7.539,5.969,469,False,,"[{'id': 12, 'name': 'Adventure'}, {'id': 10751, 'name': 'Family'}]","[{'id': 1992, 'logo_path': '/tGYQyvkKTqAEXidVisQ5FDipKAP.png', 'name': 'La Petite Reine', 'origin_country': 'FR'}]","[{'english_name': 'French', 'iso_639_1': 'fr', 'name': 'Français'}]",Released,The French Resistance came in all shapes and sizes.,"Occupied France; Lebrac leads a play war between two rival kid gangs, but a girl he likes, who's Jewish, is in danger of being discovered by local Nazi sympathisers. Lebrac and the village must now respond to the reality of what's happening.",tt1837587,"[{'iso_3166_1': 'FR', 'name': 'France'}]",fr
454417,2017-09-25,Unhinged,Unhinged,0,0,93,7.517,5.3,50,False,,"[{'id': 27, 'name': 'Horror'}]","[{'id': 111974, 'logo_path': '/972APERrz9kelCZtUJdfSJd1u4n.png', 'name': 'ChampDog Films', 'origin_country': 'GB'}, {'id': 84624, 'logo_path': '/mY4SMEplDeqrLF2kBLShp4qJSvK.png', 'name': 'Proportion Productions', 'origin_country': 'GB'}]","[{'english_name': 'English', 'iso_639_1': 'en', 'name': 'English'}]",Released,Something lurks in the attic...,"Four American best friends decide to take the back roads travelling to a wedding in England, on their way a deadly secret forces the girls to be stranded in the woods, where they discover a house occupied by Miss Perkins.",tt5940342,"[{'iso_3166_1': 'GB', 'name': 'United Kingdom'}]",en
159128,2013-09-27,We Are What We Are,We Are What We Are,0,81381,105,7.49,5.8,547,False,,"[{'id': 18, 'name': 'Drama'}, {'id': 27, 'name': 'Horror'}, {'id': 53, 'name': 'Thriller'}]","[{'id': 2341, 'logo_path': None, 'name': 'Belladonna Productions', 'origin_country': 'US'}, {'id': 10949, 'logo_path': '/2JOR75Gaz14Vzim0XSTSCmGFYsD.png', 'name': 'Memento Films International', 'origin_country': 'FR'}, {'id': 28360, 'logo_path': '/juWn38bElYfPvCCu8OUR1ovDBbO.png', 'name': 'Paradise City', 'origin_country': 'FR'}, {'id': 137386, 'logo_path': None, 'name': 'The Zoo', 'origin_country': ''}, {'id': 74006, 'logo_path': None, 'name': 'Uncorked Productions', 'origin_country': ''}, {'id': 20313, 'logo_path': None, 'name': 'Venture Forth', 'origin_country': ''}, {'id': 137387, 'logo_path': None, 'name': 'We Are What We Are', 'origin_country': ''}]","[{'english_name': 'English', 'iso_639_1': 'en', 'name': 'English'}]",Released,Blood is the strongest bond.,"The Parkers, reclusive people who cling to ancient customs, find their secret lives threatened when a torrential downpour and the death of the family matriarch forces daughters Iris and Rose to assume special responsibilities.",tt2309021,"[{'iso_3166_1': 'FR', 'name': 'France'}, {'iso_3166_1': 'US', 'name': 'United States of America'}]",en
364902,2015-10-31,The Dresser,The Dresser,0,0,109,7.484,6.206,80,False,,"[{'id': 18, 'name': 'Drama'}, {'id': 10770, 'name': 'TV Movie'}]","[{'id': 3324, 'logo_path': '/dqT3yOTlfJRmtvk52Ccd1O6dZ0A.png', 'name': 'BBC', 'origin_country': 'GB'}, {'id': 19089, 'logo_path': '/6uZ9wF94eMZaHmDayhxMy7q3ndo.png', 'name': 'Playground Entertainment', 'origin_country': 'US'}]","[{'english_name': 'English', 'iso_639_1': 'en', 'name': 'English'}]",Released,,"One fateful night in a small English regional theatre during World War II a troupe of touring actors stage a production of Shakespeares King Lear. Bombs are falling, sirens are wailing, the curtain is up in an hour but the actor/manager Sir who is playing Lear is nowhere to be seen. His dresser Norman must scramble to keep the production alive but will Sir turn up in time and if he does will he be able to perform that night? The Dresser is a wickedly funny and deeply moving story of friendship and loyalty as Sir reflects on his lifelong accomplishments and seeks to reconcile his turbulent friendships with those in his employ before the final curtain.",tt4247618,"[{'iso_3166_1': 'GB', 'name': 'United Kingdom'}]",en
228355,2013-10-16,Boss,Boss,0,0,143,7.402,5.457,70,False,,"[{'id': 28, 'name': 'Action'}, {'id': 35, 'name': 'Comedy'}, {'id': 18, 'name': 'Drama'}]",[],"[{'english_name': 'Hindi', 'iso_639_1': 'hi', 'name': 'हिन्दी'}]",Released,The BOSS is here.,"Disowned by his father as a boy, Surya is taken in by a crime boss. When his brother Shiv is wrongly imprisoned, his father pleads for Surya's help.",tt2571140,"[{'iso_3166_1': 'IN', 'name': 'India'}]",hi
695958,2021-02-26,द गर्ल ऑन द ट्रेन,The Girl on the Train,0,0,128,7.35,5.9,75,False,,"[{'id': 18, 'name': 'Drama'}, {'id': 53, 'name': 'Thriller'}]","[{'id': 7294, 'logo_path': '/kK4PRgceWp9KNrycD8xx8seWxYU.png', 'name': 'Reliance Entertainment', 'origin_country': 'IN'}]","[{'english_name': 'Hindi', 'iso_639_1': 'hi', 'name': 'हिन्दी'}]",Released,,"When a voyeuristic divorcee fixates on the lives of a perfect couple a far, she soon gets embroiled in a murder mystery that unfolds revealing truths about her own life.",tt8907992,"[{'iso_3166_1': 'IN', 'name': 'India'}]",hi
429698,2017-02-02,Pork Pie,Pork Pie,0,847307,105,7.188,6.6,57,False,,"[{'id': 28, 'name': 'Action'}, {'id': 35, 'name': 'Comedy'}, {'id': 80, 'name': 'Crime'}]","[{'id': 55251, 'logo_path': None, 'name': 'Southern Light Films', 'origin_country': 'AU'}, {'id': 17761, 'logo_path': '/fvvFNvMUsRGTP1MUqWQKHMMc8a1.png', 'name': 'Four Knights Film', 'origin_country': 'NZ'}]","[{'english_name': 'English', 'iso_639_1': 'en', 'name': 'English'}]",Released,"The misfits, the mini, the mayhem.","A trio of accidental outlaws travel the length of New Zealand, protesting conformity and chasing lost love, with a posse of cops and a media frenzy in pursuit.",tt4834220,"[{'iso_3166_1': 'NZ', 'name': 'New Zealand'}]",en
883768,2022-06-03,機動戦士ガンダム ククルス・ドアンの島,Mobile Suit Gundam: Cucuruz Doan's Island,0,0,109,7.084,6.6,16,False,,"[{'id': 16, 'name': 'Animation'}, {'id': 18, 'name': 'Drama'}, {'id': 878, 'name': 'Science Fiction'}, {'id': 28, 'name': 'Action'}]","[{'id': 173132, 'logo_path': '/yV9EORK2ZwdMg45K10PuVh6LlM3.png', 'name': 'Bandai Namco Filmworks', 'origin_country': 'JP'}, {'id': 192, 'logo_path': '/93eAKlnQecDdMtucfOprzcjMw9V.png', 'name': 'Shochiku', 'origin_country': 'JP'}, {'id': 3153, 'logo_path': '/yKZ9UarLSu9Y4Gpw33nKRQOPM7z.png', 'name': 'SUNRISE', 'origin_country': 'JP'}]","[{'english_name': 'Japanese', 'iso_639_1': 'ja', 'name': '日本語'}]",Released,,"After a covert mission goes wrong, Mobile Suit pilot Amuro Ray and his comrades are stranded on a remote island. The battalion was sent to a land called the Island of No Return to clear off any enemy forces, only to find a group of children and an enemy mecha attack. Now Amuro must find a way for them all to escape this mysterious land, but not before meeting a strange man—Cucuruz Doan.",tt15428330,"[{'iso_3166_1': 'JP', 'name': 'Japan'}]",ja
