id,release_date,original_title,title,budget,revenue,runtime,popularity,vote_average,vote_count,adult,belongs_to_collection,genres,production_companies,spoken_languages,status,tagline,overview,imdb_id,production_countries,original_language
444902,2017-05-24,Dirty Dancing,Dirty Dancing,6000000,0,130,10.51,5.495,430,False,,"[{'id': 18, 'name': 'Drama'}, {'id': 10749, 'name': 'Romance'}]","[{'id': 28523, 'logo_path': '/zzULw9w7d50BHR8fE30PZT3zJ1D.png', 'name': 'Lionsgate Television', 'origin_country': 'US'}]","[{'english_name': 'English', 'iso_639_1': 'en', 'name': 'English'}]",Released,A musical re-imagining,"Spending the summer at a Catskills resort with her family, Frances ""Baby"" Houseman falls in love with the camp's dance instructor, Johnny Castle, and nothing is ever the same for anyone in the Houseman family.",tt5262792,"[{'iso_3166_1': 'US', 'name': 'United States of America'}]",en
28969,2009-02-27,The Velveteen Rabbit,The Velveteen Rabbit,5500000,0,88,10.492,6.6,30,False,,"[{'id': 16, 'name': 'Animation'}, {'id': 18, 'name': 'Drama'}, {'id': 10751, 'name': 'Family'}, {'id': 14, 'name': 'Fantasy'}]","[{'id': 17669, 'logo_path': '/rEkkdhNo0lS6jWW88iAEEGFvJGw.png', 'name': 'Believe Pictures', 'origin_country': 'US'}, {'id': 233293, 'logo_path': None, 'name': 'Family1 Films', 'origin_country': ''}, {'id': 43819, 'logo_path': '/c2rXy0Ob6F2F6DKVI3GZXKwgU2C.png', 'name': 'CINAR', 'origin_country': 'CA'}, {'id': 12164, 'logo_path': '/7MieiLl5TiCDr6cY96OZdStaaEK.png', 'name': 'Feature Films for Families', 'origin_country': ''}, {'id': 39008, 'logo_path': None, 'name': 'New Movie', 'origin_country': ''}]","[{'english_name': 'English', 'iso_639_1': 'en', 'name': 'English'}]",Released,All You Need to Do is Believe.,A lonely boy wins over his distant father and strict grandmother with help from a brave velveteen rabbit whose one wish is to become a real rabbit someday.,tt0974662,"[{'iso_3166_1': 'CA', 'name': 'Canada'}, {'iso_3166_1': 'US', 'name': 'United States of America'}]",en
539649,2018-09-13,The Lie,The Lie,0,0,95,10.465,6.3,716,False,,"[{'id': 27, 'name': 'Horror'}, {'id': 9648, 'name': 'Mystery'}, {'id': 53, 'name': 'Thriller'}]","[{'id': 109972, 'logo_path': None, 'name': 'Mad Dog Films', 'origin_country': 'US'}, {'id': 20580, 'logo_path': '/oRR9EXVoKP9szDkVKlze5HVJS7g.png', 'name': 'Amazon Studios', 'origin_country': 'US'}, {'id': 68884, 'logo_path': '/1BYexT6Vikz4ulCcYKGPmOi6Jm0.png', 'name': 'Blumhouse Television', 'origin_country': 'US'}]","[{'english_name': 'English', 'iso_639_1': 'en', 'name': 'English'}]",Released,It was an accident.,"A father and daughter are on their way to dance camp when they spot the girl's best friend on the side of the road. When they stop to offer the friend a ride, their good intentions soon result in terrible consequences.",tt7945440,"[{'iso_3166_1': 'US', 'name': 'United States of America'}]",en
62728,2010-09-13,Brighton Rock,Brighton Rock,0,0,111,10.428,5.7,104,False,,"[{'id': 18, 'name': 'Drama'}, {'id': 53, 'name': 'Thriller'}, {'id': 80, 'name': 'Crime'}]","[{'id': 2452, 'logo_path': '/6CLoZ59fLPG7UyxQtGTqRevjf58.png', 'name': 'UK Film Council', 'origin_country': 'GB'}, {'id': 288, 'logo_path': '/aW0IpM9d4Zjj978EqgDVSxXXhTj.png', 'name': 'BBC Film', 'origin_country': 'GB'}, {'id': 3445, 'logo_path': '/7Jkq08LdnkxhK9M2LHuIOwHFfX8.png', 'name': 'Kudos', 'origin_country': 'GB'}, {'id': 694, 'logo_path': '/5LEHONGkZBIoWvp1ygHOF8iyi1M.png', 'name': 'StudioCanal', 'origin_country': 'FR'}]","[{'english_name': 'English', 'iso_639_1': 'en', 'name': 'English'}]",Released,Love. Murder. Revenge.,"Charts the headlong fall of Pinkie, a razor-wielding disadvantaged teenager with a religious death wish.",tt1233192,"[{'iso_3166_1': 'FR', 'name': 'France'}, {'iso_3166_1': 'GB', 'name': 'United Kingdom'}]",en
27511,1924-12-22,He Who Gets Slapped,He Who Gets Slapped,172000,881000,72,10.3,7.6,91,False,,"[{'id': 18, 'name': 'Drama'}, {'id': 53, 'name': 'Thriller'}, {'id': 10749, 'name': 'Romance'}]","[{'id': 21, 'logo_path': '/usUnaYV6hQnlVAXP6r4HwrlLFPG.png', 'name': 'Metro-Goldwyn-Mayer', 'origin_country': 'US'}]","[{'english_name': 'No Language', 'iso_639_1': 'xx', 'name': 'No Language'}]",Released,,"After a baron steals his scientific discoveries, runs away with his wife, and slaps him in public, a man joins a Parisian circus sideshow as a clown whose act consists of being slapped repeatedly and becomes infatuated with a showgirl colleague whose father intends to marry her off to the baron.",tt0014972,"[{'iso_3166_1': 'US', 'name': 'United States of America'}]",en
28431,1952-11-04,The Prisoner of Zenda,The Prisoner of Zenda,0,0,96,10.239,6.7,51,False,,"[{'id': 12, 'name': 'Adventure'}, {'id': 36, 'name': 'History'}]","[{'id': 21, 'logo_path': '/usUnaYV6hQnlVAXP6r4HwrlLFPG.png', 'name': 'Metro-Goldwyn-Mayer', 'origin_country': 'US'}]","[{'english_name': 'English', 'iso_639_1': 'en', 'name': 'English'}, {'english_name': 'Italian', 'iso_639_1': 'it', 'name': 'Italiano'}]",Released,A Swashbuckling Adventure In The Grand Style!,"An Englishman vacationing in Ruritania is recruited to impersonate his cousin, the soon-to-be-crowned king after the monarch is drugged and kidnapped.",tt0045053,"[{'iso_3166_1': 'US', 'name': 'United States of America'}]",en
515741,2019-08-15,Angel of Mine,Angel of Mine,0,230193,98,10.196,6.2,271,False,,"[{'id': 18, 'name': 'Drama'}, {'id': 53, 'name': 'Thriller'}, {'id': 9648, 'name': 'Mystery'}]","[{'id': 65719, 'logo_path': None, 'name': 'Garlin Pictures', 'origin_country': ''}, {'id': 7584, 'logo_path': '/eGkfvvyf4fJTvBUR1xt1669IPA3.png', 'name': 'Screen Australia', 'origin_country': 'AU'}, {'id': 11840, 'logo_path': '/8oyCRYf6ezxB5h8HJIPVG8JjzgL.png', 'name': 'Film Victoria', 'origin_country': 'AU'}, {'id': 102896, 'logo_path': None, 'name': 'SixtyFourSixty', 'origin_country': ''}]","[{'english_name': 'English', 'iso_639_1': 'en', 'name': 'English'}]",Released,,A woman grieving over the death of her daughter loses grip of reality when she begins to think her girl may still be alive.,tt7058080,"[{'iso_3166_1': 'AU', 'name': 'Australia'}, {'iso_3166_1': 'US', 'name': 'United States of America'}]",en
397520,2016-02-15,Anne of Green Gables,Anne of Green Gables,0,127345,85,10.133,7.2,126,False,"{'id': 653726, 'name': ""L.M. Montgomery's Anne of Green Gables Collection"", 'poster_path': '/epT7TS8YKGrV8IkD9JxNdRyIKdM.jpg', 'backdrop_path': '/3EVtuNEeH0C2BqYi5BimKnT6ce8.jpg'}","[{'id': 18, 'name': 'Drama'}, {'id': 10751, 'name': 'Family'}, {'id': 10770, 'name': 'TV Movie'}]","[{'id': 5743, 'logo_path': '/y8JaCRhsEz4ipl7MWE0ErxWVPYN.png', 'name': 'Breakthrough Entertainment', 'origin_country': 'CA'}]","[{'english_name': 'English', 'iso_639_1': 'en', 'name': 'English'}]",Released,,"A retelling of L.M. Montgomery's story of Anne Shirley, an orphan who is accidentally sent to a couple looking to adopt a boy instead",tt4820224,"[{'iso_3166_1': 'CA', 'name': 'Canada'}]",en
301730,2014-12-04,Elimination Game,Elimination Game,3200000,0,90,10.119,4.4,25,False,,"[{'id': 28, 'name': 'Action'}]","[{'id': 17526, 'logo_path': None, 'name': 'F.G. Film Productions', 'origin_country': 'AU'}, {'id': 62091, 'logo_path': None, 'name': 'Thatcher Productions', 'origin_country': ''}]","[{'english_name': 'English', 'iso_639_1': 'en', 'name': 'English'}]",Released,It's live. With death.,"In the wake of a shocking civilian massacre in a foreign war zone, disgraced Navy SEAL Rick Tyler is sentenced to rot in a maximum security military prison until he is offered the opportunity to put his life on the line to win his freedom. A one-man force of nature, Tyler will have to take-on and take-down some of the world's most ruthless killers in some of the world's most brutal locations to win the game, obtain his freedom and find out why he was set up. The question is, can he accomplish all of this before Game On is Game Over?",tt3816614,"[{'iso_3166_1': 'AU', 'name': 'Australia'}]",en
45914,2005-04-02,The Quatermass Experiment,The Quatermass Experiment,0,0,97,10.093,5.5,14,False,,"[{'id': 878, 'name': 'Science Fiction'}, {'id': 18, 'name': 'Drama'}, {'id': 53, 'name': 'Thriller'}, {'id': 10770, 'name': 'TV Movie'}]","[{'id': 3324, 'logo_path': '/dqT3yOTlfJRmtvk52Ccd1O6dZ0A.png', 'name': 'BBC', 'origin_country': 'GB'}]","[{'english_name': 'English', 'iso_639_1': 'en', 'name': 'English'}]",Released,,"Bernard Quatermass heads the futuristic Experimental Rocket Group whose greatest voyage is coming to an end, but after a dramatic crash landing Victor Carroon begins to metamorphose into a strange, deadly alien, setting off a race against time to save humanity.",tt0450315,"[{'iso_3166_1': 'GB', 'name': 'United Kingdom'}]",en
505379,2020-10-16,Rebecca,Rebecca,0,0,123,10.049,6.296,1082,False,,"[{'id': 10749, 'name': 'Romance'}, {'id': 18, 'name': 'Drama'}, {'id': 9648, 'name': 'Mystery'}, {'id': 53, 'name': 'Thriller'}]","[{'id': 10163, 'logo_path': '/16KWBMmfPX0aJzDExDrPxSLj0Pg.png', 'name': 'Working Title Films', 'origin_country': 'GB'}]","[{'english_name': 'English', 'iso_639_1': 'en', 'name': 'English'}, {'english_name': 'French', 'iso_639_1': 'fr', 'name': 'Français'}]",Released,,"After a whirlwind romance with a wealthy widower, a naïve bride moves to his family estate but can't escape the haunting shadow of his late wife.",tt2235695,"[{'iso_3166_1': 'GB', 'name': 'United Kingdom'}]",en
24795,1994-07-15,Angels in the Outfield,Angels in the Outfield,31000000,50236831,102,10.029,5.9,433,False,"{'id': 508334, 'name': 'Angels in the ... Collection', 'poster_path': '/iNSnm8LC71trOK737HgSFH93fKA.jpg', 'backdrop_path': None}","[{'id': 35, 'name': 'Comedy'}, {'id': 10751, 'name': 'Family'}, {'id': 14, 'name': 'Fantasy'}]","[{'id': 175, 'logo_path': '/trtXLj3zv8T9ke1Vhw4SCkkM4JJ.png', 'name': 'Caravan Pictures', 'origin_country': 'US'}, {'id': 2, 'logo_path': '/wdrCwmRnLFJhEoH8GSfymY85KHT.png', 'name': 'Walt Disney Pictures', 'origin_country': 'US'}]","[{'english_name': 'English', 'iso_639_1': 'en', 'name': 'English'}]",Released,Ya Gotta Believe!,"Roger is a foster child whose irresponsible father promises to get his act together when Roger's favourite baseball team, the California Angels, wins the pennant. The problem is that the Angels are in last place, so Roger prays for help to turn the team around. Sure enough, his prayers are answered in the form of angel Al.",tt0109127,"[{'iso_3166_1': 'US', 'name': 'United States of America'}]",en
577328,2019-06-20,कबीर सिंह,Kabir Singh,8751000,55478164,172,9.988,6.4,134,False,"{'id': 980604, 'name': 'Kabir Singh Collection', 'poster_path': None, 'backdrop_path': None}","[{'id': 18, 'name': 'Drama'}, {'id': 10749, 'name': 'Romance'}]","[{'id': 35064, 'logo_path': '/mAqgOSWkUTQ3EMYBuy6pMRTFOmQ.png', 'name': 'Cine1 Studios', 'origin_country': 'IN'}, {'id': 3522, 'logo_path': '/d3u51JgEP5KwPfxS13ocqvtzZeX.png', 'name': 'T-Series', 'origin_country': 'IN'}]","[{'english_name': 'Hindi', 'iso_639_1': 'hi', 'name': 'हिन्दी'}]",Released,,"Kabir, a genius yet hostile medical student, falls in love with Preeti from his college. When Preeti's father spots the couple kissing, he opposes their relationship and decides to marry her off.",tt8983202,"[{'iso_3166_1': 'IN', 'name': 'India'}]",hi
11352,1989-12-22,Always,Always,31000000,74100000,122,9.959,6.288,589,False,,"[{'id': 10749, 'name': 'Romance'}, {'id': 14, 'name': 'Fantasy'}, {'id': 18, 'name': 'Drama'}]","[{'id': 33, 'logo_path': '/3wwjVpkZtnog6lSKzWDjvw2Yi00.png', 'name': 'Universal Pictures', 'origin_country': 'US'}, {'id': 60, 'logo_path': '/4YldLvCWQL9VIAHQ2Fu3Ffkh9Si.png', 'name': 'United Artists', 'origin_country': 'US'}, {'id': 56, 'logo_path': '/cEaxANEisCqeEoRvODv2dO1I0iI.png', 'name': 'Amblin Entertainment', 'origin_country': 'US'}]","[{'english_name': 'English', 'iso_639_1': 'en', 'name': 'English'}]",Released,They couldn't hear him. They couldn't see him. But he was there when they needed him... Even after he was gone.,"Aerial firefighter Pete risks himself and his vintage World War II airplane in a constant and death-defying quest to fight forest wildfires, much to the dismay of his girlfriend, Dorinda . His love for Dorinda and the advice of fellow pilot Al convince Pete to give up his perilous career, but he flies one last mission. Pete heroically saves Al's plane from certain destruction, but with supernatural consequences.",tt0096794,"[{'iso_3166_1': 'US', 'name': 'United States of America'}]",en
10955,2002-09-02,Ripley's Game,Ripley's Game,30000000,6200000,110,9.933,6.364,261,False,,"[{'id': 80, 'name': 'Crime'}, {'id': 53, 'name': 'Thriller'}]","[{'id': 2130, 'logo_path': '/g0lqeY2FvhzXcOI6z8RVXbORRUY.png', 'name': 'Mr. Mudd', 'origin_country': 'US'}, {'id': 93156, 'logo_path': None, 'name': 'Baby Films', 'origin_country': ''}, {'id': 10102, 'logo_path': '/b0g4aEM39p0PwbIiaU1Cg3ZZUAq.png', 'name': 'Cattleya', 'origin_country': 'IT'}]","[{'english_name': 'English', 'iso_639_1': 'en', 'name': 'English'}]",Released,Older. Wiser. More Talented.,"Tom Ripley - cool, urbane, wealthy, and murderous - lives in a villa in the Veneto with Luisa, his harpsichord-playing girlfriend. A former business associate from Berlin's underworld pays a call asking Ripley's help in killing a rival. Ripley - ever a student of human nature - initiates a game to turn a mild and innocent local picture framer into a hit man. The artisan, Jonathan Trevanny, who's dying of cancer, has a wife, young son, and little to leave them. If Ripley draws Jonathan into the game, can Ripley maintain control? Does it stop at one killing? What if Ripley develops a conscience?",tt0265651,"[{'iso_3166_1': 'GB', 'name': 'United Kingdom'}, {'iso_3166_1': 'US', 'name': 'United States of America'}, {'iso_3166_1': 'IT', 'name': 'Italy'}]",en
109099,2013-02-13,Passion,Passion,20000000,713616,101,9.905,5.2,412,False,,"[{'id': 53, 'name': 'Thriller'}, {'id': 18, 'name': 'Drama'}, {'id': 80, 'name': 'Crime'}, {'id': 9648, 'name': 'Mystery'}]","[{'id': 1905, 'logo_path': None, 'name': 'Integral Film', 'origin_country': 'DE'}, {'id': 8997, 'logo_path': '/79j5EijIG8NrRg5ibLtdooXTsiu.png', 'name': 'SBS Productions', 'origin_country': 'FR'}, {'id': 83, 'logo_path': '/9OQ0rm55xtlgX7KcAKMUePJSrQc.png', 'name': 'France 2 Cinéma', 'origin_country': 'FR'}]","[{'english_name': 'English', 'iso_639_1': 'en', 'name': 'English'}, {'english_name': 'German', 'iso_639_1': 'de', 'name': 'Deutsch'}]",Released,No backstabbing. Just business,The rivalry between the manipulative boss of an advertising agency and her talented protégée escalates from stealing credit to public humiliation to murder.,tt1829012,"[{'iso_3166_1': 'FR', 'name': 'France'}, {'iso_3166_1': 'DE', 'name': 'Germany'}]",en
9666,2003-08-15,呪怨2,Ju-on: The Grudge 2,20000000,70700000,92,9.876,6.4,327,False,"{'id': 1972, 'name': 'Ju-on Collection', 'poster_path': '/lVqTTvDpTeZmvqDu5Y9aWfRgUqg.jpg', 'backdrop_path': '/l3wedBkwOFc4nZpusp6fnUvJdeh.jpg'}","[{'id': 27, 'name': 'Horror'}, {'id': 53, 'name': 'Thriller'}]","[{'id': 4563, 'logo_path': None, 'name': 'Oz Company', 'origin_country': 'JP'}, {'id': 14644, 'logo_path': None, 'name': 'Aozora Investments', 'origin_country': ''}, {'id': 7776, 'logo_path': None, 'name': 'Pioneer LDC', 'origin_country': 'JP'}, {'id': 955, 'logo_path': '/5xnXD3PJI1HqOJceSAKZ3fDqO1V.png', 'name': 'Nikkatsu Corporation', 'origin_country': 'JP'}, {'id': 5815, 'logo_path': None, 'name': 'Xanadeux Company', 'origin_country': 'JP'}, {'id': 1194, 'logo_path': '/dwkHaFLgtA7CUNbgKK0wB6bospu.png', 'name': 'KADOKAWA Shoten', 'origin_country': 'JP'}, {'id': 12497, 'logo_path': '/4PHn85b0fJBmzWcpIksvKGluyLW.png', 'name': 'Tokyo Theatres Company', 'origin_country': 'JP'}]","[{'english_name': 'Japanese', 'iso_639_1': 'ja', 'name': '日本語'}]",Released,,"When the cast and crew of a paranormal TV reality program decide to shoot in the house of the original Saeki hauntings, a series of strange events unfold at the location.",tt0367913,"[{'iso_3166_1': 'JP', 'name': 'Japan'}]",ja
3079,1957-05-20,The Curse of Frankenstein,The Curse of Frankenstein,270000,8000000,83,9.807,6.8,298,False,"{'id': 123720, 'name': 'Frankenstein (Hammer) Collection', 'poster_path': '/Wvpg2lWyGtYMpglu5B5RzQ3KAg.jpg', 'backdrop_path': '/6k7NzhLLHTmz8JOHLhhCBjEoZNn.jpg'}","[{'id': 27, 'name': 'Horror'}, {'id': 878, 'name': 'Science Fiction'}]","[{'id': 1314, 'logo_path': '/gQBluDqe6dc2ZdzfJbabEHoSGoG.png', 'name': 'Hammer Film Productions', 'origin_country': 'GB'}]","[{'english_name': 'English', 'iso_639_1': 'en', 'name': 'English'}]",Released,The creature created by man and forgotten by nature!,Baron Victor Frankenstein has discovered life's secret and unleashed a blood-curdling chain of events resulting from his creation: a cursed creature with a horrid face — and a tendency to kill.,tt0050280,"[{'iso_3166_1': 'GB', 'name': 'United Kingdom'}]",en
401544,2017-01-17,Death Race 2050,Death Race 2050,0,0,93,9.786,4.3,178,False,"{'id': 434533, 'name': 'Death Race Original Collection', 'poster_path': '/kpdCNcuQsDlBQ1ZPF0e2P5cqIXB.jpg', 'backdrop_path': '/zFwnFKsutUUQB2UX8kFriVCYyLU.jpg'}","[{'id': 28, 'name': 'Action'}, {'id': 35, 'name': 'Comedy'}, {'id': 878, 'name': 'Science Fiction'}]","[{'id': 17009, 'logo_path': '/ssowAxOrrqsSR2CKeiytOXwLoCW.png', 'name': 'Universal 1440 Entertainment', 'origin_country': 'US'}, {'id': 20235, 'logo_path': None, 'name': 'New Horizons Picture', 'origin_country': ''}]","[{'english_name': 'English', 'iso_639_1': 'en', 'name': 'English'}]",Released,,"The year 2050 the planet has become overpopulated, to help control population the government develops a race. The Death Race. Annually competitors race across the country scoring points for killing people with their vehicles.",tt5493706,"[{'iso_3166_1': 'US', 'name': 'United States of America'}]",en
31696,1991-04-26,A Kiss Before Dying,A Kiss Before Dying,0,15400000,95,9.71,5.6,117,False,,"[{'id': 9648, 'name': 'Mystery'}, {'id': 53, 'name': 'Thriller'}, {'id': 80, 'name': 'Crime'}]","[{'id': 65270, 'logo_path': None, 'name': 'Kellgate Limited', 'origin_country': ''}, {'id': 33, 'logo_path': '/3wwjVpkZtnog6lSKzWDjvw2Yi00.png', 'name': 'Universal Pictures', 'origin_country': 'US'}, {'id': 6781, 'logo_path': None, 'name': 'Initial Pictures', 'origin_country': ''}]","[{'english_name': 'English', 'iso_639_1': 'en', 'name': 'English'}]",Released,Loving him was easy. Trusting him was deadly.,"Infatuated with the idea of becoming rich, college student Jonathan Corliss secretly dates Dorothy Carlsson to gain the approval of her wealthy father. When Dorothy tells Jonathan that she is pregnant and that her father will deny her inheritance if he finds out, Jonathan murders her, but he stages her death as a suicide. As Jonathan works his way onto Mr. Carlsson's payroll, Dorothy's twin sister, Ellen, investigates the apparent suicide.",tt0102220,"[{'iso_3166_1': 'GB', 'name': 'United Kingdom'}, {'iso_3166_1': 'US', 'name': 'United States of America'}]",en
491473,2019-03-07,Gloria Bell,Gloria Bell,0,11145006,102,9.706,5.959,314,False,,"[{'id': 18, 'name': 'Drama'}, {'id': 10749, 'name': 'Romance'}]","[{'id': 7493, 'logo_path': '/fHitYiGUCkRafgt6VPYQlXWLkdp.png', 'name': 'FilmNation Entertainment', 'origin_country': 'US'}, {'id': 21546, 'logo_path': '/nB186ByqKVBiuy9Nc3US9nlBst1.png', 'name': 'Fabula', 'origin_country': 'CL'}, {'id': 11341, 'logo_path': '/xytTBODEy3p20ksHL4Ftxr483Iv.png', 'name': 'Stage 6 Films', 'origin_country': 'US'}]","[{'english_name': 'English', 'iso_639_1': 'en', 'name': 'English'}]",Released,Love. Life.,"Gloria is a free-spirited divorcée who spends her days at a straight-laced office job and her nights on the dance floor, joyfully letting loose at clubs around Los Angeles. After meeting Arnold on a night out, she finds herself thrust into an unexpected new romance, filled with both the joys of budding love and the complications of dating, identity, and family.",tt6902696,"[{'iso_3166_1': 'CL', 'name': 'Chile'}, {'iso_3166_1': 'US', 'name': 'United States of America'}]",en
22998,1983-12-16,To Be or Not to Be,To Be or Not to Be,9000000,13030214,107,9.703,6.739,207,False,,"[{'id': 35, 'name': 'Comedy'}]","[{'id': 5612, 'logo_path': None, 'name': 'Brooksfilms', 'origin_country': 'US'}, {'id': 25, 'logo_path': '/qZCc1lty5FzX30aOCVRBLzaVmcp.png', 'name': '20th Century Fox', 'origin_country': 'US'}]","[{'english_name': 'Polish', 'iso_639_1': 'pl', 'name': 'Polski'}, {'english_name': 'English', 'iso_639_1': 'en', 'name': 'English'}]",Released,THAT is the movie!,"A bad Polish actor is just trying to make a living when Poland is invaded by the Germans in World War II. His wife has the habit of entertaining young Polish officers while he's on stage, which is also a source of depression to him. When one of her officers comes back on a Secret Mission, the actor takes charge and comes up with a plan for them to escape.",tt0086450,"[{'iso_3166_1': 'US', 'name': 'United States of America'}]",en
755437,2021-12-17,Mamá o papá,You Keep the Kids,0,0,103,9.679,7.162,191,False,,"[{'id': 35, 'name': 'Comedy'}, {'id': 10751, 'name': 'Family'}]","[{'id': 109818, 'logo_path': '/mIUl5Lqz0YTTkxJju0lnjJdWtP1.png', 'name': 'Álamo Producciones Audiovisuales', 'origin_country': 'ES'}, {'id': 111087, 'logo_path': None, 'name': 'Grupo Secuoya', 'origin_country': ''}, {'id': 29566, 'logo_path': '/wHbtRtUnXGNzX0riQIpq1fcgueq.png', 'name': 'Atresmedia', 'origin_country': 'ES'}, {'id': 11652, 'logo_path': None, 'name': 'Warner Bros. Entertainment España', 'origin_country': 'ES'}]","[{'english_name': 'Spanish', 'iso_639_1': 'es', 'name': 'Español'}]",Released,,"Flora and Victor are fun, modern, caring parents. That is, until they decide to get a divorce, and the perfect job opportunity turns up for them. They now have one problem: custody.",tt12443220,"[{'iso_3166_1': 'ES', 'name': 'Spain'}]",es
905,1929-01-30,Die Büchse der Pandora,Pandora's Box,0,885533,133,9.67,7.5,225,False,,"[{'id': 18, 'name': 'Drama'}, {'id': 80, 'name': 'Crime'}, {'id': 10749, 'name': 'Romance'}]","[{'id': 43854, 'logo_path': '/tMo26bTTY0f4mMPIvFnyydrDm7V.png', 'name': 'Nero-Film AG', 'origin_country': 'DE'}]","[{'english_name': 'German', 'iso_639_1': 'de', 'name': 'Deutsch'}]",Released,,"Lulu is a young woman so beautiful and alluring that few can resist her siren charms. The men drawn into her web include respectable newspaper publisher Dr. Ludwig Schön, his musical producer son Alwa, circus performer Rodrigo Quast, and seedy old Schigolch. When Lulu's charms inevitably lead to tragedy, the downward spiral encompasses them all.",tt0018737,"[{'iso_3166_1': 'DE', 'name': 'Germany'}]",de
489927,2018-09-23,The Kindergarten Teacher,The Kindergarten Teacher,0,0,96,9.638,6.576,343,False,,"[{'id': 18, 'name': 'Drama'}]","[{'id': 19640, 'logo_path': '/ddonoYYQ3ToVqMEc2Ke5SB1idkq.png', 'name': 'Maven Screen Media', 'origin_country': 'US'}, {'id': 107554, 'logo_path': None, 'name': 'Paper Chase Films', 'origin_country': ''}, {'id': 102494, 'logo_path': '/heQHAgroQnGjGJNIXB2A0qjg6TK.png', 'name': 'Studio Mao', 'origin_country': 'US'}, {'id': 105833, 'logo_path': None, 'name': 'Farcaster Films', 'origin_country': ''}, {'id': 127469, 'logo_path': None, 'name': 'Imagination Park Entertainment', 'origin_country': ''}, {'id': 69142, 'logo_path': None, 'name': 'Manhattan Productions', 'origin_country': ''}, {'id': 144390, 'logo_path': None, 'name': 'Pia Pressure', 'origin_country': ''}, {'id': 24662, 'logo_path': '/pME6OvhHDJPU96MthlqBolVoimO.png', 'name': 'Pie Films', 'origin_country': 'IL'}]","[{'english_name': 'English', 'iso_639_1': 'en', 'name': 'English'}]",Released,,"Lisa Spinelli is a Staten Island teacher who is unusually devoted to her students. When she discovers one of her five-year-olds is a prodigy, she becomes fascinated with the boy, ultimately risking her family and freedom to nurture his talent.",tt6952960,"[{'iso_3166_1': 'CA', 'name': 'Canada'}, {'iso_3166_1': 'IL', 'name': 'Israel'}, {'iso_3166_1': 'GB', 'name': 'United Kingdom'}, {'iso_3166_1': 'US', 'name': 'United States of America'}]",en
505953,2019-01-17,Storm Boy,Storm Boy,0,0,99,9.549,7.1,139,False,,"[{'id': 18, 'name': 'Drama'}, {'id': 12, 'name': 'Adventure'}, {'id': 10751, 'name': 'Family'}]","[{'id': 81187, 'logo_path': None, 'name': 'Best FX Adelaide', 'origin_country': ''}, {'id': 3427, 'logo_path': '/1QYfS7zdQ2w7RczxsDjjrWACk2a.png', 'name': 'Ambience Entertainment', 'origin_country': 'AU'}, {'id': 49937, 'logo_path': '/j14jwTsJj6ok9IkUFewX7acufKu.png', 'name': 'Good Deed Entertainment', 'origin_country': 'US'}]","[{'english_name': 'English', 'iso_639_1': 'en', 'name': 'English'}]",Released,Let your heart soar,"Storm Boy lives a lonely life with his reclusive father on a desolate coastline, but when he forms a close bond with a pelican, Mr. Percival, his life takes a new and unexpected turn.",tt3340446,"[{'iso_3166_1': 'AU', 'name': 'Australia'}]",en
602301,2020-12-10,조제,Josée,0,1709980,117,9.543,7.1,54,False,,"[{'id': 10749, 'name': 'Romance'}, {'id': 18, 'name': 'Drama'}]","[{'id': 103747, 'logo_path': None, 'name': 'Warner Bros. Korea', 'origin_country': 'KR'}, {'id': 142745, 'logo_path': None, 'name': 'Vol Media', 'origin_country': 'KR'}, {'id': 3033, 'logo_path': '/AwgX2FHGJd54aSWfWJqptFvT1h.png', 'name': 'Asmik Ace', 'origin_country': 'JP'}]","[{'english_name': 'Korean', 'iso_639_1': 'ko', 'name': '한국어/조선말'}]",Released,Our Most Beautiful Time.,"Young-seok, who feels overwhelmed and lonely in what should be his glorious youth, meets a woman who introduces herself as Josée, and they share a once-in-a-lifetime romance.",tt13411298,"[{'iso_3166_1': 'JP', 'name': 'Japan'}, {'iso_3166_1': 'KR', 'name': 'South Korea'}]",ko
