id,release_date,original_title,title,budget,revenue,runtime,popularity,vote_average,vote_count,adult,belongs_to_collection,genres,production_companies,spoken_languages,status,tagline,overview,imdb_id,production_countries,original_language
360920,2018-11-08,The Grinch,The Grinch,75000000,508600000,85,477.459,6.864,3944,False,,"[{'id': 16, 'name': 'Animation'}, {'id': 10751, 'name': 'Family'}, {'id': 35, 'name': 'Comedy'}, {'id': 14, 'name': 'Fantasy'}]","[{'id': 6704, 'logo_path': '/fOG2oY4m1YuYTQh4bMqqZkmgOAI.png', 'name': 'Illumination', 'origin_country': 'US'}, {'id': 180651, 'logo_path': None, 'name': 'Dr. Seuss Enterprises', 'origin_country': 'US'}, {'id': 5556, 'logo_path': '/AtHcoKwxqH6wHrgodaPtZqRirIX.png', 'name': 'Universal Animation Studios', 'origin_country': 'US'}]","[{'english_name': 'English', 'iso_639_1': 'en', 'name': 'English'}]",Released,It was the heist before Christmas.,The Grinch hatches a scheme to ruin Christmas when the residents of Whoville plan their annual holiday celebration.,tt2709692,"[{'iso_3166_1': 'US', 'name': 'United States of America'}]",en
156022,2014-09-24,The Equalizer,The Equalizer,55000000,192330738,132,192.911,7.3,9029,False,"{'id': 523855, 'name': 'The Equalizer Collection', 'poster_path': '/w9taToc4xcVE9duBwbywp0nAnue.jpg', 'backdrop_path': '/wac5llYhh0lC24yNWljrcOe4sR9.jpg'}","[{'id': 53, 'name': 'Thriller'}, {'id': 28, 'name': 'Action'}, {'id': 80, 'name': 'Crime'}]","[{'id': 41096, 'logo_path': None, 'name': 'Lonetree Entertainment', 'origin_country': 'US'}, {'id': 5, 'logo_path': '/71BqEFAF4V3qjjMPCpLuyJFB9A.png', 'name': 'Columbia Pictures', 'origin_country': 'US'}, {'id': 79, 'logo_path': '/at4uYdwAAgNRKhZuuFX8ShKSybw.png', 'name': 'Village Roadshow Pictures', 'origin_country': 'US'}, {'id': 1423, 'logo_path': '/gzvsPHV9WqcQMrvI8pq5hbuvEZ5.png', 'name': 'Escape Artists', 'origin_country': 'US'}, {'id': 34034, 'logo_path': None, 'name': 'LStar Capital', 'origin_country': 'US'}, {'id': 2767, 'logo_path': None, 'name': 'Mace Neufeld Productions', 'origin_country': 'US'}]","[{'english_name': 'English', 'iso_639_1': 'en', 'name': 'English'}]",Released,What do you see when you look at me?,"McCall believes he has put his mysterious past behind him and dedicated himself to beginning a new, quiet life. But when he meets Teri, a young girl under the control of ultra-violent Russian gangsters, he can’t stand idly by – he has to help her. Armed with hidden skills that allow him to serve vengeance against anyone who would brutalize the helpless, McCall comes out of his self-imposed retirement and finds his desire for justice reawakened. If someone has a problem, if the odds are stacked against them, if they have nowhere else to turn, McCall will help. He is The Equalizer.",tt0455944,"[{'iso_3166_1': 'US', 'name': 'United States of America'}]",en
420818,2019-07-12,The Lion King,The Lion King,260000000,1663000000,118,160.143,7.1,9994,False,"{'id': 762512, 'name': 'The Lion King (Reboot) Collection', 'poster_path': '/dGpIRn4Nqi63JO1RlKxjcPbQSAw.jpg', 'backdrop_path': '/jIgM7YNVft0YGeXsqrh3oG5TWLx.jpg'}","[{'id': 16, 'name': 'Animation'}, {'id': 12, 'name': 'Adventure'}, {'id': 18, 'name': 'Drama'}, {'id': 10751, 'name': 'Family'}]","[{'id': 2, 'logo_path': '/wdrCwmRnLFJhEoH8GSfymY85KHT.png', 'name': 'Walt Disney Pictures', 'origin_country': 'US'}, {'id': 7297, 'logo_path': '/l29JYQVZbTcjZXoz4CUYFpKRmM3.png', 'name': 'Fairview Entertainment', 'origin_country': 'US'}]","[{'english_name': 'English', 'iso_639_1': 'en', 'name': 'English'}]",Released,The king has returned.,"Simba idolizes his father, King Mufasa, and takes to heart his own royal destiny. But not everyone in the kingdom celebrates the new cub's arrival. Scar, Mufasa's brother—and former heir to the throne—has plans of his own. The battle for Pride Rock is ravaged with betrayal, tragedy and drama, ultimately resulting in Simba's exile. With help from a curious pair of newfound friends, Simba will have to figure out how to grow up and take back what is rightfully his.",tt6105098,"[{'iso_3166_1': 'US', 'name': 'United States of America'}]",en
564,1999-04-16,The Mummy,The Mummy,80000000,415885488,124,132.206,6.936,9047,False,"{'id': 1733, 'name': 'The Mummy Collection', 'poster_path': '/x5ZQsM90h4jmvDelgbCwPjcOn1s.jpg', 'backdrop_path': '/1BeKi6IytbfQlQocJSvP2k6sO1a.jpg'}","[{'id': 12, 'name': 'Adventure'}, {'id': 28, 'name': 'Action'}, {'id': 14, 'name': 'Fantasy'}]","[{'id': 11462, 'logo_path': '/7ZymELJwuWR4k5p0oeZ3d3WAhO3.png', 'name': 'Alphaville Films', 'origin_country': 'US'}]","[{'english_name': 'English', 'iso_639_1': 'en', 'name': 'English'}, {'english_name': 'Arabic', 'iso_639_1': 'ar', 'name': 'العربية'}]",Released,The sands will rise. The heavens will part. The power will be unleashed.,Dashing legionnaire Rick O'Connell stumbles upon the hidden ruins of Hamunaptra while in the midst of a battle to claim the area in 1920s Egypt. It has been over three thousand years since former High Priest Imhotep suffered a fate worse than death as a punishment for a forbidden love—along with a curse that guarantees eternal doom upon the world if he is ever awoken.,tt0120616,"[{'iso_3166_1': 'US', 'name': 'United States of America'}]",en
474350,2019-09-04,It Chapter Two,It Chapter Two,79000000,473123154,169,130.242,6.843,8732,False,"{'id': 477962, 'name': 'It Collection', 'poster_path': '/9tnrNFF450DWUQu3DzyFXVmuE8e.jpg', 'backdrop_path': '/ayvH5IW5eDOa28WfSjnkYMii73d.jpg'}","[{'id': 27, 'name': 'Horror'}, {'id': 18, 'name': 'Drama'}, {'id': 14, 'name': 'Fantasy'}]","[{'id': 12, 'logo_path': '/2ycs64eqV5rqKYHyQK0GVoKGvfX.png', 'name': 'New Line Cinema', 'origin_country': 'US'}, {'id': 829, 'logo_path': '/aXqwCvJSCDbTclkxAYfsT1l4Dsa.png', 'name': 'Vertigo Entertainment', 'origin_country': 'US'}, {'id': 152809, 'logo_path': None, 'name': 'Double Dream', 'origin_country': 'US'}, {'id': 118854, 'logo_path': '/g9LPNlQFoDcHjfnvrEqFmeIaDrZ.png', 'name': 'Rideback', 'origin_country': 'US'}]","[{'english_name': 'English', 'iso_639_1': 'en', 'name': 'English'}]",Released,It ends,"27 years after overcoming the malevolent supernatural entity Pennywise, the former members of the Losers' Club, who have grown up and moved away from Derry, are brought back together by a devastating phone call.",tt7349950,"[{'iso_3166_1': 'US', 'name': 'United States of America'}]",en
364689,2017-12-09,Ferdinand,Ferdinand,111000000,295038508,108,113.396,7.21,2836,False,,"[{'id': 16, 'name': 'Animation'}, {'id': 10751, 'name': 'Family'}, {'id': 12, 'name': 'Adventure'}, {'id': 35, 'name': 'Comedy'}]","[{'id': 9383, 'logo_path': '/ppeMh4iZJQUMm1nAjRALeNhWDfU.png', 'name': 'Blue Sky Studios', 'origin_country': 'US'}, {'id': 11749, 'logo_path': '/5AzTeZkSCFhiGZ86g2nz8SAHtgy.png', 'name': '20th Century Fox Animation', 'origin_country': 'US'}, {'id': 1302, 'logo_path': '/zC3b70ixHh89qJIikLQPEvLqbPM.png', 'name': 'Davis Entertainment', 'origin_country': 'US'}, {'id': 25, 'logo_path': '/qZCc1lty5FzX30aOCVRBLzaVmcp.png', 'name': '20th Century Fox', 'origin_country': 'US'}]","[{'english_name': 'English', 'iso_639_1': 'en', 'name': 'English'}]",Released,Built to Fight. Born to Love.,"Ferdinand, a little bull, prefers sitting quietly under a cork tree just smelling the flowers versus jumping around, snorting, and butting heads with other bulls. As Ferdinand grows big and strong, his temperament remains mellow, but one day five men come to choose the ""biggest, fastest, roughest bull"" for the bullfights in Madrid and Ferdinand is mistakenly chosen.  Based on the classic 1936 children's book by Munro Leaf.",tt3411444,"[{'iso_3166_1': 'US', 'name': 'United States of America'}]",en
281957,2015-12-25,The Revenant,The Revenant,135000000,532950503,157,106.682,7.533,18053,False,,"[{'id': 37, 'name': 'Western'}, {'id': 18, 'name': 'Drama'}, {'id': 12, 'name': 'Adventure'}]","[{'id': 77845, 'logo_path': None, 'name': 'Monarchy Enterprises S.a.r.l.', 'origin_country': ''}, {'id': 508, 'logo_path': '/7cxRWzi4LsVm4Utfpr1hfARNurT.png', 'name': 'Regency Enterprises', 'origin_country': 'US'}, {'id': 562, 'logo_path': '/azANEzu3H3Kztzt63sdjvlzxhuB.png', 'name': 'Appian Way', 'origin_country': 'US'}, {'id': 8870, 'logo_path': '/f2hj6ssc0KBRSafGnycnN5A1aGF.png', 'name': 'CatchPlay', 'origin_country': 'TW'}, {'id': 10039, 'logo_path': '/b8w4LldQolMKiLZw4FQJBcXSDGI.png', 'name': 'Anonymous Content', 'origin_country': 'US'}, {'id': 10104, 'logo_path': '/wRn5HnYMGeJHmItRypgOZOC6gwY.png', 'name': 'New Regency Pictures', 'origin_country': 'US'}, {'id': 13796, 'logo_path': None, 'name': 'Hong Kong Alpha Motion Pictures Co.', 'origin_country': 'HK'}, {'id': 52660, 'logo_path': None, 'name': 'M Productions', 'origin_country': ''}, {'id': 41624, 'logo_path': '/wzKxIeQKlMP0y5CaAw25MD6EQmf.png', 'name': 'RatPac Entertainment', 'origin_country': 'US'}]","[{'english_name': 'English', 'iso_639_1': 'en', 'name': 'English'}, {'english_name': 'French', 'iso_639_1': 'fr', 'name': 'Français'}]",Released,Blood lost. Life found.,"In the 1820s, a frontiersman, Hugh Glass, sets out on a path of vengeance against those who left him for dead after a bear mauling.",tt1663202,"[{'iso_3166_1': 'CA', 'name': 'Canada'}, {'iso_3166_1': 'HK', 'name': 'Hong Kong'}, {'iso_3166_1': 'TW', 'name': 'Taiwan'}, {'iso_3166_1': 'US', 'name': 'United States of America'}]",en
63,1995-12-29,Twelve Monkeys,Twelve Monkeys,29000000,168841459,129,105.973,7.598,8328,False,,"[{'id': 878, 'name': 'Science Fiction'}, {'id': 53, 'name': 'Thriller'}, {'id': 9648, 'name': 'Mystery'}]","[{'id': 33, 'logo_path': '/3wwjVpkZtnog6lSKzWDjvw2Yi00.png', 'name': 'Universal Pictures', 'origin_country': 'US'}, {'id': 507, 'logo_path': '/aRmHe6GWxYMRCQljF75rn2B9Gv8.png', 'name': 'Atlas Entertainment', 'origin_country': 'US'}, {'id': 17031, 'logo_path': None, 'name': 'Classico', 'origin_country': ''}, {'id': 207976, 'logo_path': None, 'name': 'Twelve Monkeys Productions', 'origin_country': ''}]","[{'english_name': 'English', 'iso_639_1': 'en', 'name': 'English'}, {'english_name': 'French', 'iso_639_1': 'fr', 'name': 'Français'}]",Released,The future is history.,"In the year 2035, convict James Cole reluctantly volunteers to be sent back in time to discover the origin of a deadly virus that wiped out nearly all of the earth's population and forced the survivors into underground communities. But when Cole is mistakenly sent to 1990 instead of 1996, he's arrested and locked up in a mental hospital. There he meets psychiatrist Dr. Kathryn Railly, and patient Jeffrey Goines, the son of a famous virus expert, who may hold the key to the mysterious rogue group, the Army of the 12 Monkeys, thought to be responsible for unleashing the killer disease.",tt0114746,"[{'iso_3166_1': 'US', 'name': 'United States of America'}]",en
27582,2011-01-13,The Mechanic,The Mechanic,40000000,51070807,93,98.358,6.523,3233,False,"{'id': 280504, 'name': 'Mechanic Collection', 'poster_path': '/vjD3kIvyxOx8yW3SM0kqmZja0py.jpg', 'backdrop_path': '/vexuvLnuX6MD2A9A8CZ5dxczmgp.jpg'}","[{'id': 28, 'name': 'Action'}, {'id': 53, 'name': 'Thriller'}, {'id': 80, 'name': 'Crime'}]","[{'id': 5490, 'logo_path': '/xuJSR4dWsvkE194aemIJwflyNF2.png', 'name': 'CBS Films', 'origin_country': 'US'}, {'id': 925, 'logo_path': '/dIb9hjXNOkgxu4kBWdIdK8nM4w.png', 'name': 'Nu Image', 'origin_country': 'US'}, {'id': 115204, 'logo_path': '/vNTw00vaM0GLv4UiXXE3h7ZwIYf.png', 'name': 'Millenium Films', 'origin_country': 'US'}, {'id': 12252, 'logo_path': None, 'name': 'Chartoff-Winkler Productions', 'origin_country': 'US'}]","[{'english_name': 'English', 'iso_639_1': 'en', 'name': 'English'}]",Released,Someone has to fix the problems.,"Arthur Bishop is a 'mechanic' - an elite assassin with a strict code requiring professional perfection and total detachment. One of an elite group of assassins, Bishop may be the best in the business - with a unique talent for cleanly eliminating targets. When Harry McKenna, his close friend and mentor, is murdered, Harry's son comes to him with vengeance in his heart and a desire to learn Bishop's trade, signaling the birth of a deadly partnership.",tt0472399,"[{'iso_3166_1': 'US', 'name': 'United States of America'}]",en
5503,1993-08-06,The Fugitive,The Fugitive,44000000,183875799,131,89.956,7.469,4225,False,"{'id': 721111, 'name': 'Marshal Samuel Gerard Collection', 'poster_path': '/x3JFeOU5DwpRKpwkYpH1oL3QN8I.jpg', 'backdrop_path': '/e2e08PJii5xXSnSwsHDSkDhSP4Q.jpg'}","[{'id': 28, 'name': 'Action'}, {'id': 53, 'name': 'Thriller'}, {'id': 18, 'name': 'Drama'}]","[{'id': 174, 'logo_path': '/zhD3hhtKB5qyv7ZeL4uLpNxgMVU.png', 'name': 'Warner Bros. Pictures', 'origin_country': 'US'}]","[{'english_name': 'English', 'iso_639_1': 'en', 'name': 'English'}]",Released,A murdered wife. A one-armed man. An obsessed detective. The chase begins.,"Wrongfully convicted of murdering his wife and sentenced to death, Richard Kimble escapes from the law in an attempt to find the real killer and clear his name.",tt0106977,"[{'iso_3166_1': 'US', 'name': 'United States of America'}]",en
665,1959-11-18,Ben-Hur,Ben-Hur,15000000,164000000,222,85.956,7.883,2752,False,,"[{'id': 36, 'name': 'History'}, {'id': 18, 'name': 'Drama'}, {'id': 12, 'name': 'Adventure'}, {'id': 28, 'name': 'Action'}]","[{'id': 21, 'logo_path': '/usUnaYV6hQnlVAXP6r4HwrlLFPG.png', 'name': 'Metro-Goldwyn-Mayer', 'origin_country': 'US'}]","[{'english_name': 'English', 'iso_639_1': 'en', 'name': 'English'}]",Released,The entertainment experience of a lifetime!,"In 25 AD, Judah Ben-Hur, a Jew in ancient Judea, opposes the occupying Roman empire.  Falsely accused by a Roman childhood friend-turned-overlord of trying to kill the Roman governor, he is put into slavery and his mother and sister are taken away as prisoners.",tt0052618,"[{'iso_3166_1': 'US', 'name': 'United States of America'}]",en
111,1983-12-09,Scarface,Scarface,25000000,66023329,169,85.474,8.165,11828,False,,"[{'id': 28, 'name': 'Action'}, {'id': 80, 'name': 'Crime'}, {'id': 18, 'name': 'Drama'}]","[{'id': 33, 'logo_path': '/3wwjVpkZtnog6lSKzWDjvw2Yi00.png', 'name': 'Universal Pictures', 'origin_country': 'US'}, {'id': 56976, 'logo_path': None, 'name': 'Martin Bregman Productions', 'origin_country': 'US'}]","[{'english_name': 'English', 'iso_639_1': 'en', 'name': 'English'}, {'english_name': 'Spanish', 'iso_639_1': 'es', 'name': 'Español'}]",Released,The world is yours.,"After getting a green card in exchange for assassinating a Cuban government official, Tony Montana stakes a claim on the drug trade in Miami. Viciously murdering anyone who stands in his way, Tony eventually becomes the biggest drug lord in the state, controlling nearly all the cocaine that comes through Miami. But increased pressure from the police, wars with Colombian drug cartels and his own drug-fueled paranoia serve to fuel the flames of his eventual downfall.",tt0086250,"[{'iso_3166_1': 'US', 'name': 'United States of America'}]",en
461130,2019-12-06,Code 8,Code 8,15000000,157209,99,84.693,6.261,1985,False,"{'id': 1196403, 'name': 'Code 8 Collection', 'poster_path': '/qbnLY7PXGDTidMUUqWPUVari9pq.jpg', 'backdrop_path': '/hQEm07zXMhxonxs7M2dXBzTfeV4.jpg'}","[{'id': 878, 'name': 'Science Fiction'}, {'id': 28, 'name': 'Action'}, {'id': 80, 'name': 'Crime'}]","[{'id': 126355, 'logo_path': None, 'name': 'Colony Pictures', 'origin_country': 'CA'}, {'id': 36109, 'logo_path': '/wca0Jcidf2N1KAPicYMjGoKOmYu.png', 'name': 'The Fyzz', 'origin_country': 'GB'}, {'id': 126513, 'logo_path': None, 'name': 'Lane E Productions', 'origin_country': 'US'}, {'id': 12142, 'logo_path': '/rPnEeMwxjI6rYMGqkWqIWwIJXxi.png', 'name': 'XYZ Films', 'origin_country': 'US'}, {'id': 82659, 'logo_path': '/3mZkZUZUaqXDcIoYnECLb98PSWC.png', 'name': 'Blue Ice Pictures', 'origin_country': 'CA'}, {'id': 806, 'logo_path': '/kcNh09qqR2Pkw1JAzRW4CommrW4.png', 'name': 'Téléfilm Canada', 'origin_country': 'CA'}, {'id': 26742, 'logo_path': None, 'name': 'Collective Pictures', 'origin_country': 'CA'}]","[{'english_name': 'English', 'iso_639_1': 'en', 'name': 'English'}]",Released,Fear is the most dangerous power,"In Lincoln City, some inhabitants have extraordinary abilities. Most live below the poverty line, under the close surveillance of a heavily militarized police force. Connor, a construction worker with powers, involves with a criminal gang to help his ailing mother. (Based on the short film “Code 8,” 2016.)",tt6259380,"[{'iso_3166_1': 'CA', 'name': 'Canada'}, {'iso_3166_1': 'GB', 'name': 'United Kingdom'}, {'iso_3166_1': 'US', 'name': 'United States of America'}]",en
321612,2017-03-16,Beauty and the Beast,Beauty and the Beast,160000000,1266115964,129,82.049,6.97,15411,False,,"[{'id': 10751, 'name': 'Family'}, {'id': 14, 'name': 'Fantasy'}, {'id': 10749, 'name': 'Romance'}]","[{'id': 2, 'logo_path': '/wdrCwmRnLFJhEoH8GSfymY85KHT.png', 'name': 'Walt Disney Pictures', 'origin_country': 'US'}, {'id': 10227, 'logo_path': '/3YfRy3DBl4abcqkzGx4RVNz12yl.png', 'name': 'Mandeville Films', 'origin_country': 'US'}]","[{'english_name': 'English', 'iso_639_1': 'en', 'name': 'English'}, {'english_name': 'French', 'iso_639_1': 'fr', 'name': 'Français'}]",Released,Be our guest.,A live-action adaptation of Disney's version of the classic tale of a cursed prince and a beautiful young woman who helps him break the spell.,tt2771200,"[{'iso_3166_1': 'US', 'name': 'United States of America'}]",en
1903,2001-12-14,Vanilla Sky,Vanilla Sky,68000000,203388341,136,72.422,6.8,4125,False,,"[{'id': 878, 'name': 'Science Fiction'}, {'id': 10749, 'name': 'Romance'}, {'id': 18, 'name': 'Drama'}, {'id': 14, 'name': 'Fantasy'}, {'id': 53, 'name': 'Thriller'}, {'id': 9648, 'name': 'Mystery'}]","[{'id': 4, 'logo_path': '/gz66EfNoYPqHTYI4q9UEN4CbHRc.png', 'name': 'Paramount Pictures', 'origin_country': 'US'}, {'id': 44, 'logo_path': '/6Hs6K20Hz1W9W1Tiam5QN2Kpx8V.png', 'name': 'Cruise/Wagner Productions', 'origin_country': 'US'}, {'id': 485, 'logo_path': '/tVOP0mIeoYLua4Rw66OYNzitrrI.png', 'name': 'Vinyl Films', 'origin_country': 'US'}, {'id': 692, 'logo_path': '/mKVxLKcaUmevZUfxsuKzfIoeSw.png', 'name': 'Sogecine', 'origin_country': 'ES'}, {'id': 491, 'logo_path': '/5LvDUt3KmvRnXQ4NrdWJYHeuA8J.png', 'name': 'Summit Entertainment', 'origin_country': 'US'}, {'id': 2188, 'logo_path': '/f1zrx8bIsS81AHoPQq4riJx68Lt.png', 'name': 'Artisan Entertainment', 'origin_country': 'US'}]","[{'english_name': 'English', 'iso_639_1': 'en', 'name': 'English'}, {'english_name': 'Portuguese', 'iso_639_1': 'pt', 'name': 'Português'}, {'english_name': 'Spanish', 'iso_639_1': 'es', 'name': 'Español'}]",Released,LoveHateDreamsLifeWorkPlayFriendshipSex,"David Aames has it all: wealth, good looks and gorgeous women on his arm. But just as he begins falling for the warmhearted Sofia, his face is horribly disfigured in a car accident. That's just the beginning of his troubles as the lines between illusion and reality, between life and death, are blurred.",tt0259711,"[{'iso_3166_1': 'US', 'name': 'United States of America'}, {'iso_3166_1': 'ES', 'name': 'Spain'}]",en
65754,2011-12-14,The Girl with the Dragon Tattoo,The Girl with the Dragon Tattoo,90000000,232617430,158,71.45,7.375,6947,False,"{'id': 575987, 'name': 'The Girl - Millennium Collection', 'poster_path': '/eZEAiTIF3DrnWdDLz25ibINs5iJ.jpg', 'backdrop_path': '/oCInm8wwTCIk6ElzHiXuhL2K7om.jpg'}","[{'id': 53, 'name': 'Thriller'}, {'id': 80, 'name': 'Crime'}, {'id': 9648, 'name': 'Mystery'}]","[{'id': 5, 'logo_path': '/71BqEFAF4V3qjjMPCpLuyJFB9A.png', 'name': 'Columbia Pictures', 'origin_country': 'US'}, {'id': 21, 'logo_path': '/usUnaYV6hQnlVAXP6r4HwrlLFPG.png', 'name': 'Metro-Goldwyn-Mayer', 'origin_country': 'US'}, {'id': 258, 'logo_path': '/tMI4xPwgxfNaNId3h9dOcHGU1NI.png', 'name': 'Scott Rudin Productions', 'origin_country': 'US'}, {'id': 5746, 'logo_path': '/sWgSj9muRStENKBoIoaDK6OZmDu.png', 'name': 'Yellow Bird', 'origin_country': 'SE'}]","[{'english_name': 'English', 'iso_639_1': 'en', 'name': 'English'}, {'english_name': 'French', 'iso_639_1': 'fr', 'name': 'Français'}]",Released,"What is hidden in snow, comes forth in the thaw.","Disgraced journalist Mikael Blomkvist investigates the disappearance of a weary patriarch's niece from 40 years ago. He is aided by the pierced, tattooed, punk computer hacker named Lisbeth Salander. As they work together in the investigation, Blomkvist and Salander uncover immense corruption beyond anything they have ever imagined.",tt1568346,"[{'iso_3166_1': 'SE', 'name': 'Sweden'}, {'iso_3166_1': 'US', 'name': 'United States of America'}]",en
9820,1998-07-28,The Parent Trap,The Parent Trap,15000000,92108518,128,70.675,7.2,4152,False,,"[{'id': 35, 'name': 'Comedy'}, {'id': 10751, 'name': 'Family'}, {'id': 10749, 'name': 'Romance'}]","[{'id': 2, 'logo_path': '/wdrCwmRnLFJhEoH8GSfymY85KHT.png', 'name': 'Walt Disney Pictures', 'origin_country': 'US'}, {'id': 8795, 'logo_path': None, 'name': 'The Meyers/Shyer Company', 'origin_country': 'US'}]","[{'english_name': 'English', 'iso_639_1': 'en', 'name': 'English'}, {'english_name': 'French', 'iso_639_1': 'fr', 'name': 'Français'}, {'english_name': 'Italian', 'iso_639_1': 'it', 'name': 'Italiano'}, {'english_name': 'Spanish', 'iso_639_1': 'es', 'name': 'Español'}]",Released,"Twice the Fun, Double the Trouble.","Hallie Parker and Annie James are identical twins separated at a young age because of their parents' divorce. Unknowingly to their parents, the girls are sent to the same summer camp where they meet, discover the truth about themselves, and then plot with each other to switch places.",tt0120783,"[{'iso_3166_1': 'US', 'name': 'United States of America'}]",en
64635,2012-08-02,Total Recall,Total Recall,125000000,198800000,118,70.237,6.014,5437,False,,"[{'id': 28, 'name': 'Action'}, {'id': 878, 'name': 'Science Fiction'}, {'id': 53, 'name': 'Thriller'}]","[{'id': 85921, 'logo_path': None, 'name': 'Total Recall', 'origin_country': ''}, {'id': 333, 'logo_path': '/5xUJfzPZ8jWJUDzYtIeuPO4qPIa.png', 'name': 'Original Film', 'origin_country': 'US'}, {'id': 15357, 'logo_path': '/uvaRT02pY9U8qLH8a9WwwAroDqr.png', 'name': 'Prime Focus', 'origin_country': 'IN'}, {'id': 12676, 'logo_path': None, 'name': 'Rekall Productions', 'origin_country': ''}, {'id': 5, 'logo_path': '/71BqEFAF4V3qjjMPCpLuyJFB9A.png', 'name': 'Columbia Pictures', 'origin_country': 'US'}]","[{'english_name': 'English', 'iso_639_1': 'en', 'name': 'English'}]",Released,What Is Real?,"Factory worker Doug Quaid takes a virtual mind-trip vacation with the Rekall company, opting for implanted memories of being a spy. When the procedure goes wrong, Quaid becomes a wanted man by the police and joins forces with a rebel fighter to stop the evil Chancellor Cohaagen.",tt1386703,"[{'iso_3166_1': 'CA', 'name': 'Canada'}, {'iso_3166_1': 'IN', 'name': 'India'}, {'iso_3166_1': 'US', 'name': 'United States of America'}]",en
203801,2015-08-13,The Man from U.N.C.L.E.,The Man from U.N.C.L.E.,75000000,108100000,116,67.957,7.089,6305,False,,"[{'id': 35, 'name': 'Comedy'}, {'id': 28, 'name': 'Action'}, {'id': 12, 'name': 'Adventure'}]","[{'id': 23202, 'logo_path': None, 'name': 'Wigram Productions', 'origin_country': 'US'}, {'id': 1302, 'logo_path': '/zC3b70ixHh89qJIikLQPEvLqbPM.png', 'name': 'Davis Entertainment', 'origin_country': 'US'}, {'id': 41624, 'logo_path': '/wzKxIeQKlMP0y5CaAw25MD6EQmf.png', 'name': 'RatPac Entertainment', 'origin_country': 'US'}, {'id': 174, 'logo_path': '/zhD3hhtKB5qyv7ZeL4uLpNxgMVU.png', 'name': 'Warner Bros. Pictures', 'origin_country': 'US'}]","[{'english_name': 'Italian', 'iso_639_1': 'it', 'name': 'Italiano'}, {'english_name': 'English', 'iso_639_1': 'en', 'name': 'English'}, {'english_name': 'Russian', 'iso_639_1': 'ru', 'name': 'Pусский'}, {'english_name': 'German', 'iso_639_1': 'de', 'name': 'Deutsch'}]",Released,Saving the world never goes out of style.,"At the height of the Cold War, a mysterious criminal organization plans to use nuclear weapons and technology to upset the fragile balance of power between the United States and Soviet Union. CIA agent Napoleon Solo and KGB agent Illya Kuryakin are forced to put aside their hostilities and work together to stop the evildoers in their tracks. The duo's only lead is the daughter of a missing German scientist, whom they must find soon to prevent a global catastrophe.",tt1638355,"[{'iso_3166_1': 'US', 'name': 'United States of America'}]",en
924,2004-03-19,Dawn of the Dead,Dawn of the Dead,26000000,102278712,101,64.25,7.1,3993,False,,"[{'id': 28, 'name': 'Action'}, {'id': 27, 'name': 'Horror'}, {'id': 878, 'name': 'Science Fiction'}]","[{'id': 572, 'logo_path': None, 'name': 'New Amsterdam Entertainment', 'origin_country': ''}, {'id': 655, 'logo_path': None, 'name': 'Strike Entertainment', 'origin_country': 'US'}, {'id': 657, 'logo_path': '/mDBPrBO6hl21KhQOzCVYUBo33zt.png', 'name': 'TOHO-TOWA', 'origin_country': 'JP'}, {'id': 33, 'logo_path': '/3wwjVpkZtnog6lSKzWDjvw2Yi00.png', 'name': 'Universal Pictures', 'origin_country': 'US'}, {'id': 9995, 'logo_path': '/mAIGhOYhN4N2N0F7p4dbKhgXf3l.png', 'name': 'Cruel & Unusual Films', 'origin_country': 'US'}, {'id': 882, 'logo_path': '/fRSWWjquvzcHjACbtF53utZFIll.png', 'name': 'TOHO', 'origin_country': 'JP'}, {'id': 16419, 'logo_path': '/8ppVamMu9jnA72kOi4e9grvx6Ex.png', 'name': 'Metropolitan Filmexport', 'origin_country': 'FR'}, {'id': 830, 'logo_path': '/mYga54mrt5n4GUUcJxE6DmR2FKv.png', 'name': 'Senator International', 'origin_country': 'US'}]","[{'english_name': 'English', 'iso_639_1': 'en', 'name': 'English'}]",Released,"When there's no more room in Hell, the dead will walk the Earth.","A group of survivors take refuge in a shopping mall after the world is taken over by aggressive, flesh-eating zombies.",tt0363547,"[{'iso_3166_1': 'CA', 'name': 'Canada'}, {'iso_3166_1': 'FR', 'name': 'France'}, {'iso_3166_1': 'JP', 'name': 'Japan'}, {'iso_3166_1': 'US', 'name': 'United States of America'}]",en
