id,release_date,original_title,title,budget,revenue,runtime,popularity,vote_average,vote_count,adult,belongs_to_collection,genres,production_companies,spoken_languages,status,tagline,overview,imdb_id,production_countries,original_language
360920,2018-11-08,The Grinch,The Grinch,75000000,508600000,85,379.385,6.863,3967,False,,"[{'id': 16, 'name': 'Animation'}, {'id': 10751, 'name': 'Family'}, {'id': 35, 'name': 'Comedy'}, {'id': 14, 'name': 'Fantasy'}]","[{'id': 6704, 'logo_path': '/fOG2oY4m1YuYTQh4bMqqZkmgOAI.png', 'name': 'Illumination', 'origin_country': 'US'}, {'id': 180651, 'logo_path': None, 'name': 'Dr. Seuss Enterprises', 'origin_country': 'US'}, {'id': 5556, 'logo_path': '/AtHcoKwxqH6wHrgodaPtZqRirIX.png', 'name': 'Universal Animation Studios', 'origin_country': 'US'}]","[{'english_name': 'English', 'iso_639_1': 'en', 'name': 'English'}]",Released,It was the heist before Christmas.,The Grinch hatches a scheme to ruin Christmas when the residents of Whoville plan their annual holiday celebration.,tt2709692,"[{'iso_3166_1': 'US', 'name': 'United States of America'}]",en
420818,2019-07-12,The Lion King,The Lion King,260000000,1663000000,118,170.177,7.1,9998,False,"{'id': 762512, 'name': 'The Lion King (Reboot) Collection', 'poster_path': '/dGpIRn4Nqi63JO1RlKxjcPbQSAw.jpg', 'backdrop_path': '/jIgM7YNVft0YGeXsqrh3oG5TWLx.jpg'}","[{'id': 16, 'name': 'Animation'}, {'id': 12, 'name': 'Adventure'}, {'id': 18, 'name': 'Drama'}, {'id': 10751, 'name': 'Family'}]","[{'id': 2, 'logo_path': '/wdrCwmRnLFJhEoH8GSfymY85KHT.png', 'name': 'Walt Disney Pictures', 'origin_country': 'US'}, {'id': 7297, 'logo_path': '/l29JYQVZbTcjZXoz4CUYFpKRmM3.png', 'name': 'Fairview Entertainment', 'origin_country': 'US'}]","[{'english_name': 'English', 'iso_639_1': 'en', 'name': 'English'}]",Released,The king has returned.,"Simba idolizes his father, King Mufasa, and takes to heart his own royal destiny. But not everyone in the kingdom celebrates the new cub's arrival. Scar, Mufasa's brother—and former heir to the throne—has plans of his own. The battle for Pride Rock is ravaged with betrayal, tragedy and drama, ultimately resulting in Simba's exile. With help from a curious pair of newfound friends, Simba will have to figure out how to grow up and take back what is rightfully his.",tt6105098,"[{'iso_3166_1': 'US', 'name': 'United States of America'}]",en
156022,2014-09-24,The Equalizer,The Equalizer,55000000,192330738,132,136.16,7.282,9041,False,"{'id': 523855, 'name': 'The Equalizer Collection', 'poster_path': '/w9taToc4xcVE9duBwbywp0nAnue.jpg', 'backdrop_path': '/wac5llYhh0lC24yNWljrcOe4sR9.jpg'}","[{'id': 53, 'name': 'Thriller'}, {'id': 28, 'name': 'Action'}, {'id': 80, 'name': 'Crime'}]","[{'id': 41096, 'logo_path': None, 'name': 'Lonetree Entertainment', 'origin_country': 'US'}, {'id': 5, 'logo_path': '/71BqEFAF4V3qjjMPCpLuyJFB9A.png', 'name': 'Columbia Pictures', 'origin_country': 'US'}, {'id': 79, 'logo_path': '/at4uYdwAAgNRKhZuuFX8ShKSybw.png', 'name': 'Village Roadshow Pictures', 'origin_country': 'US'}, {'id': 1423, 'logo_path': '/gzvsPHV9WqcQMrvI8pq5hbuvEZ5.png', 'name': 'Escape Artists', 'origin_country': 'US'}, {'id': 34034, 'logo_path': None, 'name': 'LStar Capital', 'origin_country': 'US'}, {'id': 2767, 'logo_path': None, 'name': 'Mace Neufeld Productions', 'origin_country': 'US'}]","[{'english_name': 'English', 'iso_639_1': 'en', 'name': 'English'}]",Released,What do you see when you look at me?,"McCall believes he has put his mysterious past behind him and dedicated himself to beginning a new, quiet life. But when he meets Teri, a young girl under the control of ultra-violent Russian gangsters, he can’t stand idly by – he has to help her. Armed with hidden skills that allow him to serve vengeance against anyone who would brutalize the helpless, McCall comes out of his self-imposed retirement and finds his desire for justice reawakened. If someone has a problem, if the odds are stacked against them, if they have nowhere else to turn, McCall will help. He is The Equalizer.",tt0455944,"[{'iso_3166_1': 'US', 'name': 'United States of America'}]",en
321612,2017-03-16,Beauty and the Beast,Beauty and the Beast,160000000,1266115964,129,95.838,6.97,15416,False,,"[{'id': 10751, 'name': 'Family'}, {'id': 14, 'name': 'Fantasy'}, {'id': 10749, 'name': 'Romance'}]","[{'id': 2, 'logo_path': '/wdrCwmRnLFJhEoH8GSfymY85KHT.png', 'name': 'Walt Disney Pictures', 'origin_country': 'US'}, {'id': 10227, 'logo_path': '/3YfRy3DBl4abcqkzGx4RVNz12yl.png', 'name': 'Mandeville Films', 'origin_country': 'US'}]","[{'english_name': 'English', 'iso_639_1': 'en', 'name': 'English'}, {'english_name': 'French', 'iso_639_1': 'fr', 'name': 'Français'}]",Released,Be our guest.,A live-action adaptation of Disney's version of the classic tale of a cursed prince and a beautiful young woman who helps him break the spell.,tt2771200,"[{'iso_3166_1': 'US', 'name': 'United States of America'}]",en
281957,2015-12-25,The Revenant,The Revenant,135000000,532950503,157,57.797,7.533,18067,False,,"[{'id': 37, 'name': 'Western'}, {'id': 18, 'name': 'Drama'}, {'id': 12, 'name': 'Adventure'}]","[{'id': 77845, 'logo_path': None, 'name': 'Monarchy Enterprises S.a.r.l.', 'origin_country': ''}, {'id': 508, 'logo_path': '/7cxRWzi4LsVm4Utfpr1hfARNurT.png', 'name': 'Regency Enterprises', 'origin_country': 'US'}, {'id': 562, 'logo_path': '/azANEzu3H3Kztzt63sdjvlzxhuB.png', 'name': 'Appian Way', 'origin_country': 'US'}, {'id': 8870, 'logo_path': '/f2hj6ssc0KBRSafGnycnN5A1aGF.png', 'name': 'CatchPlay', 'origin_country': 'TW'}, {'id': 10039, 'logo_path': '/b8w4LldQolMKiLZw4FQJBcXSDGI.png', 'name': 'Anonymous Content', 'origin_country': 'US'}, {'id': 10104, 'logo_path': '/wRn5HnYMGeJHmItRypgOZOC6gwY.png', 'name': 'New Regency Pictures', 'origin_country': 'US'}, {'id': 13796, 'logo_path': None, 'name': 'Hong Kong Alpha Motion Pictures Co.', 'origin_country': 'HK'}, {'id': 52660, 'logo_path': None, 'name': 'M Productions', 'origin_country': ''}, {'id': 41624, 'logo_path': '/wzKxIeQKlMP0y5CaAw25MD6EQmf.png', 'name': 'RatPac Entertainment', 'origin_country': 'US'}]","[{'english_name': 'English', 'iso_639_1': 'en', 'name': 'English'}, {'english_name': 'French', 'iso_639_1': 'fr', 'name': 'Français'}]",Released,Revenge proves its own executioner.,"In the 1820s, a frontiersman, Hugh Glass, sets out on a path of vengeance against those who left him for dead after a bear mauling.",tt1663202,"[{'iso_3166_1': 'CA', 'name': 'Canada'}, {'iso_3166_1': 'HK', 'name': 'Hong Kong'}, {'iso_3166_1': 'TW', 'name': 'Taiwan'}, {'iso_3166_1': 'US', 'name': 'United States of America'}]",en
474350,2019-09-04,It Chapter Two,It Chapter Two,79000000,473123154,169,57.525,6.843,8737,False,"{'id': 477962, 'name': 'It Collection', 'poster_path': '/9tnrNFF450DWUQu3DzyFXVmuE8e.jpg', 'backdrop_path': '/ayvH5IW5eDOa28WfSjnkYMii73d.jpg'}","[{'id': 27, 'name': 'Horror'}, {'id': 18, 'name': 'Drama'}, {'id': 14, 'name': 'Fantasy'}]","[{'id': 12, 'logo_path': '/2ycs64eqV5rqKYHyQK0GVoKGvfX.png', 'name': 'New Line Cinema', 'origin_country': 'US'}, {'id': 829, 'logo_path': '/aXqwCvJSCDbTclkxAYfsT1l4Dsa.png', 'name': 'Vertigo Entertainment', 'origin_country': 'US'}, {'id': 152809, 'logo_path': None, 'name': 'Double Dream', 'origin_country': 'US'}, {'id': 118854, 'logo_path': '/g9LPNlQFoDcHjfnvrEqFmeIaDrZ.png', 'name': 'Rideback', 'origin_country': 'US'}]","[{'english_name': 'English', 'iso_639_1': 'en', 'name': 'English'}]",Released,It ends,"27 years after overcoming the malevolent supernatural entity Pennywise, the former members of the Losers' Club, who have grown up and moved away from Derry, are brought back together by a devastating phone call.",tt7349950,"[{'iso_3166_1': 'US', 'name': 'United States of America'}]",en
331482,2019-12-25,Little Women,Little Women,40000000,216600000,135,56.169,7.877,6255,False,,"[{'id': 18, 'name': 'Drama'}, {'id': 10749, 'name': 'Romance'}, {'id': 36, 'name': 'History'}]","[{'id': 5, 'logo_path': '/71BqEFAF4V3qjjMPCpLuyJFB9A.png', 'name': 'Columbia Pictures', 'origin_country': 'US'}, {'id': 508, 'logo_path': '/7cxRWzi4LsVm4Utfpr1hfARNurT.png', 'name': 'Regency Enterprises', 'origin_country': 'US'}, {'id': 84041, 'logo_path': '/nw4kyc29QRpNtFbdsBHkRSFavvt.png', 'name': 'Pascal Pictures', 'origin_country': 'US'}]","[{'english_name': 'French', 'iso_639_1': 'fr', 'name': 'Français'}, {'english_name': 'English', 'iso_639_1': 'en', 'name': 'English'}]",Released,Own your story,Four sisters come of age in America in the aftermath of the Civil War.,tt3281548,"[{'iso_3166_1': 'US', 'name': 'United States of America'}]",en
937278,2022-12-28,A Man Called Otto,A Man Called Otto,50000000,108961677,126,54.337,7.759,2783,False,,"[{'id': 35, 'name': 'Comedy'}, {'id': 18, 'name': 'Drama'}]","[{'id': 4171, 'logo_path': '/cdwjRVcXP9zws9gkiim0KkBNs9N.png', 'name': 'Playtone', 'origin_country': 'US'}, {'id': 6181, 'logo_path': '/eaQ7or8IoEmPfgmQiU2C5lVZkxS.png', 'name': 'SF Studios', 'origin_country': 'SE'}, {'id': 191075, 'logo_path': None, 'name': 'Artistic Films', 'origin_country': 'US'}, {'id': 5, 'logo_path': '/71BqEFAF4V3qjjMPCpLuyJFB9A.png', 'name': 'Columbia Pictures', 'origin_country': 'US'}, {'id': 23644, 'logo_path': '/wF4SeLFv2qjKQa3oS1eaGyS4Hms.png', 'name': '2DUX²', 'origin_country': 'US'}, {'id': 22213, 'logo_path': '/qx9K6bFWJupwde0xQDwOvXkOaL8.png', 'name': 'TSG Entertainment', 'origin_country': 'US'}]","[{'english_name': 'English', 'iso_639_1': 'en', 'name': 'English'}, {'english_name': 'Portuguese', 'iso_639_1': 'pt', 'name': 'Português'}, {'english_name': 'Spanish', 'iso_639_1': 'es', 'name': 'Español'}]",Released,Fall in love with the grumpiest man in America.,"When a lively young family moves in next door, grumpy widower Otto Anderson meets his match in a quick-witted, pregnant woman named Marisol, leading to an unlikely friendship that turns his world upside down.",tt7405458,"[{'iso_3166_1': 'SE', 'name': 'Sweden'}, {'iso_3166_1': 'US', 'name': 'United States of America'}]",en
762430,2023-08-23,Retribution,Retribution,20000000,16700000,91,53.683,6.648,1149,False,,"[{'id': 53, 'name': 'Thriller'}, {'id': 28, 'name': 'Action'}, {'id': 12, 'name': 'Adventure'}]","[{'id': 99132, 'logo_path': '/oKjgNvaMndJiBmcngrSWPWb8VYO.png', 'name': 'The Picture Company', 'origin_country': 'US'}, {'id': 23513, 'logo_path': None, 'name': 'Ombra Films', 'origin_country': 'US'}, {'id': 106689, 'logo_path': '/fWQ9uEqIKuPukxrbZEUIrkPRrjs.png', 'name': 'StudioCanal', 'origin_country': 'DE'}, {'id': 356, 'logo_path': '/9tW5wZEGotn1Ei5pErA88m47XiD.png', 'name': 'TF1 Films Production', 'origin_country': 'FR'}, {'id': 264, 'logo_path': '/fA90qwUKgPhMONqtwY60GaHRyrW.png', 'name': 'Studio Babelsberg', 'origin_country': 'DE'}]","[{'english_name': 'English', 'iso_639_1': 'en', 'name': 'English'}, {'english_name': 'German', 'iso_639_1': 'de', 'name': 'Deutsch'}]",Released,All roads lead to the truth.,"When a mysterious caller puts a bomb under his car seat, Matt Turner begins a high-speed chase across the city to complete a specific series of tasks- all with his kids trapped in the back seat.",tt6906292,"[{'iso_3166_1': 'FR', 'name': 'France'}, {'iso_3166_1': 'DE', 'name': 'Germany'}, {'iso_3166_1': 'US', 'name': 'United States of America'}]",en
124905,2014-05-14,Godzilla,Godzilla,160000000,524978362,123,47.023,6.343,9102,False,"{'id': 535313, 'name': 'Godzilla Collection', 'poster_path': '/inNN466SKHNjbGmpfhfsaPQNleS.jpg', 'backdrop_path': '/oboBn4VYB79uDxnyIri0Nt3U3N2.jpg'}","[{'id': 28, 'name': 'Action'}, {'id': 18, 'name': 'Drama'}, {'id': 878, 'name': 'Science Fiction'}]","[{'id': 923, 'logo_path': '/8M99Dkt23MjQMTTWukq4m5XsEuo.png', 'name': 'Legendary Pictures', 'origin_country': 'US'}]","[{'english_name': 'English', 'iso_639_1': 'en', 'name': 'English'}, {'english_name': 'Japanese', 'iso_639_1': 'ja', 'name': '日本語'}, {'english_name': 'Tagalog', 'iso_639_1': 'tl', 'name': ''}]",Released,"The world ends, Godzilla begins.","Ford Brody, a Navy bomb expert, has just reunited with his family in San Francisco when he is forced to go to Japan to help his estranged father, Joe. Soon, both men are swept up in an escalating crisis when an ancient alpha predator arises from the sea to combat malevolent adversaries that threaten the survival of humanity. The creatures leave colossal destruction in their wake, as they make their way toward their final battleground: San Francisco.",tt0831387,"[{'iso_3166_1': 'US', 'name': 'United States of America'}]",en
763285,2022-03-16,Ambulance,Ambulance,40000000,52303589,136,45.481,6.653,2125,False,,"[{'id': 53, 'name': 'Thriller'}, {'id': 28, 'name': 'Action'}, {'id': 80, 'name': 'Crime'}]","[{'id': 33, 'logo_path': '/3wwjVpkZtnog6lSKzWDjvw2Yi00.png', 'name': 'Universal Pictures', 'origin_country': 'US'}, {'id': 6734, 'logo_path': '/u55FhlG6vFNzSVKLcmnFFwLb2cc.png', 'name': 'Bay Films', 'origin_country': 'US'}, {'id': 100640, 'logo_path': '/5BR67T28TVm2UMH8GCRDftafsaJ.png', 'name': 'Endeavor Content', 'origin_country': 'US'}, {'id': 114732, 'logo_path': '/tNCbisMxO5mX2X2bOQxHHQZVYnT.png', 'name': 'New Republic Pictures', 'origin_country': 'US'}, {'id': 130448, 'logo_path': '/yHWTTGKbOGZKUd1cp6l3uLyDeiv.png', 'name': 'Project X Entertainment', 'origin_country': 'US'}]","[{'english_name': 'English', 'iso_639_1': 'en', 'name': 'English'}]",Released,It was supposed to be a simple heist.,"Decorated veteran Will Sharp, desperate for money to cover his wife's medical bills, asks for help from his adoptive brother Danny. A charismatic career criminal, Danny instead offers him a score: the biggest bank heist in Los Angeles history: $32 million.",tt4998632,"[{'iso_3166_1': 'US', 'name': 'United States of America'}]",en
420808,2023-04-20,Peter Pan & Wendy,Peter Pan & Wendy,0,0,106,44.659,5.501,669,False,,"[{'id': 10751, 'name': 'Family'}, {'id': 14, 'name': 'Fantasy'}, {'id': 28, 'name': 'Action'}, {'id': 12, 'name': 'Adventure'}]","[{'id': 2, 'logo_path': '/wdrCwmRnLFJhEoH8GSfymY85KHT.png', 'name': 'Walt Disney Pictures', 'origin_country': 'US'}, {'id': 51164, 'logo_path': None, 'name': 'Whitaker Entertainment', 'origin_country': 'US'}]","[{'english_name': 'English', 'iso_639_1': 'en', 'name': 'English'}]",Released,Escape to Neverland.,"Wendy Darling, a young girl afraid to leave her childhood home behind, meets Peter Pan, a boy who refuses to grow up. Alongside her brothers and a tiny fairy, Tinker Bell, she travels with Peter to the magical world of Neverland. There, she encounters an evil pirate captain, Captain Hook, and embarks on a thrilling adventure that will change her life forever.",tt5635026,"[{'iso_3166_1': 'CA', 'name': 'Canada'}, {'iso_3166_1': 'US', 'name': 'United States of America'}]",en
278927,2016-04-07,The Jungle Book,The Jungle Book,175000000,966550600,106,42.997,6.866,8017,False,,"[{'id': 10751, 'name': 'Family'}, {'id': 12, 'name': 'Adventure'}, {'id': 18, 'name': 'Drama'}, {'id': 14, 'name': 'Fantasy'}]","[{'id': 2, 'logo_path': '/wdrCwmRnLFJhEoH8GSfymY85KHT.png', 'name': 'Walt Disney Pictures', 'origin_country': 'US'}, {'id': 7297, 'logo_path': '/l29JYQVZbTcjZXoz4CUYFpKRmM3.png', 'name': 'Fairview Entertainment', 'origin_country': 'US'}, {'id': 20478, 'logo_path': '/gSS2OBc6dRsK2ewRx5lcwnARrpl.png', 'name': 'Moving Picture Company', 'origin_country': 'GB'}]","[{'english_name': 'English', 'iso_639_1': 'en', 'name': 'English'}]",Released,The legend will never be the same.,"A man-cub named Mowgli fostered by wolves. After a threat from the tiger Shere Khan, Mowgli is forced to flee the jungle, by which he embarks on a journey of self discovery with the help of the panther, Bagheera and the free-spirited bear, Baloo.",tt3040964,"[{'iso_3166_1': 'GB', 'name': 'United Kingdom'}, {'iso_3166_1': 'US', 'name': 'United States of America'}]",en
257088,2015-12-03,Point Break,Point Break,105000000,133782481,114,42.632,6.0,2288,False,,"[{'id': 28, 'name': 'Action'}, {'id': 12, 'name': 'Adventure'}, {'id': 80, 'name': 'Crime'}, {'id': 53, 'name': 'Thriller'}]","[{'id': 264, 'logo_path': '/fA90qwUKgPhMONqtwY60GaHRyrW.png', 'name': 'Studio Babelsberg', 'origin_country': 'DE'}, {'id': 1088, 'logo_path': '/9WOE5AQUXbOtLU6GTwfjS8OMF0v.png', 'name': 'Alcon Entertainment', 'origin_country': 'US'}, {'id': 10289, 'logo_path': '/4lXJcFjACjb34LF78AUjEz4FtB9.png', 'name': 'DMG Entertainment', 'origin_country': 'US'}, {'id': 195034, 'logo_path': None, 'name': 'Taylor-Baldecchi-Wimmer', 'origin_country': 'US'}, {'id': 174, 'logo_path': '/zhD3hhtKB5qyv7ZeL4uLpNxgMVU.png', 'name': 'Warner Bros. Pictures', 'origin_country': 'US'}, {'id': 491, 'logo_path': '/5LvDUt3KmvRnXQ4NrdWJYHeuA8J.png', 'name': 'Summit Entertainment', 'origin_country': 'US'}, {'id': 13016, 'logo_path': None, 'name': 'Cine Tirol', 'origin_country': 'AT'}, {'id': 10400, 'logo_path': '/9LlB2YAwXTkUAhx0pItSo6pDlkB.png', 'name': 'Eagle Pictures', 'origin_country': 'IT'}]","[{'english_name': 'English', 'iso_639_1': 'en', 'name': 'English'}]",Released,The only law that matters is gravity.,"A young undercover FBI agent infiltrates a gang of thieves who share a common interest in extreme sports. A remake of the 1991 film, ""Point Break"".",tt2058673,"[{'iso_3166_1': 'AT', 'name': 'Austria'}, {'iso_3166_1': 'CA', 'name': 'Canada'}, {'iso_3166_1': 'CN', 'name': 'China'}, {'iso_3166_1': 'DE', 'name': 'Germany'}, {'iso_3166_1': 'IT', 'name': 'Italy'}, {'iso_3166_1': 'US', 'name': 'United States of America'}]",en
329996,2019-03-27,Dumbo,Dumbo,170000000,353284621,112,41.035,6.6,4308,False,,"[{'id': 10751, 'name': 'Family'}, {'id': 14, 'name': 'Fantasy'}, {'id': 12, 'name': 'Adventure'}]","[{'id': 8601, 'logo_path': '/kqubCH3sfBAk4znUj7hjqv8ffgi.png', 'name': 'Tim Burton Productions', 'origin_country': 'US'}, {'id': 2, 'logo_path': '/wdrCwmRnLFJhEoH8GSfymY85KHT.png', 'name': 'Walt Disney Pictures', 'origin_country': 'US'}, {'id': 120402, 'logo_path': None, 'name': 'Infinite Detective', 'origin_country': ''}, {'id': 120403, 'logo_path': None, 'name': 'Secret Machine Entertainment', 'origin_country': ''}, {'id': 120404, 'logo_path': None, 'name': 'British Film Commission', 'origin_country': 'GB'}, {'id': 2806, 'logo_path': '/vxOhCbpsRBh10m6LZ3HyImTYpPY.png', 'name': 'South Australian Film Corporation', 'origin_country': 'AU'}]","[{'english_name': 'English', 'iso_639_1': 'en', 'name': 'English'}]",Released,Soar to new heights.,"A young elephant, whose oversized ears enable him to fly, helps save a struggling circus, but when the circus plans a new venture, Dumbo and his friends discover dark secrets beneath its shiny veneer.",tt3861390,"[{'iso_3166_1': 'AU', 'name': 'Australia'}, {'iso_3166_1': 'CA', 'name': 'Canada'}, {'iso_3166_1': 'GB', 'name': 'United Kingdom'}, {'iso_3166_1': 'US', 'name': 'United States of America'}]",en
818397,2022-04-28,Memory,Memory,30000000,13900000,114,40.79,6.789,1492,False,,"[{'id': 28, 'name': 'Action'}, {'id': 53, 'name': 'Thriller'}, {'id': 80, 'name': 'Crime'}]","[{'id': 22146, 'logo_path': '/v37N1mFeXNQfvPankg3feBhVvM7.png', 'name': 'Black Bear Pictures', 'origin_country': 'US'}, {'id': 173612, 'logo_path': '/c3qT8JXmVUtkSqJ8eZYkN1Ezf4C.png', 'name': 'Welle Entertainment', 'origin_country': 'US'}, {'id': 73620, 'logo_path': '/kQQbILUGiewlKlkK2WeYdLZ61Sm.png', 'name': 'Saville Productions', 'origin_country': 'US'}, {'id': 10427, 'logo_path': '/3u5sNgPRbba0ND3SUMXPTT7On9h.png', 'name': 'Open Road Films', 'origin_country': 'US'}, {'id': 191127, 'logo_path': '/u1PuaaODldWd4hBsQLcJDDjkZy1.png', 'name': 'Briarcliff Entertainment', 'origin_country': 'US'}, {'id': 47729, 'logo_path': '/bAxh897TGgdR0Py6wdd0UuE147Z.png', 'name': 'STXfilms', 'origin_country': 'US'}]","[{'english_name': 'English', 'iso_639_1': 'en', 'name': 'English'}, {'english_name': 'Spanish', 'iso_639_1': 'es', 'name': 'Español'}]",Released,His mind is fading. His conscience is clear.,"Alex, an assassin-for-hire, finds that he's become a target after he refuses to complete a job for a dangerous criminal organization. With the crime syndicate and FBI in hot pursuit, Alex has the skills to stay ahead, except for one thing: he is struggling with severe memory loss, affecting his every move. Alex must question his every action and whom he can ultimately trust.",tt11827628,"[{'iso_3166_1': 'US', 'name': 'United States of America'}]",en
505026,2022-02-09,Death on the Nile,Death on the Nile,90000000,137307235,127,39.956,6.427,3665,False,"{'id': 735384, 'name': 'Hercule Poirot (Kenneth Branagh) Collection', 'poster_path': '/cbml6OHQ6dXfRbFhZQ2Fi422z7L.jpg', 'backdrop_path': '/rI27nF0juWNs3vwhQ8p2qUwE88F.jpg'}","[{'id': 9648, 'name': 'Mystery'}, {'id': 80, 'name': 'Crime'}, {'id': 53, 'name': 'Thriller'}]","[{'id': 1557, 'logo_path': '/ccz9bqCu3jSFKbPFnfWmjAKZLBL.png', 'name': 'The Mark Gordon Company', 'origin_country': 'US'}, {'id': 28788, 'logo_path': '/Aqomtf9oh5dKtxBNEagkdlp3aGv.png', 'name': 'Genre Films', 'origin_country': 'US'}, {'id': 127928, 'logo_path': '/h0rjX5vjW5r8yEnUBStFarjcLT4.png', 'name': '20th Century Studios', 'origin_country': 'US'}, {'id': 221347, 'logo_path': '/6Ry6uNBaa0IbbSs1XYIgX5DkA9r.png', 'name': 'Scott Free Productions', 'origin_country': 'US'}]","[{'english_name': 'English', 'iso_639_1': 'en', 'name': 'English'}, {'english_name': 'French', 'iso_639_1': 'fr', 'name': 'Français'}]",Released,Murder was just the beginning.,Belgian sleuth Hercule Poirot's Egyptian vacation aboard a glamorous river steamer turns into a terrifying search for a murderer when a picture-perfect couple's idyllic honeymoon is tragically cut short.,tt7657566,"[{'iso_3166_1': 'US', 'name': 'United States of America'}]",en
776503,2021-08-13,CODA,CODA,10000000,1905058,112,39.854,7.936,2248,False,,"[{'id': 18, 'name': 'Drama'}, {'id': 10402, 'name': 'Music'}, {'id': 10749, 'name': 'Romance'}]","[{'id': 7460, 'logo_path': '/yAAbQ6vIYIL84geYYIAraxQGL10.png', 'name': 'Vendôme Pictures', 'origin_country': 'US'}, {'id': 7981, 'logo_path': '/6Yv1gIAuGkHS5Vis4UjnqHhCPWV.png', 'name': 'Pathé', 'origin_country': 'FR'}, {'id': 159430, 'logo_path': '/uyWLvnD838IcdrQ5jwOenC9QXLZ.png', 'name': 'Picture Perfect Entertainment', 'origin_country': 'US'}]","[{'english_name': 'English', 'iso_639_1': 'en', 'name': 'English'}, {'english_name': 'Spanish', 'iso_639_1': 'es', 'name': 'Español'}]",Released,Every family has its own language.,"As a CODA (Child of Deaf Adults), Ruby is the only hearing person in her deaf family. When the family's fishing business is threatened, Ruby finds herself torn between pursuing her love of music and her fear of abandoning her parents.",tt10366460,"[{'iso_3166_1': 'FR', 'name': 'France'}, {'iso_3166_1': 'US', 'name': 'United States of America'}]",en
333484,2016-09-14,The Magnificent Seven,The Magnificent Seven,90000000,162400000,132,39.74,6.5,5890,False,,"[{'id': 12, 'name': 'Adventure'}, {'id': 28, 'name': 'Action'}, {'id': 37, 'name': 'Western'}]","[{'id': 21, 'logo_path': '/usUnaYV6hQnlVAXP6r4HwrlLFPG.png', 'name': 'Metro-Goldwyn-Mayer', 'origin_country': 'US'}, {'id': 5, 'logo_path': '/71BqEFAF4V3qjjMPCpLuyJFB9A.png', 'name': 'Columbia Pictures', 'origin_country': 'US'}, {'id': 34034, 'logo_path': None, 'name': 'LStar Capital', 'origin_country': 'US'}, {'id': 79, 'logo_path': '/at4uYdwAAgNRKhZuuFX8ShKSybw.png', 'name': 'Village Roadshow Pictures', 'origin_country': 'US'}, {'id': 79566, 'logo_path': None, 'name': 'Pin High', 'origin_country': 'US'}, {'id': 1423, 'logo_path': '/gzvsPHV9WqcQMrvI8pq5hbuvEZ5.png', 'name': 'Escape Artists', 'origin_country': 'US'}]","[{'english_name': 'English', 'iso_639_1': 'en', 'name': 'English'}, {'english_name': 'Italian', 'iso_639_1': 'it', 'name': 'Italiano'}]",Released,Justice has a number.,"Looking to mine for gold, greedy industrialist Bartholomew Bogue seizes control of the Old West town of Rose Creek. With their lives in jeopardy, Emma Cullen and other desperate residents turn to bounty hunter Sam Chisolm for help. Chisolm recruits an eclectic group of gunslingers to take on Bogue and his ruthless henchmen. With a deadly showdown on the horizon, the seven mercenaries soon find themselves fighting for more than just money once the bullets start to fly.",tt2404435,"[{'iso_3166_1': 'US', 'name': 'United States of America'}]",en
332562,2018-10-03,A Star Is Born,A Star Is Born,36000000,436388866,136,39.518,7.499,11632,False,,"[{'id': 10402, 'name': 'Music'}, {'id': 18, 'name': 'Drama'}, {'id': 10749, 'name': 'Romance'}]","[{'id': 174, 'logo_path': '/zhD3hhtKB5qyv7ZeL4uLpNxgMVU.png', 'name': 'Warner Bros. Pictures', 'origin_country': 'US'}, {'id': 81368, 'logo_path': '/srN5L2dTtbsb48VUHvpNG71pT7q.png', 'name': 'Live Nation Productions', 'origin_country': 'US'}, {'id': 21, 'logo_path': '/usUnaYV6hQnlVAXP6r4HwrlLFPG.png', 'name': 'Metro-Goldwyn-Mayer', 'origin_country': 'US'}, {'id': 16774, 'logo_path': '/uD6Ls0FSJwo13ekpz91s1TRpkGq.png', 'name': 'Peters Entertainment', 'origin_country': 'US'}, {'id': 975, 'logo_path': '/fknQoaiVO632mD4QMdJFmP3Gbda.png', 'name': 'Gerber Pictures', 'origin_country': 'US'}, {'id': 83036, 'logo_path': None, 'name': 'Joint Effort', 'origin_country': 'US'}]","[{'english_name': 'English', 'iso_639_1': 'en', 'name': 'English'}]",Released,,"Seasoned musician Jackson Maine discovers — and falls in love with — struggling artist Ally. She has just about given up on her dream to make it big as a singer — until Jack coaxes her into the spotlight. But even as Ally's career takes off, the personal side of their relationship is breaking down, as Jack fights an ongoing battle with his own internal demons.",tt1517451,"[{'iso_3166_1': 'US', 'name': 'United States of America'}]",en
