id,release_date,original_title,title,budget,revenue,runtime,popularity,vote_average,vote_count,adult,belongs_to_collection,genres,production_companies,spoken_languages,status,tagline,overview,imdb_id,production_countries,original_language
299536,2018-04-25,Avengers: Infinity War,Avengers: Infinity War,300000000,2052415039,149,342.224,8.2,29791,False,"{'id': 86311, 'name': 'The Avengers Collection', 'poster_path': '/yFSIUVTCvgYrpalUktulvk3Gi5Y.jpg', 'backdrop_path': '/zuW6fOiusv4X9nnW3paHGfXcSll.jpg'}","[{'id': 12, 'name': 'Adventure'}, {'id': 28, 'name': 'Action'}, {'id': 878, 'name': 'Science Fiction'}]","[{'id': 420, 'logo_path': '/hUzeosd33nzE5MCNsZxCGEKTXaQ.png', 'name': 'Marvel Studios', 'origin_country': 'US'}]","[{'english_name': 'English', 'iso_639_1': 'en', 'name': 'English'}, {'english_name': 'Xhosa', 'iso_639_1': 'xh', 'name': ''}]",Released,An entire universe. Once and for all.,"As the Avengers and their allies have continued to protect the world from threats too large for any one hero to handle, a new danger has emerged from the cosmic shadows: Thanos. A despot of intergalactic infamy, his goal is to collect all six Infinity Stones, artifacts of unimaginable power, and use them to inflict his twisted will on all of reality. Everything the Avengers have fought for has led up to this moment - the fate of Earth and existence itself has never been more uncertain.",tt4154756,"[{'iso_3166_1': 'US', 'name': 'United States of America'}]",en
580489,2021-09-30,Venom: Let There Be Carnage,Venom: Let There Be Carnage,110000000,506863592,97,341.095,6.8,10268,False,"{'id': 558216, 'name': 'Venom Collection', 'poster_path': '/4bXIKqdZIjR8wKgZaGDaLhLj4yF.jpg', 'backdrop_path': '/vq340s8DxA5Q209FT8PHA6CXYOx.jpg'}","[{'id': 878, 'name': 'Science Fiction'}, {'id': 28, 'name': 'Action'}, {'id': 12, 'name': 'Adventure'}]","[{'id': 5, 'logo_path': '/71BqEFAF4V3qjjMPCpLuyJFB9A.png', 'name': 'Columbia Pictures', 'origin_country': 'US'}, {'id': 84041, 'logo_path': '/nw4kyc29QRpNtFbdsBHkRSFavvt.png', 'name': 'Pascal Pictures', 'origin_country': 'US'}, {'id': 53462, 'logo_path': '/nx8B3Phlcse02w86RW4CJqzCnfL.png', 'name': 'Matt Tolmach Productions', 'origin_country': 'US'}, {'id': 14439, 'logo_path': None, 'name': 'Arad Productions', 'origin_country': 'US'}]","[{'english_name': 'English', 'iso_639_1': 'en', 'name': 'English'}, {'english_name': 'Spanish', 'iso_639_1': 'es', 'name': 'Español'}]",Released,It’s time to meet Carnage.,"After finding a host body in investigative reporter Eddie Brock, the alien symbiote must face a new enemy, Carnage, the alter ego of serial killer Cletus Kasady.",tt7097896,"[{'iso_3166_1': 'US', 'name': 'United States of America'}]",en
569094,2023-05-31,Spider-Man: Across the Spider-Verse,Spider-Man: Across the Spider-Verse,100000000,690897910,140,301.999,8.354,7037,False,"{'id': 573436, 'name': 'Spider-Man: Spider-Verse Collection', 'poster_path': '/eD4bGQNfmqExIAzKdvX5gDHhI2.jpg', 'backdrop_path': '/oC5S5pdfzPiQC4us05uDMT7v5Ng.jpg'}","[{'id': 16, 'name': 'Animation'}, {'id': 28, 'name': 'Action'}, {'id': 12, 'name': 'Adventure'}, {'id': 878, 'name': 'Science Fiction'}]","[{'id': 5, 'logo_path': '/71BqEFAF4V3qjjMPCpLuyJFB9A.png', 'name': 'Columbia Pictures', 'origin_country': 'US'}, {'id': 2251, 'logo_path': '/5ilV5mH3gxTEU7p5wjxptHvXkyr.png', 'name': 'Sony Pictures Animation', 'origin_country': 'US'}, {'id': 77973, 'logo_path': '/9y5lW86HnxKUZOFencYk3TIIRCM.png', 'name': 'Lord Miller', 'origin_country': 'US'}, {'id': 84041, 'logo_path': '/nw4kyc29QRpNtFbdsBHkRSFavvt.png', 'name': 'Pascal Pictures', 'origin_country': 'US'}, {'id': 14439, 'logo_path': None, 'name': 'Arad Productions', 'origin_country': 'US'}, {'id': 7505, 'logo_path': '/837VMM4wOkODc1idNxGT0KQJlej.png', 'name': 'Marvel Entertainment', 'origin_country': 'US'}]","[{'english_name': 'English', 'iso_639_1': 'en', 'name': 'English'}, {'english_name': 'Hindi', 'iso_639_1': 'hi', 'name': 'हिन्दी'}, {'english_name': 'Italian', 'iso_639_1': 'it', 'name': 'Italiano'}, {'english_name': 'Spanish', 'iso_639_1': 'es', 'name': 'Español'}]",Released,It's how you wear the mask that matters.,"After reuniting with Gwen Stacy, Brooklyn’s full-time, friendly neighborhood Spider-Man is catapulted across the Multiverse, where he encounters the Spider Society, a team of Spider-People charged with protecting the Multiverse’s very existence. But when the heroes clash on how to handle a new threat, Miles finds himself pitted against the other Spiders and must set out on his own to save those he loves most.",tt9362722,"[{'iso_3166_1': 'US', 'name': 'United States of America'}]",en
335983,2018-09-28,Venom,Venom,116000000,856085151,112,301.84,6.834,16069,False,"{'id': 558216, 'name': 'Venom Collection', 'poster_path': '/4bXIKqdZIjR8wKgZaGDaLhLj4yF.jpg', 'backdrop_path': '/vq340s8DxA5Q209FT8PHA6CXYOx.jpg'}","[{'id': 878, 'name': 'Science Fiction'}, {'id': 28, 'name': 'Action'}]","[{'id': 53462, 'logo_path': '/nx8B3Phlcse02w86RW4CJqzCnfL.png', 'name': 'Matt Tolmach Productions', 'origin_country': 'US'}, {'id': 84041, 'logo_path': '/nw4kyc29QRpNtFbdsBHkRSFavvt.png', 'name': 'Pascal Pictures', 'origin_country': 'US'}, {'id': 7505, 'logo_path': '/837VMM4wOkODc1idNxGT0KQJlej.png', 'name': 'Marvel Entertainment', 'origin_country': 'US'}, {'id': 81620, 'logo_path': '/7LkIVuWBVScdujpKhBPx1TMnPQE.png', 'name': 'Tencent Pictures', 'origin_country': 'CN'}, {'id': 14439, 'logo_path': None, 'name': 'Arad Productions', 'origin_country': 'US'}, {'id': 5, 'logo_path': '/71BqEFAF4V3qjjMPCpLuyJFB9A.png', 'name': 'Columbia Pictures', 'origin_country': 'US'}]","[{'english_name': 'Mandarin', 'iso_639_1': 'zh', 'name': '普通话'}, {'english_name': 'English', 'iso_639_1': 'en', 'name': 'English'}, {'english_name': 'Malay', 'iso_639_1': 'ms', 'name': 'Bahasa melayu'}]",Released,The world has enough Superheroes.,"Investigative journalist Eddie Brock attempts a comeback following a scandal, but accidentally becomes the host of Venom, a violent, super powerful alien symbiote. Soon, he must rely on his newfound powers to protect the world from a shadowy organization looking for a symbiote of their own.",tt1270797,"[{'iso_3166_1': 'CN', 'name': 'China'}, {'iso_3166_1': 'US', 'name': 'United States of America'}]",en
566525,2021-09-01,Shang-Chi and the Legend of the Ten Rings,Shang-Chi and the Legend of the Ten Rings,150000000,432243292,132,202.537,7.544,9414,False,"{'id': 912503, 'name': 'Shang-Chi Collection', 'poster_path': '/x9y9KmPa2RXavK39cwJx4w3AJ2y.jpg', 'backdrop_path': '/4PHnWsIk71qFCzFElLCbx706p1m.jpg'}","[{'id': 28, 'name': 'Action'}, {'id': 12, 'name': 'Adventure'}, {'id': 14, 'name': 'Fantasy'}]","[{'id': 420, 'logo_path': '/hUzeosd33nzE5MCNsZxCGEKTXaQ.png', 'name': 'Marvel Studios', 'origin_country': 'US'}]","[{'english_name': 'English', 'iso_639_1': 'en', 'name': 'English'}, {'english_name': 'Mandarin', 'iso_639_1': 'zh', 'name': '普通话'}]",Released,You can't outrun your destiny.,Shang-Chi must confront the past he thought he left behind when he is drawn into the web of the mysterious Ten Rings organization.,tt9376612,"[{'iso_3166_1': 'US', 'name': 'United States of America'}]",en
475557,2019-10-01,Joker,Joker,55000000,1078958629,122,201.229,8.145,25782,False,"{'id': 987044, 'name': 'Joker Collection', 'poster_path': '/cI4Ng3oX0CEJiY3wMxcfszQZbcI.jpg', 'backdrop_path': '/k1YC7mFLvxX4bbD7P8lkcML0Jek.jpg'}","[{'id': 80, 'name': 'Crime'}, {'id': 53, 'name': 'Thriller'}, {'id': 18, 'name': 'Drama'}]","[{'id': 174, 'logo_path': '/zhD3hhtKB5qyv7ZeL4uLpNxgMVU.png', 'name': 'Warner Bros. Pictures', 'origin_country': 'US'}, {'id': 83036, 'logo_path': None, 'name': 'Joint Effort', 'origin_country': 'US'}, {'id': 79, 'logo_path': '/at4uYdwAAgNRKhZuuFX8ShKSybw.png', 'name': 'Village Roadshow Pictures', 'origin_country': 'US'}, {'id': 13240, 'logo_path': '/aTc07YaNHo8WNgkQSnvLmG6w4nW.png', 'name': 'Bron Studios', 'origin_country': 'CA'}, {'id': 128064, 'logo_path': '/13F3Jf7EFAcREU0xzZqJnVnyGXu.png', 'name': 'DC Films', 'origin_country': 'US'}]","[{'english_name': 'English', 'iso_639_1': 'en', 'name': 'English'}]",Released,Put on a happy face.,"During the 1980s, a failed stand-up comedian is driven insane and turns to a life of crime and chaos in Gotham City while becoming an infamous psychopathic crime figure.",tt7286456,"[{'iso_3166_1': 'CA', 'name': 'Canada'}, {'iso_3166_1': 'US', 'name': 'United States of America'}]",en
293660,2016-02-09,Deadpool,Deadpool,58000000,782837347,108,190.413,7.624,31057,False,"{'id': 448150, 'name': 'Deadpool Collection', 'poster_path': '/4y20YJ1F3z7Biptt2XBX1RXOSUr.jpg', 'backdrop_path': '/hBQOWY8qWXJVFAc8yLTh1teIu43.jpg'}","[{'id': 28, 'name': 'Action'}, {'id': 12, 'name': 'Adventure'}, {'id': 35, 'name': 'Comedy'}]","[{'id': 25, 'logo_path': '/qZCc1lty5FzX30aOCVRBLzaVmcp.png', 'name': '20th Century Fox', 'origin_country': 'US'}, {'id': 431, 'logo_path': '/6dcR1MbRqYgt3jUVYxkHe68GFnZ.png', 'name': ""The Donners' Company"", 'origin_country': 'US'}, {'id': 28788, 'logo_path': '/Aqomtf9oh5dKtxBNEagkdlp3aGv.png', 'name': 'Genre Films', 'origin_country': 'US'}, {'id': 7505, 'logo_path': '/837VMM4wOkODc1idNxGT0KQJlej.png', 'name': 'Marvel Entertainment', 'origin_country': 'US'}]","[{'english_name': 'English', 'iso_639_1': 'en', 'name': 'English'}]",Released,Feel the love.,"The origin story of former Special Forces operative turned mercenary Wade Wilson, who, after being subjected to a rogue experiment that leaves him with accelerated healing powers, adopts the alter ego Deadpool. Armed with his new abilities and a dark, twisted sense of humor, Deadpool hunts down the man who nearly destroyed his life.",tt1431045,"[{'iso_3166_1': 'US', 'name': 'United States of America'}]",en
791373,2021-03-18,Zack Snyder's Justice League,Zack Snyder's Justice League,70000000,0,242,182.638,8.138,9985,False,,"[{'id': 28, 'name': 'Action'}, {'id': 12, 'name': 'Adventure'}, {'id': 14, 'name': 'Fantasy'}]","[{'id': 174, 'logo_path': '/zhD3hhtKB5qyv7ZeL4uLpNxgMVU.png', 'name': 'Warner Bros. Pictures', 'origin_country': 'US'}, {'id': 114152, 'logo_path': '/xYfrnGFXxrEy5x5OVThunxHYScK.png', 'name': 'The Stone Quarry', 'origin_country': 'US'}, {'id': 507, 'logo_path': '/aRmHe6GWxYMRCQljF75rn2B9Gv8.png', 'name': 'Atlas Entertainment', 'origin_country': 'US'}, {'id': 103376, 'logo_path': '/zAyfGEx1LJOkwNTrHugnWHzLRE.png', 'name': 'Access Entertainment', 'origin_country': 'US'}, {'id': 444, 'logo_path': None, 'name': 'Dune Entertainment', 'origin_country': 'US'}, {'id': 128064, 'logo_path': '/13F3Jf7EFAcREU0xzZqJnVnyGXu.png', 'name': 'DC Films', 'origin_country': 'US'}]","[{'english_name': 'English', 'iso_639_1': 'en', 'name': 'English'}]",Released,Us united.,"Determined to ensure Superman's ultimate sacrifice was not in vain, Bruce Wayne aligns forces with Diana Prince with plans to recruit a team of metahumans to protect the world from an approaching threat of catastrophic proportions.",tt12361974,"[{'iso_3166_1': 'US', 'name': 'United States of America'}]",en
557,2002-05-01,Spider-Man,Spider-Man,139000000,821708551,121,177.262,7.302,19077,False,"{'id': 556, 'name': 'Spider-Man Collection', 'poster_path': '/bp5PqLa06QA1LsELA1SsKZ008H7.jpg', 'backdrop_path': '/waZqriYTuBE3WqXI3SDGi3kfDQE.jpg'}","[{'id': 28, 'name': 'Action'}, {'id': 878, 'name': 'Science Fiction'}]","[{'id': 19551, 'logo_path': '/2WpWp9b108hizjHKdA107hFmvQ5.png', 'name': 'Marvel Enterprises', 'origin_country': 'US'}, {'id': 326, 'logo_path': None, 'name': 'Laura Ziskin Productions', 'origin_country': 'US'}, {'id': 5, 'logo_path': '/71BqEFAF4V3qjjMPCpLuyJFB9A.png', 'name': 'Columbia Pictures', 'origin_country': 'US'}]","[{'english_name': 'English', 'iso_639_1': 'en', 'name': 'English'}]",Released,Go for the ultimate spin.,"After being bitten by a genetically altered spider at Oscorp, nerdy but endearing high school student Peter Parker is endowed with amazing powers to become the superhero known as Spider-Man.",tt0145487,"[{'iso_3166_1': 'US', 'name': 'United States of America'}]",en
824003,2023-11-30,Diabolik chi sei?,Diabolik - Who Are You?,0,0,124,168.197,6.4,113,False,"{'id': 824004, 'name': 'Diabolik Collection', 'poster_path': '/npxIpLIlbGQ2ukKHtUzUyx22AJA.jpg', 'backdrop_path': '/kju1yy7rPlyyH2GEsJhYjizGtnd.jpg'}","[{'id': 80, 'name': 'Crime'}, {'id': 28, 'name': 'Action'}]","[{'id': 94370, 'logo_path': None, 'name': 'Mompracem', 'origin_country': 'IT'}, {'id': 123289, 'logo_path': None, 'name': 'Astorina S.A.C.', 'origin_country': ''}, {'id': 155990, 'logo_path': '/py9VaywwK6KVi94YwrxSKVg1gkh.png', 'name': 'RAI Cinema', 'origin_country': 'IT'}]","[{'english_name': 'Italian', 'iso_639_1': 'it', 'name': 'Italiano'}]",Released,,"Captured by a ruthless gang of bank robbers, foes Diabolik and Ginko find themselves facing certain death. While Eva Kant and Altea forge an unlikely alliance to rescue their lovers, Diabolik reveals his mysterious past to the Inspector.",tt15307234,"[{'iso_3166_1': 'IT', 'name': 'Italy'}]",it
383498,2018-05-10,Deadpool 2,Deadpool 2,110000000,785896632,120,143.977,7.492,17957,False,"{'id': 448150, 'name': 'Deadpool Collection', 'poster_path': '/4y20YJ1F3z7Biptt2XBX1RXOSUr.jpg', 'backdrop_path': '/hBQOWY8qWXJVFAc8yLTh1teIu43.jpg'}","[{'id': 28, 'name': 'Action'}, {'id': 35, 'name': 'Comedy'}, {'id': 12, 'name': 'Adventure'}]","[{'id': 104228, 'logo_path': '/hx0C1XcSxGgat8N62GpxoJGTkCk.png', 'name': 'Maximum Effort', 'origin_country': 'US'}, {'id': 28788, 'logo_path': '/Aqomtf9oh5dKtxBNEagkdlp3aGv.png', 'name': 'Genre Films', 'origin_country': 'US'}, {'id': 25, 'logo_path': '/qZCc1lty5FzX30aOCVRBLzaVmcp.png', 'name': '20th Century Fox', 'origin_country': 'US'}, {'id': 7505, 'logo_path': '/837VMM4wOkODc1idNxGT0KQJlej.png', 'name': 'Marvel Entertainment', 'origin_country': 'US'}]","[{'english_name': 'Cantonese', 'iso_639_1': 'cn', 'name': '广州话 / 廣州話'}, {'english_name': 'English', 'iso_639_1': 'en', 'name': 'English'}, {'english_name': 'Russian', 'iso_639_1': 'ru', 'name': 'Pусский'}, {'english_name': 'Spanish', 'iso_639_1': 'es', 'name': 'Español'}]",Released,Prepare for the Second Coming.,Wisecracking mercenary Deadpool battles the evil and powerful Cable and other bad guys to save a boy's life.,tt5463162,"[{'iso_3166_1': 'US', 'name': 'United States of America'}]",en
561,2005-02-08,Constantine,Constantine,100000000,230900000,121,142.468,7.094,7170,False,"{'id': 1025281, 'name': 'Constantine Collection', 'poster_path': '/wfV9uKdkbEguX5XfNZ80G6jeb4z.jpg', 'backdrop_path': '/44TlYuWbWBpRY3i0Ch7MJtLv4Yd.jpg'}","[{'id': 14, 'name': 'Fantasy'}, {'id': 28, 'name': 'Action'}, {'id': 27, 'name': 'Horror'}]","[{'id': 79, 'logo_path': '/at4uYdwAAgNRKhZuuFX8ShKSybw.png', 'name': 'Village Roadshow Pictures', 'origin_country': 'US'}, {'id': 430, 'logo_path': None, 'name': 'Lonely Film Productions GmbH & Co. KG.', 'origin_country': 'DE'}, {'id': 431, 'logo_path': '/6dcR1MbRqYgt3jUVYxkHe68GFnZ.png', 'name': ""The Donners' Company"", 'origin_country': 'US'}, {'id': 432, 'logo_path': None, 'name': 'Batfilm Productions', 'origin_country': 'US'}, {'id': 433, 'logo_path': '/iafkKMpcRfEXq9a4sQf0h6tg2E2.png', 'name': 'Weed Road Pictures', 'origin_country': 'US'}, {'id': 174, 'logo_path': '/zhD3hhtKB5qyv7ZeL4uLpNxgMVU.png', 'name': 'Warner Bros. Pictures', 'origin_country': 'US'}, {'id': 787, 'logo_path': '/cCefBs1t7jxtiz3eCxBp9yxrxGx.png', 'name': '3 Arts Entertainment', 'origin_country': 'US'}, {'id': 165407, 'logo_path': '/5fnvtywvYSkskSJr99VcR3x9RTE.png', 'name': 'DC Vertigo', 'origin_country': 'US'}]","[{'english_name': 'Spanish', 'iso_639_1': 'es', 'name': 'Español'}, {'english_name': 'English', 'iso_639_1': 'en', 'name': 'English'}, {'english_name': 'Latin', 'iso_639_1': 'la', 'name': 'Latin'}, {'english_name': 'Tagalog', 'iso_639_1': 'tl', 'name': ''}]",Released,Hell wants him. Heaven won't take him. Earth needs him.,"John Constantine has literally been to Hell and back. When he teams up with a policewoman to solve the mysterious suicide of her twin sister, their investigation takes them through the world of demons and angels that exists beneath the landscape of contemporary Los Angeles.",tt0360486,"[{'iso_3166_1': 'DE', 'name': 'Germany'}, {'iso_3166_1': 'US', 'name': 'United States of America'}]",en
155,2008-07-16,The Dark Knight,The Dark Knight,185000000,1004558444,152,142.229,8.5,32971,False,"{'id': 263, 'name': 'The Dark Knight Collection', 'poster_path': '/ogyw5LTmL53dVxsppcy8Dlm30Fu.jpg', 'backdrop_path': '/xfKot7lqaiW4XpL5TtDlVBA9ei9.jpg'}","[{'id': 18, 'name': 'Drama'}, {'id': 28, 'name': 'Action'}, {'id': 80, 'name': 'Crime'}, {'id': 53, 'name': 'Thriller'}]","[{'id': 429, 'logo_path': '/2Tc1P3Ac8M479naPp1kYT3izLS5.png', 'name': 'DC', 'origin_country': 'US'}, {'id': 923, 'logo_path': '/8M99Dkt23MjQMTTWukq4m5XsEuo.png', 'name': 'Legendary Pictures', 'origin_country': 'US'}, {'id': 9996, 'logo_path': '/3tvBqYsBhxWeHlu62SIJ1el93O7.png', 'name': 'Syncopy', 'origin_country': 'GB'}, {'id': 118865, 'logo_path': None, 'name': 'Isobel Griffiths', 'origin_country': 'GB'}, {'id': 174, 'logo_path': '/zhD3hhtKB5qyv7ZeL4uLpNxgMVU.png', 'name': 'Warner Bros. Pictures', 'origin_country': 'US'}]","[{'english_name': 'English', 'iso_639_1': 'en', 'name': 'English'}, {'english_name': 'Mandarin', 'iso_639_1': 'zh', 'name': '普通话'}]",Released,Welcome to a world without rules.,"Batman raises the stakes in his war on crime. With the help of Lt. Jim Gordon and District Attorney Harvey Dent, Batman sets out to dismantle the remaining criminal organizations that plague the streets. The partnership proves to be effective, but they soon find themselves prey to a reign of chaos unleashed by a rising criminal mastermind known to the terrified citizens of Gotham as the Joker.",tt0468569,"[{'iso_3166_1': 'GB', 'name': 'United Kingdom'}, {'iso_3166_1': 'US', 'name': 'United States of America'}]",en
516632,2020-10-22,The Empty Man,The Empty Man,16000000,4796993,137,140.078,6.146,828,False,,"[{'id': 27, 'name': 'Horror'}, {'id': 9648, 'name': 'Mystery'}, {'id': 53, 'name': 'Thriller'}]","[{'id': 122178, 'logo_path': '/fDbVQowlf20UGZUTFIxNRMVkB8W.png', 'name': 'BOOM! Studios', 'origin_country': 'US'}, {'id': 6834, 'logo_path': None, 'name': 'Out of Africa Entertainment', 'origin_country': 'ZA'}, {'id': 25, 'logo_path': '/qZCc1lty5FzX30aOCVRBLzaVmcp.png', 'name': '20th Century Fox', 'origin_country': 'US'}]","[{'english_name': 'English', 'iso_639_1': 'en', 'name': 'English'}]",Released,The first night you hear him. The second night you see him. The third night he finds you.,"Retired cop James Lasombra is asked by a friend to investigate the disappearance of her daughter, who seemingly packed in the night and left an ominous message on the bathroom mirror - ""The Empty Man Made Me Do It."" As he investigates this mysterious figure further, James begins to see and hear strange things, and is forced to come to terms with his past and what it means for his future.",tt5867314,"[{'iso_3166_1': 'ZA', 'name': 'South Africa'}, {'iso_3166_1': 'US', 'name': 'United States of America'}]",en
284054,2018-02-13,Black Panther,Black Panther,200000000,1349926083,135,138.884,7.382,22164,False,"{'id': 529892, 'name': 'Black Panther Collection', 'poster_path': '/VtMkk2s92SnDUt8eYyUyYaSJQK.jpg', 'backdrop_path': '/nsiBzWsmmerBMuD8TKHpYBTnfhD.jpg'}","[{'id': 28, 'name': 'Action'}, {'id': 12, 'name': 'Adventure'}, {'id': 878, 'name': 'Science Fiction'}]","[{'id': 420, 'logo_path': '/hUzeosd33nzE5MCNsZxCGEKTXaQ.png', 'name': 'Marvel Studios', 'origin_country': 'US'}]","[{'english_name': 'English', 'iso_639_1': 'en', 'name': 'English'}, {'english_name': 'Korean', 'iso_639_1': 'ko', 'name': '한국어/조선말'}, {'english_name': 'Swahili', 'iso_639_1': 'sw', 'name': 'Kiswahili'}, {'english_name': 'Xhosa', 'iso_639_1': 'xh', 'name': ''}]",Released,Long live the king.,"King T'Challa returns home to the reclusive, technologically advanced African nation of Wakanda to serve as his country's new leader. However, T'Challa soon finds that he is challenged for the throne by factions within his own country as well as without. Using powers reserved to Wakandan kings, T'Challa assumes the Black Panther mantle to join with ex-girlfriend Nakia, the queen-mother, his princess-kid sister, members of the Dora Milaje (the Wakandan 'special forces') and an American secret agent, to prevent Wakanda from being dragged into a world war.",tt1825683,"[{'iso_3166_1': 'US', 'name': 'United States of America'}]",en
559,2007-05-01,Spider-Man 3,Spider-Man 3,258000000,894983373,139,137.371,6.433,14093,False,"{'id': 556, 'name': 'Spider-Man Collection', 'poster_path': '/bp5PqLa06QA1LsELA1SsKZ008H7.jpg', 'backdrop_path': '/waZqriYTuBE3WqXI3SDGi3kfDQE.jpg'}","[{'id': 28, 'name': 'Action'}, {'id': 12, 'name': 'Adventure'}, {'id': 878, 'name': 'Science Fiction'}]","[{'id': 326, 'logo_path': None, 'name': 'Laura Ziskin Productions', 'origin_country': 'US'}, {'id': 420, 'logo_path': '/hUzeosd33nzE5MCNsZxCGEKTXaQ.png', 'name': 'Marvel Studios', 'origin_country': 'US'}, {'id': 5, 'logo_path': '/71BqEFAF4V3qjjMPCpLuyJFB9A.png', 'name': 'Columbia Pictures', 'origin_country': 'US'}]","[{'english_name': 'English', 'iso_639_1': 'en', 'name': 'English'}, {'english_name': 'French', 'iso_639_1': 'fr', 'name': 'Français'}]",Released,The greatest battle lies within.,"The seemingly invincible Spider-Man goes up against an all-new crop of villains—including the shape-shifting Sandman. While Spider-Man’s superpowers are altered by an alien organism, his alter ego, Peter Parker, deals with nemesis Eddie Brock and also gets caught up in a love triangle.",tt0413300,"[{'iso_3166_1': 'US', 'name': 'United States of America'}]",en
177572,2014-10-24,Big Hero 6,Big Hero 6,165000000,657870525,102,130.121,7.732,15603,False,,"[{'id': 12, 'name': 'Adventure'}, {'id': 10751, 'name': 'Family'}, {'id': 16, 'name': 'Animation'}, {'id': 28, 'name': 'Action'}, {'id': 35, 'name': 'Comedy'}]","[{'id': 2, 'logo_path': '/wdrCwmRnLFJhEoH8GSfymY85KHT.png', 'name': 'Walt Disney Pictures', 'origin_country': 'US'}, {'id': 6125, 'logo_path': '/tzsMJBJZINu7GHzrpYzpReWhh66.png', 'name': 'Walt Disney Animation Studios', 'origin_country': 'US'}]","[{'english_name': 'English', 'iso_639_1': 'en', 'name': 'English'}]",Released,Drop everything. Save the world.,"A special bond develops between plus-sized inflatable robot Baymax, and prodigy Hiro Hamada, who team up with a group of friends to form a band of high-tech heroes.",tt2245084,"[{'iso_3166_1': 'US', 'name': 'United States of America'}]",en
414906,2022-03-01,The Batman,The Batman,185000000,771000000,177,127.081,7.7,10358,False,"{'id': 948485, 'name': 'The Batman Collection', 'poster_path': '/rTCJB5axQ8XOmGbpJBsiHkhKq14.jpg', 'backdrop_path': '/6IX81STHKPsSFVCN57sJ3ljwXI5.jpg'}","[{'id': 80, 'name': 'Crime'}, {'id': 9648, 'name': 'Mystery'}, {'id': 53, 'name': 'Thriller'}]","[{'id': 101405, 'logo_path': '/iusVPF9AJD1DiHEWbZEXgn1hpOf.png', 'name': '6th & Idaho Motion Picture Company', 'origin_country': 'US'}, {'id': 119245, 'logo_path': '/6F45uVsKpNYANcWvplyhgIFezFU.png', 'name': 'Dylan Clark Productions', 'origin_country': 'US'}, {'id': 128064, 'logo_path': '/13F3Jf7EFAcREU0xzZqJnVnyGXu.png', 'name': 'DC Films', 'origin_country': 'US'}, {'id': 174, 'logo_path': '/zhD3hhtKB5qyv7ZeL4uLpNxgMVU.png', 'name': 'Warner Bros. Pictures', 'origin_country': 'US'}]","[{'english_name': 'English', 'iso_639_1': 'en', 'name': 'English'}]",Released,Unmask the truth.,"In his second year of fighting crime, Batman uncovers corruption in Gotham City that connects to his own family while facing a serial killer known as the Riddler.",tt1877830,"[{'iso_3166_1': 'US', 'name': 'United States of America'}]",en
640146,2023-02-15,Ant-Man and the Wasp: Quantumania,Ant-Man and the Wasp: Quantumania,388369742,476071180,125,126.874,6.3,5000,False,"{'id': 422834, 'name': 'Ant-Man Collection', 'poster_path': '/9llE4J9sVv8qsvfVGkpugiPTxUV.jpg', 'backdrop_path': '/2KjtWUBiksmN8LsUouaZnxocu5N.jpg'}","[{'id': 28, 'name': 'Action'}, {'id': 12, 'name': 'Adventure'}, {'id': 878, 'name': 'Science Fiction'}]","[{'id': 420, 'logo_path': '/hUzeosd33nzE5MCNsZxCGEKTXaQ.png', 'name': 'Marvel Studios', 'origin_country': 'US'}, {'id': 176762, 'logo_path': None, 'name': 'Kevin Feige Productions', 'origin_country': 'US'}]","[{'english_name': 'English', 'iso_639_1': 'en', 'name': 'English'}]",Released,Witness the beginning of a new dynasty.,"Super-Hero partners Scott Lang and Hope van Dyne, along with with Hope's parents Janet van Dyne and Hank Pym, and Scott's daughter Cassie Lang, find themselves exploring the Quantum Realm, interacting with strange new creatures and embarking on an adventure that will push them beyond the limits of what they thought possible.",tt10954600,"[{'iso_3166_1': 'US', 'name': 'United States of America'}]",en
299534,2019-04-24,Avengers: Endgame,Avengers: Endgame,356000000,2799439100,181,124.211,8.2,25662,False,"{'id': 86311, 'name': 'The Avengers Collection', 'poster_path': '/yFSIUVTCvgYrpalUktulvk3Gi5Y.jpg', 'backdrop_path': '/zuW6fOiusv4X9nnW3paHGfXcSll.jpg'}","[{'id': 12, 'name': 'Adventure'}, {'id': 878, 'name': 'Science Fiction'}, {'id': 28, 'name': 'Action'}]","[{'id': 420, 'logo_path': '/hUzeosd33nzE5MCNsZxCGEKTXaQ.png', 'name': 'Marvel Studios', 'origin_country': 'US'}]","[{'english_name': 'English', 'iso_639_1': 'en', 'name': 'English'}, {'english_name': 'Japanese', 'iso_639_1': 'ja', 'name': '日本語'}, {'english_name': 'Xhosa', 'iso_639_1': 'xh', 'name': ''}]",Released,Avenge the fallen.,"After the devastating events of Avengers: Infinity War, the universe is in ruins due to the efforts of the Mad Titan, Thanos. With the help of remaining allies, the Avengers must assemble once more in order to undo Thanos' actions and restore order to the universe once and for all, no matter what consequences may be in store.",tt4154796,"[{'iso_3166_1': 'US', 'name': 'United States of America'}]",en
