id,release_date,original_title,title,budget,revenue,runtime,popularity,vote_average,vote_count,adult,belongs_to_collection,genres,production_companies,spoken_languages,status,tagline,overview,imdb_id,production_countries,original_language
618353,2020-10-13,Batman: Death in the Family,Batman: Death in the Family,0,0,31,16.22,7.1,417,False,,"[{'id': 16, 'name': 'Animation'}, {'id': 28, 'name': 'Action'}]","[{'id': 2785, 'logo_path': '/l5zW8jjmQOCx2dFmvnmbYmqoBmL.png', 'name': 'Warner Bros. Animation', 'origin_country': 'US'}, {'id': 9993, 'logo_path': '/2Tc1P3Ac8M479naPp1kYT3izLS5.png', 'name': 'DC Entertainment', 'origin_country': 'US'}]","[{'english_name': 'English', 'iso_639_1': 'en', 'name': 'English'}]",Released,The fate of Gotham is in your hands.,Tragedy strikes the Batman's life again when Robin Jason Todd tracks down his birth mother only to run afoul of the Joker. An adaptation of the 1988 comic book storyline of the same name.,tt12794046,"[{'iso_3166_1': 'US', 'name': 'United States of America'}]",en
16281,1982-11-10,Creepshow,Creepshow,8000000,21028755,120,16.011,6.9,1030,False,"{'id': 107725, 'name': 'Creepshow Collection', 'poster_path': '/lIl5hc79GshNu4Z9F1a64enUQbq.jpg', 'backdrop_path': '/5dNsa8nte62HindzotT6P8X6Wj5.jpg'}","[{'id': 27, 'name': 'Horror'}, {'id': 35, 'name': 'Comedy'}]","[{'id': 2483, 'logo_path': None, 'name': 'Laurel Entertainment', 'origin_country': 'US'}, {'id': 95947, 'logo_path': None, 'name': 'United Film Distribution Company (UFDC)', 'origin_country': 'US'}]","[{'english_name': 'English', 'iso_639_1': 'en', 'name': 'English'}]",Released,The Most Fun You'll Ever Have BEING SCARED!,"Five tales in the style of classic '50s horror comics, involving a murdered man emerging from the grave, a meteor's ooze that makes everything grow, a snack for a crated creature, a scheming husband, and a malevolent millionaire with an insect phobia.",tt0083767,"[{'iso_3166_1': 'US', 'name': 'United States of America'}]",en
14400,2008-12-17,Largo Winch,The Heir Apparent: Largo Winch,25400000,17100000,108,15.985,6.084,526,False,"{'id': 70764, 'name': 'Largo Winch Collection', 'poster_path': '/bpUPREscFpjllSnPR28UW6FdFEq.jpg', 'backdrop_path': '/9RbOJOG3qb9naM5sZDsRaUdNw5x.jpg'}","[{'id': 12, 'name': 'Adventure'}, {'id': 18, 'name': 'Drama'}, {'id': 28, 'name': 'Action'}, {'id': 53, 'name': 'Thriller'}]","[{'id': 6750, 'logo_path': None, 'name': 'Pan-Européenne', 'origin_country': 'FR'}, {'id': 856, 'logo_path': '/3tfzS2CrX6Ntbu927XzHXEPDA6y.png', 'name': 'Wild Bunch', 'origin_country': 'FR'}, {'id': 356, 'logo_path': '/9tW5wZEGotn1Ei5pErA88m47XiD.png', 'name': 'TF1 Films Production', 'origin_country': 'FR'}, {'id': 139617, 'logo_path': None, 'name': 'Araneo', 'origin_country': 'BE'}, {'id': 104, 'logo_path': '/9aotxauvc9685tq9pTcRJszuT06.png', 'name': 'Canal+', 'origin_country': 'FR'}, {'id': 14362, 'logo_path': None, 'name': 'October Pictures', 'origin_country': 'HK'}]","[{'english_name': 'French', 'iso_639_1': 'fr', 'name': 'Français'}, {'english_name': 'English', 'iso_639_1': 'en', 'name': 'English'}, {'english_name': 'Serbian', 'iso_639_1': 'sr', 'name': 'Srpski'}, {'english_name': 'Portuguese', 'iso_639_1': 'pt', 'name': 'Português'}]",Released,,"After a powerful billionaire is murdered, his secret adoptive son must race to prove his legitimacy, find his father's killers and stop them from taking over his financial empire.",tt0808339,"[{'iso_3166_1': 'BE', 'name': 'Belgium'}, {'iso_3166_1': 'FR', 'name': 'France'}, {'iso_3166_1': 'HK', 'name': 'Hong Kong'}]",fr
487670,2018-07-24,The Death of Superman,The Death of Superman,0,0,81,15.942,7.408,746,False,"{'id': 593251, 'name': 'The Death of Superman Collection', 'poster_path': '/h6Yb1dBcgxxM5GtfikO5MewWnJI.jpg', 'backdrop_path': '/viomxKA5tejwzJJOMOBjFMgwgCR.jpg'}","[{'id': 878, 'name': 'Science Fiction'}, {'id': 16, 'name': 'Animation'}, {'id': 28, 'name': 'Action'}, {'id': 18, 'name': 'Drama'}]","[{'id': 9993, 'logo_path': '/2Tc1P3Ac8M479naPp1kYT3izLS5.png', 'name': 'DC Entertainment', 'origin_country': 'US'}, {'id': 2785, 'logo_path': '/l5zW8jjmQOCx2dFmvnmbYmqoBmL.png', 'name': 'Warner Bros. Animation', 'origin_country': 'US'}]","[{'english_name': 'English', 'iso_639_1': 'en', 'name': 'English'}]",Released,Witness the day Metropolis stood still,"When a hulking monster arrives on Earth and begins a mindless rampage, the Justice League is quickly called in to stop it. But it soon becomes apparent that only Superman can stand against the monstrosity.",tt7167658,"[{'iso_3166_1': 'US', 'name': 'United States of America'}]",en
9385,1976-06-26,Les 12 travaux d'Astérix,The Twelve Tasks of Asterix,0,0,82,15.911,7.317,1227,False,"{'id': 94039, 'name': 'Asterix and Obelix (Animation) Collection', 'poster_path': '/mJ85mdtrQl2LWTNAHHcSJC55dcs.jpg', 'backdrop_path': '/7DpiEK17hH1foWyj4U0kv9ylRqG.jpg'}","[{'id': 10751, 'name': 'Family'}, {'id': 16, 'name': 'Animation'}, {'id': 35, 'name': 'Comedy'}, {'id': 12, 'name': 'Adventure'}]","[{'id': 7964, 'logo_path': '/facxCmKiPTdHnKmxQhl71KtOO1d.png', 'name': 'Studios Idéfix', 'origin_country': 'FR'}, {'id': 5851, 'logo_path': None, 'name': 'Dargaud Films', 'origin_country': 'FR'}, {'id': 7963, 'logo_path': None, 'name': 'Les Productions René Goscinny', 'origin_country': ''}]","[{'english_name': 'French', 'iso_639_1': 'fr', 'name': 'Français'}]",Released,,"Asterix and Obelix depart on an adventure to complete twelve impossible tasks to prove to Caesar that they are as strong as the Gods. You'll roar with laughter as they outwit, outrun, and generally outrage the very people who are trying to prove them ""only human"".",tt0072901,"[{'iso_3166_1': 'FR', 'name': 'France'}]",fr
529106,2021-04-01,Майор Гром: Чумной Доктор,Major Grom: Plague Doctor,10000000,4500000,136,15.903,6.699,585,False,"{'id': 579873, 'name': 'Major Grom Collection', 'poster_path': '/pOPjrrgyOxRpuz8GM0iXp5PwpUN.jpg', 'backdrop_path': '/wAS75CgE26EvSER1t9hGUUIYyqj.jpg'}","[{'id': 28, 'name': 'Action'}, {'id': 12, 'name': 'Adventure'}]","[{'id': 86050, 'logo_path': None, 'name': 'Bubble Studios', 'origin_country': 'RU'}, {'id': 119413, 'logo_path': None, 'name': 'Plus Studio', 'origin_country': 'RU'}]","[{'english_name': 'Russian', 'iso_639_1': 'ru', 'name': 'Pусский'}]",Released,,"In present day St. Petersburg, police major Igor Grom, an honest and skilled cop with unconventional methods, pursues a vigilante murderer in the mask of a plague doctor.",tt7601480,"[{'iso_3166_1': 'RU', 'name': 'Russia'}]",ru
30675,2010-02-02,Planet Hulk,Planet Hulk,0,7000000,81,15.877,7.009,480,False,,"[{'id': 878, 'name': 'Science Fiction'}, {'id': 16, 'name': 'Animation'}, {'id': 28, 'name': 'Action'}, {'id': 14, 'name': 'Fantasy'}]","[{'id': 13252, 'logo_path': '/1gKwYyTDNhumwBKUlKqoxXRUdpC.png', 'name': 'Marvel Animation', 'origin_country': 'US'}, {'id': 1632, 'logo_path': '/cisLn1YAUuptXVBa0xjq7ST9cH0.png', 'name': 'Lionsgate', 'origin_country': 'US'}, {'id': 213003, 'logo_path': None, 'name': 'MLG Productions 8', 'origin_country': 'US'}]","[{'english_name': 'English', 'iso_639_1': 'en', 'name': 'English'}]",Released,Will he save their world... or destroy it?,"When the Hulk's presence on Earth becomes too great a risk, the Illuminati trick him to board a shuttle destined for a planet where he will be able to live in peace, and launch it into space. The Hulk's struggle to escape causes the shuttle to malfunction and crash land on the planet Sakaar, however, where he is sold into slavery and trained as a gladiator.",tt1483025,"[{'iso_3166_1': 'US', 'name': 'United States of America'}]",en
13647,2007-01-23,The Invincible Iron Man,The Invincible Iron Man,0,0,83,15.849,6.2,238,False,,"[{'id': 12, 'name': 'Adventure'}, {'id': 16, 'name': 'Animation'}, {'id': 28, 'name': 'Action'}, {'id': 14, 'name': 'Fantasy'}, {'id': 878, 'name': 'Science Fiction'}]","[{'id': 212999, 'logo_path': None, 'name': 'MLG Productions 3', 'origin_country': 'US'}, {'id': 420, 'logo_path': '/hUzeosd33nzE5MCNsZxCGEKTXaQ.png', 'name': 'Marvel Studios', 'origin_country': 'US'}, {'id': 1632, 'logo_path': '/cisLn1YAUuptXVBa0xjq7ST9cH0.png', 'name': 'Lionsgate', 'origin_country': 'US'}, {'id': 7505, 'logo_path': '/837VMM4wOkODc1idNxGT0KQJlej.png', 'name': 'Marvel Entertainment', 'origin_country': 'US'}]","[{'english_name': 'Czech', 'iso_639_1': 'cs', 'name': 'Český'}, {'english_name': 'English', 'iso_639_1': 'en', 'name': 'English'}]",Released,A lone warrior. A suit of armor. Our only hope. IRON MAN.,"When a cocky industrialist's efforts to raise an ancient Chinese temple leads him to be seriously wounded and captured by enemy forces, he must use his ideas for a revolutionary power armor in order to fight back as a superhero.",tt0903135,"[{'iso_3166_1': 'US', 'name': 'United States of America'}]",en
1499,1993-03-17,Teenage Mutant Ninja Turtles III,Teenage Mutant Ninja Turtles III,21000000,42273609,96,15.773,5.451,819,False,"{'id': 1582, 'name': 'Teenage Mutant Ninja Turtles Collection', 'poster_path': '/wkJR8XgIEmZUb7muluAgBC3DRRQ.jpg', 'backdrop_path': '/7dusELv6x1ANRGorNvqbKhKIUPY.jpg'}","[{'id': 28, 'name': 'Action'}, {'id': 12, 'name': 'Adventure'}, {'id': 35, 'name': 'Comedy'}, {'id': 10751, 'name': 'Family'}, {'id': 14, 'name': 'Fantasy'}, {'id': 878, 'name': 'Science Fiction'}]","[{'id': 53677, 'logo_path': None, 'name': 'Clearwater Holdings Limited', 'origin_country': ''}, {'id': 12, 'logo_path': '/2ycs64eqV5rqKYHyQK0GVoKGvfX.png', 'name': 'New Line Cinema', 'origin_country': 'US'}, {'id': 30900, 'logo_path': '/gyO0BxkreNepFOxc882GIdWHblX.png', 'name': 'Mirage Studios', 'origin_country': 'US'}, {'id': 2521, 'logo_path': '/e9lXexogBN1nOXA8axzASggea8B.png', 'name': 'Orange Sky Golden Harvest', 'origin_country': 'HK'}]","[{'english_name': 'English', 'iso_639_1': 'en', 'name': 'English'}]",Released,The Turtles Are Back....In Time.,"The four turtles travel back in time to the days of the legendary and deadly samurai in ancient Japan, where they train to perfect the art of becoming one. The turtles also assist a small village in an uprising.",tt0108308,"[{'iso_3166_1': 'HK', 'name': 'Hong Kong'}, {'iso_3166_1': 'US', 'name': 'United States of America'}]",en
133601,2012-08-22,이웃사람,The Neighbors,0,0,110,15.717,7.268,84,False,,"[{'id': 53, 'name': 'Thriller'}, {'id': 9648, 'name': 'Mystery'}]","[{'id': 7819, 'logo_path': '/ghFZAt4edln0M7BzDExyYMzUGX1.png', 'name': 'Lotte Entertainment', 'origin_country': 'KR'}, {'id': 126495, 'logo_path': '/vnIkRuZSNTAL6l80dUPGY2yemiN.png', 'name': 'Mr. Romance', 'origin_country': 'KR'}, {'id': 119446, 'logo_path': '/OtKHwFyTlm5XUFMrWakECpve7T.png', 'name': 'kth', 'origin_country': 'KR'}, {'id': 217379, 'logo_path': '/v4PZUo7T5whDdBROII7QKObC4Lg.png', 'name': 'Zion Ent Inc.', 'origin_country': 'KR'}]","[{'english_name': 'Korean', 'iso_639_1': 'ko', 'name': '한국어/조선말'}]",Released,Watch who lives next door,"A serial killer murders a girl from his neighborhood. The residents begin to suspect him one by one, as he tries to cover his tracks and plans another kill before escape.",tt2195490,"[{'iso_3166_1': 'KR', 'name': 'South Korea'}]",ko
13056,2008-12-05,Punisher: War Zone,Punisher: War Zone,20500000,10089373,102,15.609,5.809,1135,False,"{'id': 635362, 'name': 'The Punisher Collection', 'poster_path': '/uirltOKTtjdxw3CUSMwbvxLl0o0.jpg', 'backdrop_path': '/wy3mGT2BxqNiBb3JV6lAQwOLrM5.jpg'}","[{'id': 28, 'name': 'Action'}, {'id': 80, 'name': 'Crime'}]","[{'id': 1632, 'logo_path': '/cisLn1YAUuptXVBa0xjq7ST9cH0.png', 'name': 'Lionsgate', 'origin_country': 'US'}, {'id': 8848, 'logo_path': None, 'name': 'MHF Zweite Academy Film', 'origin_country': 'DE'}, {'id': 11106, 'logo_path': '/gpUMd5Mvo79o2Twsj4JA9ZJGtaB.png', 'name': 'Marvel Knights', 'origin_country': 'US'}, {'id': 11533, 'logo_path': '/tWM9pmzVYxok4GbQIttxdcml1yT.png', 'name': 'Valhalla Motion Pictures', 'origin_country': 'US'}, {'id': 33808, 'logo_path': None, 'name': 'SGF Entertainment', 'origin_country': ''}, {'id': 6438, 'logo_path': '/hQVRii7CRnfG0rowSEc6ibt2Pke.png', 'name': 'Muse Entertainment', 'origin_country': 'CA'}, {'id': 420, 'logo_path': '/hUzeosd33nzE5MCNsZxCGEKTXaQ.png', 'name': 'Marvel Studios', 'origin_country': 'US'}]","[{'english_name': 'Russian', 'iso_639_1': 'ru', 'name': 'Pусский'}, {'english_name': 'English', 'iso_639_1': 'en', 'name': 'English'}]",Released,Vengeance has a name.,"Waging his one-man war on the world of organized crime, ruthless vigilante-hero Frank Castle sets his sights on overeager mob boss Billy Russoti. After Russoti is left horribly disfigured by Castle, he sets out for vengeance under his new alias: Jigsaw. With the ""Punisher Task Force"" hot on his trail and the FBI unable to take Jigsaw in, Frank must stand up to the formidable army that Jigsaw has recruited before more of his evil deeds go unpunished.",tt0450314,"[{'iso_3166_1': 'CA', 'name': 'Canada'}, {'iso_3166_1': 'DE', 'name': 'Germany'}, {'iso_3166_1': 'US', 'name': 'United States of America'}]",en
57331,2011-02-16,Largo Winch II,Largo Winch II,21200000,14400000,119,15.569,5.889,352,False,"{'id': 70764, 'name': 'Largo Winch Collection', 'poster_path': '/bpUPREscFpjllSnPR28UW6FdFEq.jpg', 'backdrop_path': '/9RbOJOG3qb9naM5sZDsRaUdNw5x.jpg'}","[{'id': 28, 'name': 'Action'}, {'id': 12, 'name': 'Adventure'}, {'id': 53, 'name': 'Thriller'}]","[{'id': 856, 'logo_path': '/3tfzS2CrX6Ntbu927XzHXEPDA6y.png', 'name': 'Wild Bunch', 'origin_country': 'FR'}, {'id': 356, 'logo_path': '/9tW5wZEGotn1Ei5pErA88m47XiD.png', 'name': 'TF1 Films Production', 'origin_country': 'FR'}, {'id': 6750, 'logo_path': None, 'name': 'Pan-Européenne', 'origin_country': 'FR'}, {'id': 9066, 'logo_path': None, 'name': 'Climax Films', 'origin_country': 'BE'}, {'id': 310, 'logo_path': '/4Gp5A4YdjPBfsHT47ngHMaXWmb9.png', 'name': 'CNC', 'origin_country': 'FR'}, {'id': 851, 'logo_path': '/kieSA3GFVysJcAUXNRer06u6e5x.png', 'name': 'MEDIA Programme of the European Union', 'origin_country': 'BE'}, {'id': 104, 'logo_path': '/9aotxauvc9685tq9pTcRJszuT06.png', 'name': 'Canal+', 'origin_country': 'FR'}, {'id': 14362, 'logo_path': None, 'name': 'October Pictures', 'origin_country': 'HK'}, {'id': 11924, 'logo_path': '/3uGsFGMUjLw52rvEllvs2txnJmn.png', 'name': 'Casa Kafka Pictures', 'origin_country': 'BE'}, {'id': 139617, 'logo_path': None, 'name': 'Araneo', 'origin_country': 'BE'}]","[{'english_name': 'French', 'iso_639_1': 'fr', 'name': 'Français'}, {'english_name': 'English', 'iso_639_1': 'en', 'name': 'English'}, {'english_name': 'Italian', 'iso_639_1': 'it', 'name': 'Italiano'}, {'english_name': 'Serbian', 'iso_639_1': 'sr', 'name': 'Srpski'}, {'english_name': 'Thai', 'iso_639_1': 'th', 'name': 'ภาษาไทย'}]",Released,The Burma Conspiracy,"Propelled to the head of the W Group after the death of his adoptive father, Largo Winch decides, to everyone's surprise, to sell it, and use the proceeds to create an ambitious humanitarian foundation. But on the very same day, he finds himself accused of crimes against humanity by a mysterious witness. To prove his innocence, Largo will have to retrace the steps of his past life, in the heart of the Burmese jungle.",tt1322333,"[{'iso_3166_1': 'BE', 'name': 'Belgium'}, {'iso_3166_1': 'FR', 'name': 'France'}, {'iso_3166_1': 'HK', 'name': 'Hong Kong'}]",fr
485942,2018-06-15,ニンジャバットマン,Batman Ninja,0,0,85,15.532,5.798,848,False,"{'id': 1313822, 'name': 'Batman Ninja Collection', 'poster_path': None, 'backdrop_path': None}","[{'id': 16, 'name': 'Animation'}, {'id': 28, 'name': 'Action'}, {'id': 878, 'name': 'Science Fiction'}]","[{'id': 93154, 'logo_path': '/vTNoVe4tBhY1hshuVVF7fA2RbSD.png', 'name': 'Kamikaze Douga', 'origin_country': 'JP'}, {'id': 9993, 'logo_path': '/2Tc1P3Ac8M479naPp1kYT3izLS5.png', 'name': 'DC Entertainment', 'origin_country': 'US'}, {'id': 3627, 'logo_path': '/pBfPYpzg5o3EoBPfrFKzTRi8MGr.png', 'name': 'Warner Bros. Japan', 'origin_country': 'JP'}]","[{'english_name': 'Japanese', 'iso_639_1': 'ja', 'name': '日本語'}]",Released,,"Batman, along with many of his allies and adversaries, finds himself transported to feudal Japan by Gorilla Grodd's time displacement machine.",tt7451284,"[{'iso_3166_1': 'JP', 'name': 'Japan'}, {'iso_3166_1': 'US', 'name': 'United States of America'}]",ja
897160,2023-10-25,용감한 시민,Brave Citizen,0,0,112,15.506,6.9,30,False,,"[{'id': 28, 'name': 'Action'}, {'id': 18, 'name': 'Drama'}, {'id': 35, 'name': 'Comedy'}]","[{'id': 119174, 'logo_path': '/hLiXjOBvOlEA0IdTveoR7MsZwbj.png', 'name': 'Studio N', 'origin_country': 'KR'}, {'id': 119754, 'logo_path': '/v8nvXqLkNmPKTE7JlSdJmGcnrK4.png', 'name': 'Oscar 10 Studio', 'origin_country': 'KR'}, {'id': 142745, 'logo_path': None, 'name': 'Vol Media', 'origin_country': 'KR'}]","[{'english_name': 'Korean', 'iso_639_1': 'ko', 'name': '한국어/조선말'}]",Released,Purring in the face of injustice,"An expelled boxing champion, who now is a high-school teacher, witnesses intolerable violence and throws her first punch to build justice against it, while putting on a mask.",tt22505214,"[{'iso_3166_1': 'KR', 'name': 'South Korea'}]",ko
997776,2023-04-25,"Justice League x RWBY: Super Heroes & Huntsmen, Part One","Justice League x RWBY: Super Heroes & Huntsmen, Part One",0,0,83,15.407,7.1,107,False,"{'id': 1150569, 'name': 'Justice League x RWBY Collection', 'poster_path': '/n85hUWYN0kzYITamBqsJSXoen0G.jpg', 'backdrop_path': '/umAKpJx87AcY9LqBFc5ZqCS3c1M.jpg'}","[{'id': 16, 'name': 'Animation'}, {'id': 28, 'name': 'Action'}, {'id': 14, 'name': 'Fantasy'}]","[{'id': 2785, 'logo_path': '/l5zW8jjmQOCx2dFmvnmbYmqoBmL.png', 'name': 'Warner Bros. Animation', 'origin_country': 'US'}, {'id': 9993, 'logo_path': '/2Tc1P3Ac8M479naPp1kYT3izLS5.png', 'name': 'DC Entertainment', 'origin_country': 'US'}]","[{'english_name': 'English', 'iso_639_1': 'en', 'name': 'English'}]",Released,,"Superman, Batman, Wonder Woman, Flash, Cyborg, Green Lantern and Vixen are transported to the strange world of Remnant and find themselves turned into teenagers. Meanwhile, Remnant heroes Ruby, Weiss, Blake and Yang must combine forces with the Justice League to uncover why their planet has been mysteriously altered before a superpowered Grimm destroys everything.",tt24548912,"[{'iso_3166_1': 'US', 'name': 'United States of America'}]",en
9431,1996-08-16,Bordello of Blood,Bordello of Blood,15000000,5600000,87,15.394,5.9,374,False,"{'id': 115142, 'name': 'Tales from the Crypt Collection', 'poster_path': '/1niIwqmQSB10CnHx6lv6S6cD4Qb.jpg', 'backdrop_path': '/ty4FEu6bNW28HlWAKKcfvBYfqeV.jpg'}","[{'id': 27, 'name': 'Horror'}, {'id': 35, 'name': 'Comedy'}]","[{'id': 33, 'logo_path': '/3wwjVpkZtnog6lSKzWDjvw2Yi00.png', 'name': 'Universal Pictures', 'origin_country': 'US'}, {'id': 69626, 'logo_path': '/k0Oe4lEoX4lffhChQgtnJp3bQi9.png', 'name': 'Tales From The Crypt Holdings', 'origin_country': ''}, {'id': 69625, 'logo_path': None, 'name': 'Universal City Studios', 'origin_country': ''}]","[{'english_name': 'English', 'iso_639_1': 'en', 'name': 'English'}, {'english_name': 'Spanish', 'iso_639_1': 'es', 'name': 'Español'}]",Released,Evil bites!,"Private eye Rafe Guttman is hired by repressed, born-again Katherine to find her missing bad-boy brother. The trail leads him to a whorehouse run by a thousand-year-old vampire and secretly backed by Katherine's boss, televangelist Jimmy Current.",tt0117826,"[{'iso_3166_1': 'US', 'name': 'United States of America'}]",en
15739,1982-05-21,Annie,Annie,35000000,57063861,127,15.355,6.5,695,False,"{'id': 312735, 'name': 'Annie Collection', 'poster_path': '/tRws7tGefgIy7pXWBiD6whrTAsh.jpg', 'backdrop_path': '/30HYJdFA59AIW1625BXdwpZW3hK.jpg'}","[{'id': 35, 'name': 'Comedy'}, {'id': 18, 'name': 'Drama'}, {'id': 10751, 'name': 'Family'}]","[{'id': 5, 'logo_path': '/71BqEFAF4V3qjjMPCpLuyJFB9A.png', 'name': 'Columbia Pictures', 'origin_country': 'US'}, {'id': 1177, 'logo_path': '/gxvrQWG6byKMVEHMjTJjGhRlARQ.png', 'name': 'Rastar Productions', 'origin_country': 'US'}]","[{'english_name': 'English', 'iso_639_1': 'en', 'name': 'English'}]",Released,The movie of 'Tomorrow',"An orphan in a facility run by the mean Miss Hannigan, Annie believes that her parents left her there by mistake. When a rich man named Oliver ""Daddy"" Warbucks decides to let an orphan live at his home to promote his image, Annie is selected. While Annie gets accustomed to living in Warbucks' mansion, she still longs to meet her parents. So Warbucks announces a search for them and a reward, which brings out many frauds.",tt0083564,"[{'iso_3166_1': 'US', 'name': 'United States of America'}]",en
484862,2018-01-31,Scooby-Doo! & Batman: The Brave and the Bold,Scooby-Doo! & Batman: The Brave and the Bold,0,0,76,15.35,7.2,241,False,,"[{'id': 16, 'name': 'Animation'}, {'id': 35, 'name': 'Comedy'}, {'id': 28, 'name': 'Action'}, {'id': 10751, 'name': 'Family'}, {'id': 878, 'name': 'Science Fiction'}]","[{'id': 1353, 'logo_path': '/yXhCcOFK5Fy3ZBQwhBYx8Zu9ZIw.png', 'name': 'Hanna-Barbera Productions', 'origin_country': 'US'}, {'id': 2785, 'logo_path': '/l5zW8jjmQOCx2dFmvnmbYmqoBmL.png', 'name': 'Warner Bros. Animation', 'origin_country': 'US'}, {'id': 9993, 'logo_path': '/2Tc1P3Ac8M479naPp1kYT3izLS5.png', 'name': 'DC Entertainment', 'origin_country': 'US'}]","[{'english_name': 'English', 'iso_639_1': 'en', 'name': 'English'}]",Released,"The brave, the bold and the hungry.",Scooby-Doo and the Mystery Inc. gang meet up with Batman and other friends to defeat evil villains and save the day.,tt7578566,"[{'iso_3166_1': 'US', 'name': 'United States of America'}]",en
65584,2006-07-24,Aquaman,Aquaman,0,0,42,15.319,6.0,32,False,,"[{'id': 28, 'name': 'Action'}, {'id': 12, 'name': 'Adventure'}, {'id': 10770, 'name': 'TV Movie'}]","[{'id': 1957, 'logo_path': '/pJJw98MtNFC9cHn3o15G7vaUnnX.png', 'name': 'Warner Bros. Television', 'origin_country': 'US'}]","[{'english_name': 'English', 'iso_639_1': 'en', 'name': 'English'}]",Released,,A young twenty-something diver living in the Florida Keys discovers he has the power to breathe underwater.,tt0498318,"[{'iso_3166_1': 'US', 'name': 'United States of America'}]",en
257346,2014-04-19,アベンジャーズ コンフィデンシャル：ブラック・ウィドウ ＆ パニッシャー,Avengers Confidential: Black Widow & Punisher,0,0,83,15.272,6.4,255,False,,"[{'id': 16, 'name': 'Animation'}, {'id': 878, 'name': 'Science Fiction'}, {'id': 28, 'name': 'Action'}]","[{'id': 82346, 'logo_path': '/jqgK6CSkPrEsIv6Nk390JaBcXYF.png', 'name': 'Sony Pictures', 'origin_country': 'JP'}, {'id': 3464, 'logo_path': '/9k0nr75nwnNeT2MHerf1OXJN0hj.png', 'name': 'Madhouse', 'origin_country': 'JP'}]","[{'english_name': 'Japanese', 'iso_639_1': 'ja', 'name': '日本語'}]",Released,Two legendary heroes. One unstoppable force.,"When the Punisher takes out a black-market weapons dealer, he stumbles upon a far-reaching terrorist plot devised by a group known as Leviathan.",tt3482378,"[{'iso_3166_1': 'JP', 'name': 'Japan'}]",ja
1150537,2023-10-17,"Justice League x RWBY: Super Heroes & Huntsmen, Part Two","Justice League x RWBY: Super Heroes & Huntsmen, Part Two",0,0,75,15.225,6.5,39,False,"{'id': 1150569, 'name': 'Justice League x RWBY Collection', 'poster_path': '/n85hUWYN0kzYITamBqsJSXoen0G.jpg', 'backdrop_path': '/umAKpJx87AcY9LqBFc5ZqCS3c1M.jpg'}","[{'id': 16, 'name': 'Animation'}, {'id': 28, 'name': 'Action'}, {'id': 14, 'name': 'Fantasy'}, {'id': 12, 'name': 'Adventure'}]","[{'id': 2785, 'logo_path': '/l5zW8jjmQOCx2dFmvnmbYmqoBmL.png', 'name': 'Warner Bros. Animation', 'origin_country': 'US'}, {'id': 9993, 'logo_path': '/2Tc1P3Ac8M479naPp1kYT3izLS5.png', 'name': 'DC Entertainment', 'origin_country': 'US'}]","[{'english_name': 'English', 'iso_639_1': 'en', 'name': 'English'}]",Released,,"On the heels of successfully escaping a deadly digital trap, the members of the Justice League emerge in their own world to discover that Grimm, ravenous creatures from Remnant, have overtaken Earth! In order to defeat the monsters, they must call on their new friends – Team RWBY – for help!",tt28786861,"[{'iso_3166_1': 'US', 'name': 'United States of America'}]",en
10249,1991-06-21,The Rocketeer,The Rocketeer,42000000,46704056,108,15.213,6.5,933,False,"{'id': 869156, 'name': 'The Rocketeer Collection', 'poster_path': '/xDHRPIejBUyTAFZ6jbEJPFx946e.jpg', 'backdrop_path': None}","[{'id': 28, 'name': 'Action'}, {'id': 12, 'name': 'Adventure'}, {'id': 878, 'name': 'Science Fiction'}, {'id': 10751, 'name': 'Family'}]","[{'id': 2, 'logo_path': '/wdrCwmRnLFJhEoH8GSfymY85KHT.png', 'name': 'Walt Disney Pictures', 'origin_country': 'US'}, {'id': 1073, 'logo_path': None, 'name': 'Gordon Company', 'origin_country': 'US'}, {'id': 552, 'logo_path': '/9dGdLfm3GteWeUDtD9c9tvlidUG.png', 'name': 'Dark Horse Entertainment', 'origin_country': 'US'}, {'id': 10282, 'logo_path': None, 'name': 'Silver Screen Partners IV', 'origin_country': 'US'}]","[{'english_name': 'English', 'iso_639_1': 'en', 'name': 'English'}]",Released,An Ordinary Man Forced to Become An Extraordinary Hero.,"A stunt pilot comes across a prototype jetpack that gives him the ability to fly. However, evil forces of the world also want this jetpack at any cost.",tt0102803,"[{'iso_3166_1': 'US', 'name': 'United States of America'}]",en
