id,release_date,original_title,title,budget,revenue,runtime,popularity,vote_average,vote_count,adult,belongs_to_collection,genres,production_companies,spoken_languages,status,tagline,overview,imdb_id,production_countries,original_language
545609,2020-04-23,Extraction,Extraction,65000000,0,116,52.689,7.323,6043,False,"{'id': 735127, 'name': 'Extraction Collection', 'poster_path': '/npMSYY9x9zy5iWZSffkUO78fVeg.jpg', 'backdrop_path': '/gxBbFVb2SUWtHTJQXjwAtEPTWcA.jpg'}","[{'id': 28, 'name': 'Action'}, {'id': 53, 'name': 'Thriller'}]","[{'id': 106544, 'logo_path': '/psd84iF7PTGrKf4yFOStKj8JbAh.png', 'name': 'AGBO', 'origin_country': 'US'}, {'id': 109172, 'logo_path': None, 'name': 'Thematic Entertainment', 'origin_country': 'US'}, {'id': 92029, 'logo_path': None, 'name': 'TGIM Films', 'origin_country': 'US'}]","[{'english_name': 'Bengali', 'iso_639_1': 'bn', 'name': 'বাংলা'}, {'english_name': 'English', 'iso_639_1': 'en', 'name': 'English'}, {'english_name': 'Hindi', 'iso_639_1': 'hi', 'name': 'हिन्दी'}]",Released,"When the mission ends, redemption begins",A hardened gun-for-hire's latest mission becomes a soul-searching race to survive when he's sent into Bangladesh to rescue a drug lord's kidnapped son.,tt8936646,"[{'iso_3166_1': 'US', 'name': 'United States of America'}]",en
9495,1994-05-11,The Crow,The Crow,23000000,93722164,102,50.922,7.5,4072,False,"{'id': 9436, 'name': 'The Crow Collection', 'poster_path': '/kfU8OZptlBfR5DL9LNGL301Zmlz.jpg', 'backdrop_path': '/xxJs7xqY0vMuNlznQboBzq8RlZm.jpg'}","[{'id': 14, 'name': 'Fantasy'}, {'id': 28, 'name': 'Action'}, {'id': 53, 'name': 'Thriller'}]","[{'id': 4029, 'logo_path': None, 'name': 'Entertainment Media Investment Corporation', 'origin_country': ''}, {'id': 4030, 'logo_path': None, 'name': 'Jeff Most Productions', 'origin_country': 'US'}, {'id': 6455, 'logo_path': '/mc3rMk0tW5ajjbfqkB8xlp85Cdy.png', 'name': 'Pressman Film', 'origin_country': 'US'}, {'id': 14, 'logo_path': '/m6AHu84oZQxvq7n1rsvMNJIAsMu.png', 'name': 'Miramax', 'origin_country': 'US'}]","[{'english_name': 'English', 'iso_639_1': 'en', 'name': 'English'}]",Released,Believe in angels.,"Exactly one year after young rock guitarist Eric Draven and his fiancée are brutally killed by a ruthless gang of criminals, Draven—watched over by a hypnotic crow—returns from the grave to exact revenge.",tt0109506,"[{'iso_3166_1': 'GB', 'name': 'United Kingdom'}, {'iso_3166_1': 'US', 'name': 'United States of America'}]",en
1271,2007-03-07,300,300,65000000,456082343,116,50.207,7.189,13669,False,"{'id': 125570, 'name': '300 Collection', 'poster_path': '/15c4BOYE7gJn1jTN1VxA9KBjcnq.jpg', 'backdrop_path': '/jeyZp2BKvAyl0L6LV3z13duoUFz.jpg'}","[{'id': 28, 'name': 'Action'}, {'id': 12, 'name': 'Adventure'}, {'id': 10752, 'name': 'War'}]","[{'id': 449, 'logo_path': '/fV3x8bowlRCXKtkWDovLYco7cOK.png', 'name': 'Virtual Studios', 'origin_country': 'US'}, {'id': 923, 'logo_path': '/8M99Dkt23MjQMTTWukq4m5XsEuo.png', 'name': 'Legendary Pictures', 'origin_country': 'US'}, {'id': 2994, 'logo_path': '/jg4nWIIjQ49APUHqTWZ09gArhF8.png', 'name': 'Hollywood Gang Productions', 'origin_country': 'US'}, {'id': 2995, 'logo_path': '/drzD5Yq9aQuDEbNxlTAhmlL2izx.png', 'name': 'Atmosphere Entertainment MM', 'origin_country': 'US'}, {'id': 7636, 'logo_path': '/e6uCvCNTf0nnery1iaQh6QSgpbn.png', 'name': 'Nimar Studios', 'origin_country': 'BG'}, {'id': 174, 'logo_path': '/zhD3hhtKB5qyv7ZeL4uLpNxgMVU.png', 'name': 'Warner Bros. Pictures', 'origin_country': 'US'}, {'id': 9995, 'logo_path': '/mAIGhOYhN4N2N0F7p4dbKhgXf3l.png', 'name': 'Cruel & Unusual Films', 'origin_country': 'US'}]","[{'english_name': 'English', 'iso_639_1': 'en', 'name': 'English'}]",Released,Prepare for glory!,"Based on Frank Miller's graphic novel, ""300"" is very loosely based the 480 B.C. Battle of Thermopylae, where the King of Sparta led his army against the advancing Persians; the battle is said to have inspired all of Greece to band together against the Persians, and helped usher in the world's first democracy.",tt0416449,"[{'iso_3166_1': 'GB', 'name': 'United Kingdom'}, {'iso_3166_1': 'US', 'name': 'United States of America'}]",en
184315,2014-07-23,Hercules,Hercules,100000000,244819862,98,50.086,5.781,4053,False,,"[{'id': 28, 'name': 'Action'}, {'id': 12, 'name': 'Adventure'}]","[{'id': 4, 'logo_path': '/gz66EfNoYPqHTYI4q9UEN4CbHRc.png', 'name': 'Paramount Pictures', 'origin_country': 'US'}, {'id': 19648, 'logo_path': None, 'name': 'Radical Studios', 'origin_country': 'US'}, {'id': 34081, 'logo_path': None, 'name': 'Flynn Picture Company', 'origin_country': 'US'}, {'id': 21, 'logo_path': '/usUnaYV6hQnlVAXP6r4HwrlLFPG.png', 'name': 'Metro-Goldwyn-Mayer', 'origin_country': 'US'}]","[{'english_name': 'English', 'iso_639_1': 'en', 'name': 'English'}]",Released,"Before he was a legend, he was a man.","When a new enemy threatens the innocent, Hercules must lead his fearless team of warriors in a battle against overwhelming odds.",tt1267297,"[{'iso_3166_1': 'US', 'name': 'United States of America'}]",en
20533,2010-06-18,Jonah Hex,Jonah Hex,47000000,10539000,82,50.067,4.93,1419,False,,"[{'id': 28, 'name': 'Action'}, {'id': 37, 'name': 'Western'}, {'id': 18, 'name': 'Drama'}, {'id': 14, 'name': 'Fantasy'}, {'id': 53, 'name': 'Thriller'}]","[{'id': 174, 'logo_path': '/zhD3hhtKB5qyv7ZeL4uLpNxgMVU.png', 'name': 'Warner Bros. Pictures', 'origin_country': 'US'}, {'id': 923, 'logo_path': '/8M99Dkt23MjQMTTWukq4m5XsEuo.png', 'name': 'Legendary Pictures', 'origin_country': 'US'}, {'id': 433, 'logo_path': '/iafkKMpcRfEXq9a4sQf0h6tg2E2.png', 'name': 'Weed Road Pictures', 'origin_country': 'US'}, {'id': 1757, 'logo_path': '/fc9qw5GoTbyWGa0QcfbsZFzuMKQ.png', 'name': 'Mad Chance', 'origin_country': 'US'}, {'id': 429, 'logo_path': '/2Tc1P3Ac8M479naPp1kYT3izLS5.png', 'name': 'DC', 'origin_country': 'US'}]","[{'english_name': 'English', 'iso_639_1': 'en', 'name': 'English'}]",Released,Revenge gets ugly.,"Gunslinger Jonah Hex is appointed by President Ulysses Grant to track down terrorist Quentin Turnbull, a former Confederate officer determined on unleashing hell on earth. Jonah not only secures freedom by accepting this task, he also gets revenge on the man who slayed his wife and child.",tt1075747,"[{'iso_3166_1': 'US', 'name': 'United States of America'}]",en
34813,2010-04-23,The Losers,The Losers,25000000,23580000,97,49.255,6.267,1804,False,,"[{'id': 28, 'name': 'Action'}, {'id': 12, 'name': 'Adventure'}, {'id': 80, 'name': 'Crime'}, {'id': 9648, 'name': 'Mystery'}, {'id': 53, 'name': 'Thriller'}]","[{'id': 1786, 'logo_path': '/joLFuCWg9e2lweYnFQtRPJKSLlI.png', 'name': 'Dark Castle Entertainment', 'origin_country': 'US'}, {'id': 433, 'logo_path': '/iafkKMpcRfEXq9a4sQf0h6tg2E2.png', 'name': 'Weed Road Pictures', 'origin_country': 'US'}, {'id': 174, 'logo_path': '/zhD3hhtKB5qyv7ZeL4uLpNxgMVU.png', 'name': 'Warner Bros. Pictures', 'origin_country': 'US'}, {'id': 165407, 'logo_path': '/5fnvtywvYSkskSJr99VcR3x9RTE.png', 'name': 'DC Vertigo', 'origin_country': 'US'}]","[{'english_name': 'English', 'iso_639_1': 'en', 'name': 'English'}]",Released,Anyone else would be dead by now.,"On a mission deep in the Bolivian jungle, a team of elite commandos finds itself on the receiving end of a lethal betrayal. Now presumed dead, the men join forces with a mysterious operative named Aisha to hunt down their enemy and even the score.",tt0480255,"[{'iso_3166_1': 'US', 'name': 'United States of America'}]",en
524434,2021-11-03,Eternals,Eternals,200000000,402064899,156,48.806,6.849,8272,False,,"[{'id': 878, 'name': 'Science Fiction'}, {'id': 28, 'name': 'Action'}, {'id': 12, 'name': 'Adventure'}]","[{'id': 420, 'logo_path': '/hUzeosd33nzE5MCNsZxCGEKTXaQ.png', 'name': 'Marvel Studios', 'origin_country': 'US'}]","[{'english_name': 'Arabic', 'iso_639_1': 'ar', 'name': 'العربية'}, {'english_name': 'English', 'iso_639_1': 'en', 'name': 'English'}, {'english_name': 'Hindi', 'iso_639_1': 'hi', 'name': 'हिन्दी'}, {'english_name': 'Latin', 'iso_639_1': 'la', 'name': 'Latin'}, {'english_name': 'Spanish', 'iso_639_1': 'es', 'name': 'Español'}]",Released,In the beginning...,"The Eternals are a team of ancient aliens who have been living on Earth in secret for thousands of years. When an unexpected tragedy forces them out of the shadows, they are forced to reunite against mankind’s most ancient enemy, the Deviants.",tt9032400,"[{'iso_3166_1': 'US', 'name': 'United States of America'}]",en
127585,2014-05-15,X-Men: Days of Future Past,X-Men: Days of Future Past,250000000,747862775,132,48.416,7.531,15267,False,"{'id': 748, 'name': 'X-Men Collection', 'poster_path': '/31rqs6ZxFdi5nWZZaFPIr17q8jt.jpg', 'backdrop_path': '/2jMXECTRYfs0EZWJgDzlcH6MmBQ.jpg'}","[{'id': 28, 'name': 'Action'}, {'id': 12, 'name': 'Adventure'}, {'id': 878, 'name': 'Science Fiction'}]","[{'id': 9168, 'logo_path': '/hQNXrYIuyLRxMSBuGHk0GX7CCBS.png', 'name': 'Bad Hat Harry Productions', 'origin_country': 'US'}, {'id': 431, 'logo_path': '/6dcR1MbRqYgt3jUVYxkHe68GFnZ.png', 'name': ""The Donners' Company"", 'origin_country': 'US'}, {'id': 25, 'logo_path': '/qZCc1lty5FzX30aOCVRBLzaVmcp.png', 'name': '20th Century Fox', 'origin_country': 'US'}, {'id': 7505, 'logo_path': '/837VMM4wOkODc1idNxGT0KQJlej.png', 'name': 'Marvel Entertainment', 'origin_country': 'US'}, {'id': 22213, 'logo_path': '/qx9K6bFWJupwde0xQDwOvXkOaL8.png', 'name': 'TSG Entertainment', 'origin_country': 'US'}, {'id': 28788, 'logo_path': '/Aqomtf9oh5dKtxBNEagkdlp3aGv.png', 'name': 'Genre Films', 'origin_country': 'US'}]","[{'english_name': 'English', 'iso_639_1': 'en', 'name': 'English'}, {'english_name': 'French', 'iso_639_1': 'fr', 'name': 'Français'}, {'english_name': 'Russian', 'iso_639_1': 'ru', 'name': 'Pусский'}, {'english_name': 'Vietnamese', 'iso_639_1': 'vi', 'name': 'Tiếng Việt'}]",Released,"To save the future, they must alter the past.",The ultimate X-Men ensemble fights a war for the survival of the species across two time periods as they join forces with their younger selves in an epic battle that must change the past – to save our future.,tt1877832,"[{'iso_3166_1': 'US', 'name': 'United States of America'}]",en
644124,2022-10-28,Dampyr,Dampyr,15000000,362113,109,47.433,6.3,145,False,,"[{'id': 27, 'name': 'Horror'}, {'id': 14, 'name': 'Fantasy'}, {'id': 28, 'name': 'Action'}]","[{'id': 56151, 'logo_path': None, 'name': 'Sergio Bonelli Editore', 'origin_country': ''}, {'id': 10400, 'logo_path': '/9LlB2YAwXTkUAhx0pItSo6pDlkB.png', 'name': 'Eagle Pictures', 'origin_country': 'IT'}, {'id': 124732, 'logo_path': None, 'name': 'Brandon Box', 'origin_country': 'IT'}]","[{'english_name': 'English', 'iso_639_1': 'en', 'name': 'English'}]",Released,"Shall a vampire unite with a human woman, she will give birth to a...","In war-torn Balkans, bogus monster hunter Harlan Draka is hired by soldiers who happen to be under attack by an army of actual vampires, uncovering the hidden truth about his past in the process: he is half-human and half-vampire... a Dampyr.",tt10315050,"[{'iso_3166_1': 'IT', 'name': 'Italy'}]",it
53182,2014-03-05,300: Rise of an Empire,300: Rise of an Empire,110000000,337580051,102,47.258,6.114,6484,False,"{'id': 125570, 'name': '300 Collection', 'poster_path': '/15c4BOYE7gJn1jTN1VxA9KBjcnq.jpg', 'backdrop_path': '/jeyZp2BKvAyl0L6LV3z13duoUFz.jpg'}","[{'id': 28, 'name': 'Action'}, {'id': 18, 'name': 'Drama'}, {'id': 10752, 'name': 'War'}]","[{'id': 923, 'logo_path': '/8M99Dkt23MjQMTTWukq4m5XsEuo.png', 'name': 'Legendary Pictures', 'origin_country': 'US'}, {'id': 2994, 'logo_path': '/jg4nWIIjQ49APUHqTWZ09gArhF8.png', 'name': 'Hollywood Gang Productions', 'origin_country': 'US'}, {'id': 2995, 'logo_path': '/drzD5Yq9aQuDEbNxlTAhmlL2izx.png', 'name': 'Atmosphere Entertainment MM', 'origin_country': 'US'}, {'id': 7636, 'logo_path': '/e6uCvCNTf0nnery1iaQh6QSgpbn.png', 'name': 'Nimar Studios', 'origin_country': 'BG'}, {'id': 174, 'logo_path': '/zhD3hhtKB5qyv7ZeL4uLpNxgMVU.png', 'name': 'Warner Bros. Pictures', 'origin_country': 'US'}, {'id': 9995, 'logo_path': '/mAIGhOYhN4N2N0F7p4dbKhgXf3l.png', 'name': 'Cruel & Unusual Films', 'origin_country': 'US'}]","[{'english_name': 'English', 'iso_639_1': 'en', 'name': 'English'}]",Released,Seize your glory!,"Greek general Themistocles attempts to unite all of Greece by leading the charge that will change the course of the war. Themistocles faces the massive invading Persian forces led by mortal-turned-god, Xerxes and Artemesia, the vengeful commander of the Persian navy.",tt1253863,"[{'iso_3166_1': 'BG', 'name': 'Bulgaria'}, {'iso_3166_1': 'US', 'name': 'United States of America'}]",en
607,1997-07-02,Men in Black,Men in Black,90000000,589400000,98,47.079,7.202,13723,False,"{'id': 86055, 'name': 'Men In Black Collection', 'poster_path': '/neo50PMS8QZhl4VdzXAF1Cz3sPz.jpg', 'backdrop_path': '/xKz6YaOvmnIJQ3MYIpnaa7FBaAB.jpg'}","[{'id': 28, 'name': 'Action'}, {'id': 12, 'name': 'Adventure'}, {'id': 35, 'name': 'Comedy'}, {'id': 878, 'name': 'Science Fiction'}]","[{'id': 5, 'logo_path': '/71BqEFAF4V3qjjMPCpLuyJFB9A.png', 'name': 'Columbia Pictures', 'origin_country': 'US'}, {'id': 56, 'logo_path': '/cEaxANEisCqeEoRvODv2dO1I0iI.png', 'name': 'Amblin Entertainment', 'origin_country': 'US'}, {'id': 384, 'logo_path': None, 'name': 'MacDonald/Parkes Productions', 'origin_country': ''}]","[{'english_name': 'English', 'iso_639_1': 'en', 'name': 'English'}, {'english_name': 'Spanish', 'iso_639_1': 'es', 'name': 'Español'}]",Released,Protecting the Earth from the scum of the universe.,"After a police chase with an otherworldly being, a New York City cop is recruited as an agent in a top-secret organization established to monitor and police alien activity on Earth: the Men in Black. Agent K and new recruit Agent J find themselves in the middle of a deadly plot by an intergalactic terrorist who has arrived on Earth to assassinate two ambassadors from opposing galaxies.",tt0119654,"[{'iso_3166_1': 'US', 'name': 'United States of America'}]",en
456740,2019-04-10,Hellboy,Hellboy,50000000,55065289,120,46.03,5.6,3425,False,,"[{'id': 14, 'name': 'Fantasy'}, {'id': 27, 'name': 'Horror'}, {'id': 28, 'name': 'Action'}, {'id': 12, 'name': 'Adventure'}]","[{'id': 48738, 'logo_path': None, 'name': 'Campbell Grobman Films', 'origin_country': 'US'}, {'id': 552, 'logo_path': '/9dGdLfm3GteWeUDtD9c9tvlidUG.png', 'name': 'Dark Horse Entertainment', 'origin_country': 'US'}, {'id': 1020, 'logo_path': '/kuUIHNwMec4dwOLghDhhZJzHZTd.png', 'name': 'Millennium Media', 'origin_country': 'US'}, {'id': 120256, 'logo_path': None, 'name': 'Boyana Film Studios', 'origin_country': 'BG'}, {'id': 840, 'logo_path': None, 'name': 'Lawrence Gordon Productions', 'origin_country': 'US'}, {'id': 214913, 'logo_path': None, 'name': 'Lloyd Levin Productions', 'origin_country': ''}, {'id': 342, 'logo_path': '/kZ99mxyNvNgyAFjm7rcl9vfYmU8.png', 'name': 'Davis Films', 'origin_country': 'FR'}]","[{'english_name': 'English', 'iso_639_1': 'en', 'name': 'English'}, {'english_name': 'German', 'iso_639_1': 'de', 'name': 'Deutsch'}, {'english_name': 'Russian', 'iso_639_1': 'ru', 'name': 'Pусский'}, {'english_name': 'Turkish', 'iso_639_1': 'tr', 'name': 'Türkçe'}]",Released,Demons have demons too,"Hellboy comes to England, where he must defeat Nimue, Merlin's consort and the Blood Queen. But their battle will bring about the end of the world, a fate he desperately tries to turn away.",tt2274648,"[{'iso_3166_1': 'BG', 'name': 'Bulgaria'}, {'iso_3166_1': 'US', 'name': 'United States of America'}]",en
320288,2019-06-05,Dark Phoenix,Dark Phoenix,200000000,252442974,114,45.405,5.981,6511,False,"{'id': 748, 'name': 'X-Men Collection', 'poster_path': '/31rqs6ZxFdi5nWZZaFPIr17q8jt.jpg', 'backdrop_path': '/2jMXECTRYfs0EZWJgDzlcH6MmBQ.jpg'}","[{'id': 878, 'name': 'Science Fiction'}, {'id': 28, 'name': 'Action'}, {'id': 12, 'name': 'Adventure'}]","[{'id': 28788, 'logo_path': '/Aqomtf9oh5dKtxBNEagkdlp3aGv.png', 'name': 'Genre Films', 'origin_country': 'US'}, {'id': 91797, 'logo_path': None, 'name': 'Hutch Parker Entertainment', 'origin_country': 'US'}, {'id': 25, 'logo_path': '/qZCc1lty5FzX30aOCVRBLzaVmcp.png', 'name': '20th Century Fox', 'origin_country': 'US'}, {'id': 22213, 'logo_path': '/qx9K6bFWJupwde0xQDwOvXkOaL8.png', 'name': 'TSG Entertainment', 'origin_country': 'US'}, {'id': 7505, 'logo_path': '/837VMM4wOkODc1idNxGT0KQJlej.png', 'name': 'Marvel Entertainment', 'origin_country': 'US'}]","[{'english_name': 'English', 'iso_639_1': 'en', 'name': 'English'}, {'english_name': 'Portuguese', 'iso_639_1': 'pt', 'name': 'Português'}, {'english_name': 'Russian', 'iso_639_1': 'ru', 'name': 'Pусский'}]",Released,A Phoenix will rise. The X-Men will fall.,"The X-Men face their most formidable and powerful foe when one of their own, Jean Grey, starts to spiral out of control. During a rescue mission in outer space, Jean is nearly killed when she's hit by a mysterious cosmic force. Once she returns home, this force not only makes her infinitely more powerful, but far more unstable. The X-Men must now band together to save her soul and battle aliens that want to use Grey's new abilities to rule the galaxy.",tt6565702,"[{'iso_3166_1': 'US', 'name': 'United States of America'}]",en
49521,2013-06-12,Man of Steel,Man of Steel,225000000,668045518,143,45.167,6.6,15094,False,"{'id': 209131, 'name': 'Man of Steel Collection', 'poster_path': '/rNnIW6xSPeTiIUtsfEhFeIRiJVv.jpg', 'backdrop_path': '/rPaqhsSMCky0UXVW4qmNOJq5Orp.jpg'}","[{'id': 28, 'name': 'Action'}, {'id': 12, 'name': 'Adventure'}, {'id': 878, 'name': 'Science Fiction'}]","[{'id': 9993, 'logo_path': '/2Tc1P3Ac8M479naPp1kYT3izLS5.png', 'name': 'DC Entertainment', 'origin_country': 'US'}, {'id': 9996, 'logo_path': '/3tvBqYsBhxWeHlu62SIJ1el93O7.png', 'name': 'Syncopy', 'origin_country': 'GB'}, {'id': 16774, 'logo_path': '/uD6Ls0FSJwo13ekpz91s1TRpkGq.png', 'name': 'Peters Entertainment', 'origin_country': 'US'}, {'id': 174, 'logo_path': '/zhD3hhtKB5qyv7ZeL4uLpNxgMVU.png', 'name': 'Warner Bros. Pictures', 'origin_country': 'US'}]","[{'english_name': 'English', 'iso_639_1': 'en', 'name': 'English'}]",Released,You will believe that a man can fly.,"A young boy learns that he has extraordinary powers and is not of this earth. As a young man, he journeys to discover where he came from and what he was sent here to do. But the hero in him must emerge if he is to save the world from annihilation and become the symbol of hope for all mankind.",tt0770828,"[{'iso_3166_1': 'GB', 'name': 'United Kingdom'}, {'iso_3166_1': 'US', 'name': 'United States of America'}]",en
526896,2022-03-30,Morbius,Morbius,75000000,167635712,105,44.891,5.997,4309,False,,"[{'id': 28, 'name': 'Action'}, {'id': 878, 'name': 'Science Fiction'}, {'id': 14, 'name': 'Fantasy'}]","[{'id': 5, 'logo_path': '/71BqEFAF4V3qjjMPCpLuyJFB9A.png', 'name': 'Columbia Pictures', 'origin_country': 'US'}, {'id': 53462, 'logo_path': '/nx8B3Phlcse02w86RW4CJqzCnfL.png', 'name': 'Matt Tolmach Productions', 'origin_country': 'US'}, {'id': 14439, 'logo_path': None, 'name': 'Arad Productions', 'origin_country': 'US'}]","[{'english_name': 'English', 'iso_639_1': 'en', 'name': 'English'}, {'english_name': 'Greek', 'iso_639_1': 'el', 'name': 'ελληνικά'}, {'english_name': 'Norwegian', 'iso_639_1': 'no', 'name': 'Norsk'}, {'english_name': 'Spanish', 'iso_639_1': 'es', 'name': 'Español'}]",Released,A new Marvel legend arrives.,"Dangerously ill with a rare blood disorder, and determined to save others suffering his same fate, Dr. Michael Morbius attempts a desperate gamble. What at first appears to be a radical success soon reveals itself to be a remedy potentially worse than the disease.",tt5108870,"[{'iso_3166_1': 'US', 'name': 'United States of America'}]",en
366924,2016-01-19,Batman: Bad Blood,Batman: Bad Blood,3500000,0,72,44.071,7.0,896,False,"{'id': 334996, 'name': 'Son of Batman Collection', 'poster_path': '/ze3Wnhbom7T37orabHMIiEGtoYF.jpg', 'backdrop_path': '/sVvEkTNx6SjwOb80iyURe5KHtcD.jpg'}","[{'id': 878, 'name': 'Science Fiction'}, {'id': 28, 'name': 'Action'}, {'id': 16, 'name': 'Animation'}]","[{'id': 2785, 'logo_path': '/l5zW8jjmQOCx2dFmvnmbYmqoBmL.png', 'name': 'Warner Bros. Animation', 'origin_country': 'US'}, {'id': 9993, 'logo_path': '/2Tc1P3Ac8M479naPp1kYT3izLS5.png', 'name': 'DC Entertainment', 'origin_country': 'US'}]","[{'english_name': 'English', 'iso_639_1': 'en', 'name': 'English'}]",Released,Justice runs in the family,"Bruce Wayne is missing. Alfred covers for him while Nightwing and Robin patrol Gotham City in his stead and a new player, Batwoman, investigates Batman's disappearance.",tt4870838,"[{'iso_3166_1': 'US', 'name': 'United States of America'}]",en
495764,2020-02-05,Birds of Prey (and the Fantabulous Emancipation of One Harley Quinn),Birds of Prey (and the Fantabulous Emancipation of One Harley Quinn),75000000,205537933,109,43.663,6.917,10240,False,,"[{'id': 28, 'name': 'Action'}, {'id': 80, 'name': 'Crime'}]","[{'id': 174, 'logo_path': '/zhD3hhtKB5qyv7ZeL4uLpNxgMVU.png', 'name': 'Warner Bros. Pictures', 'origin_country': 'US'}, {'id': 128064, 'logo_path': '/13F3Jf7EFAcREU0xzZqJnVnyGXu.png', 'name': 'DC Films', 'origin_country': 'US'}, {'id': 82968, 'logo_path': '/gRROMOG5bpF6TIDMbfaa5gnFFzl.png', 'name': 'LuckyChap Entertainment', 'origin_country': 'US'}, {'id': 101831, 'logo_path': '/l6x0SkRVp9ksGgRhboZbkI9w7PM.png', 'name': 'Clubhouse Pictures', 'origin_country': 'US'}, {'id': 103462, 'logo_path': None, 'name': 'Kroll & Co Entertainment', 'origin_country': 'US'}]","[{'english_name': 'English', 'iso_639_1': 'en', 'name': 'English'}]",Released,Mind Over Mayhem,"Harley Quinn joins forces with a singer, an assassin and a police detective to help a young girl who had a hit placed on her after she stole a rare diamond from a crime lord.",tt7713068,"[{'iso_3166_1': 'US', 'name': 'United States of America'}]",en
68735,2016-05-25,Warcraft,Warcraft,160000000,433677183,123,43.442,6.381,6763,False,,"[{'id': 28, 'name': 'Action'}, {'id': 12, 'name': 'Adventure'}, {'id': 14, 'name': 'Fantasy'}]","[{'id': 923, 'logo_path': '/8M99Dkt23MjQMTTWukq4m5XsEuo.png', 'name': 'Legendary Pictures', 'origin_country': 'US'}, {'id': 33, 'logo_path': '/3wwjVpkZtnog6lSKzWDjvw2Yi00.png', 'name': 'Universal Pictures', 'origin_country': 'US'}, {'id': 507, 'logo_path': '/aRmHe6GWxYMRCQljF75rn2B9Gv8.png', 'name': 'Atlas Entertainment', 'origin_country': 'US'}, {'id': 16028, 'logo_path': '/6hZcvVaJlKpDLy0iMKXuvC0K2A5.png', 'name': 'Blizzard Entertainment', 'origin_country': 'US'}, {'id': 81620, 'logo_path': '/7LkIVuWBVScdujpKhBPx1TMnPQE.png', 'name': 'Tencent Pictures', 'origin_country': 'CN'}, {'id': 3341, 'logo_path': '/dTG5dXE1kU2mpmL9BNnraffckLU.png', 'name': 'Fuji Television Network', 'origin_country': 'JP'}, {'id': 1778, 'logo_path': '/b5rT6VbYza3LyfltCmz1OcqzWJM.png', 'name': 'dentsu', 'origin_country': 'JP'}, {'id': 3393, 'logo_path': None, 'name': 'Huayi Brothers Pictures', 'origin_country': 'CN'}, {'id': 73437, 'logo_path': None, 'name': 'Taihe Entertainment', 'origin_country': 'CN'}, {'id': 14714, 'logo_path': '/dSHaVKtBCpMU5VP9wMbTkqov62i.png', 'name': 'China Film Group Corporation', 'origin_country': 'CN'}]","[{'english_name': 'English', 'iso_639_1': 'en', 'name': 'English'}]",Released,Two worlds. One home.,"The peaceful realm of Azeroth stands on the brink of war as its civilization faces a fearsome race of invaders: orc warriors fleeing their dying home to colonize another. As a portal opens to connect the two worlds, one army faces destruction and the other faces extinction. From opposing sides, two heroes are set on a collision course that will decide the fate of their family, their people, and their home.",tt0803096,"[{'iso_3166_1': 'CA', 'name': 'Canada'}, {'iso_3166_1': 'CN', 'name': 'China'}, {'iso_3166_1': 'JP', 'name': 'Japan'}, {'iso_3166_1': 'US', 'name': 'United States of America'}]",en
9480,2003-02-14,Daredevil,Daredevil,78000000,179179718,103,43.326,5.267,5054,False,,"[{'id': 14, 'name': 'Fantasy'}, {'id': 28, 'name': 'Action'}]","[{'id': 19551, 'logo_path': '/2WpWp9b108hizjHKdA107hFmvQ5.png', 'name': 'Marvel Enterprises', 'origin_country': 'US'}, {'id': 10104, 'logo_path': '/wRn5HnYMGeJHmItRypgOZOC6gwY.png', 'name': 'New Regency Pictures', 'origin_country': 'US'}, {'id': 1171, 'logo_path': '/wp7NwsxxHT8sqPaek6SlxnXlkP4.png', 'name': 'Epsilon Motion Pictures', 'origin_country': 'CH'}, {'id': 508, 'logo_path': '/7cxRWzi4LsVm4Utfpr1hfARNurT.png', 'name': 'Regency Enterprises', 'origin_country': 'US'}, {'id': 25, 'logo_path': '/qZCc1lty5FzX30aOCVRBLzaVmcp.png', 'name': '20th Century Fox', 'origin_country': 'US'}]","[{'english_name': 'English', 'iso_639_1': 'en', 'name': 'English'}, {'english_name': 'Italian', 'iso_639_1': 'it', 'name': 'Italiano'}, {'english_name': 'Greek', 'iso_639_1': 'el', 'name': 'ελληνικά'}]",Released,"When the streets have gone to Hell, have faith in the devil.",A man blinded in a childhood accident fights crime using his superhumanly-elevated remaining senses.,tt0287978,"[{'iso_3166_1': 'CH', 'name': 'Switzerland'}, {'iso_3166_1': 'US', 'name': 'United States of America'}]",en
